Sheet: Work items
A1: Aufgabe | B1: Typ (I=implementierung, R=recherche, T=testing, B=Bugfixing) | C1: Start date | D1: End date | E1: Arbeitsaufwand [Tage] | F1: Sum Commits | G1: of:=SUM([.E2:.E50]) -> 70
A2: I_Na | B2: Implementation | C2: 2019-11-01 | D2: 2019-11-02 | E2: 2
A3: I_Na | B3: Bugfixing | C3: 2020-02-05 | D3: 2020-02-11 | E3: 4
A4: I_Na | B4: Testing | C4: 2019-11-03 | D4: 2020-02-05 | E4: 4
A5: I_K1 | B5: Implementation | C5: 2020-02-15 | D5: 2020-02-15 | E5: 1
A6: I_K1 | B6: Testing | C6: 2020-02-16 | D6: 2020-02-17 | E6: 3
A7: I_Ca,L | B7: Implementation | C7: 2020-02-18 | D7: 2020-02-18 | E7: 0.2
A8: I_to | B8: Implementation | C8: 2020-02-18 | D8: 2020-02-18 | E8: 0.2
A9: I_K,r | B9: Implementation | C9: 2020-02-18 | D9: 2020-02-18 | E9: 0.2
A10: I_f | B10: Implementation | C10: 2020-02-18 | D10: 2020-02-18 | E10: 0.2
A11: I_st | B11: Implementation | C11: 2020-02-18 | D11: 2020-02-18 | E11: 0.2
A12: I_NaCa | B12: Implementation | C12: 2020-03-05 | D12: 2020-03-05 | E12: 1
A13: I_NaK | B13: Implementation | C13: 2020-03-06 | D13: 2020-03-06 | E13: 0.5
A14: I_b | B14: Implementation | C14: 2020-03-06 | D14: 2020-03-06 | E14: 0.5
A15: CaHandling | B15: Implementation | C15: 2020-03-07 | D15: 2020-03-08 | E15: 2
A16: I_Na | B16: Bugfixing | C16: 2020-03-10 | D16: 2020-03-10 | E16: 1
A17: I_Na | B17: Testing | C17: 2020-03-10 | D17: 2020-03-10 | E17: 0.5
A18: I_Ca,L | B18: Testing | C18: 2020-03-10 | D18: 2020-03-10 | E18: 0.5
A19: I_Ca,L | B19: Bugfixing | C19: 2020-03-11 | D19: 2020-03-23 | E19: 2
A20: I_to | B20: Testing | C20: 2020-03-24 | D20: 2020-03-24 | E20: 0.5
A21: I_to | B21: Bugfixing | C21: 2020-03-24 | D21: 2020-03-24 | E21: 0.5
A22: I_K,r | B22: Testing | C22: 2020-03-25 | D22: 2020-03-26 | E22: 1.7
A23: I_K,r | B23: Bugfixing | C23: 2020-03-26 | D23: 2020-03-27 | E23: 0.5
A24: I_f | B24: Testing | C24: 2020-03-27 | D24: 2020-03-27 | E24: 0.2
A25: I_f | B25: Bugfixing | C25: 2020-03-27 | D25: 2020-03-27 | E25: 0.2
A26: I_st | B26: Testing | C26: 2020-03-27 | D26: 2020-03-27 | E26: 0.2
A27: I_st | B27: Bugfixing | C27: 2020-03-27 | D27: 2020-03-28 | E27: 0.4
A28: Experiments | B28: Refactoring and Documentation | C28: 2020-03-28 | D28: 2020-03-30 | E28: 2.8
A29: Plots | B29: Refactoring and Documentation | C29: 2020-03-30 | D29: 2020-03-31 | E29: 0.9
A30: Ion channels | B30: Refactoring and Documentation | C30: 2020-03-31 | D30: 2020-03-31 | E30: 0.1
A31: I_p | B31: Testing | C31: 2020-04-01 | D31: 2020-04-01 | E31: 0.3
A32: I_b | B32: Testing | C32: 2020-04-01 | D32: 2020-04-01 | E32: 0.2
A33: I_p | B33: Bugfixing | C33: 2020-04-01 | D33: 2020-04-01 | E33: 0.2
A34: I_b | B34: Bugfixing | C34: 2020-04-01 | D34: 2020-04-01 | E34: 0.2
A35: I_NaCa | B35: Testing | C35: 2020-04-01 | D35: 2020-04-06 | E35: 1
A36: I_NaCa | B36: Bugfixing | C36: 2020-04-06 | D36: 2020-04-11 | E36: 5
A37: Plots | B37: Refactoring and Documentation | C37: 2020-04-14 | D37: 2020-04-14 | E37: 1
A38: MoST | B38: Refactoring and Documentation | C38: 2020-04-30 | D38: 2020-05-06 | E38: 2
A39: General cleanup | B39: Refactoring and Documentation | C39: 2020-05-06 | D39: 2020-05-09 | E39: 3
A40: Full cell | B40: Testing | C40: 2020-05-18 | D40: 2020-05-18 | E40: 1
A41: I_Ach | B41: Implementation | C41: 2020-05-19 | D41: 2020-05-19 | E41: 0.2
A42: CaHandling (mainly) | B42: Bugfixing | C42: 2020-05-19 | D42: 2020-06-23 | E42: 5.3
A43: CaHandling | B43: Testing | C43: 2020-06-23 | D43: 2020-06-23 | E43: 0.5
A44: General cleanup | B44: Refactoring and Documentation | C44: 2020-06-24 | D44: 2020-06-24 | E44: 1
A45: Atrial cell model | B45: Implementation (A) | C45: 2020-07-13 | D45: 2020-07-13 | E45: 1
A46: Atrial cell model | B46: Refactoring and Documentation (A) | C46: 2020-07-15 | D46: 2020-07-17 | E46: 3
A47: Unit correction | B47: Bugfixing | C47: 2020-07-24 | D47: 2020-07-24 | E47: 0.1
A48: Icons, documentation and cleanup | B48: Refactoring and Documentation | C48: 2020-07-26 | D48: 2020-09-16 | E48: 9.5
A49: Plot of full model | B49: Bugfixing | C49: 2020-09-16 | D49: 2020-09-16 | E49: 0.5
A50: Starting values | B50: Bugfixing | C50: 2020-09-30 | D50: 2020-10-05 | E50: 4
A51: Research for parameters equations and examples | B51: Research | C51: - | D51: - | E51: of:=[$Comments.E1] -> 41

Sheet: Comments
A1: Date | B1: File | C1: Is Duplicate | D1: Coud w/o duplicates | E1: of:=COUNT([.A2:.A65])-SUM([.C2:.C65]) -> 41
A2: 2019-02-06 | B2: Inada 2009 (supplement) | C2: of:=IF(COUNTIF([.A2:.A$65];[.A2]) > 1; 1; 0) -> 0
A3: 2019-02-11 | B3: Inada 2009 (supplement) | C3: of:=IF(COUNTIF([.A3:.A$65];[.A3]) > 1; 1; 0) -> 0
A4: 2019-02-12 | B4: Inada 2009 | C4: of:=IF(COUNTIF([.A4:.A$65];[.A4]) > 1; 1; 0) -> 1
A5: 2019-02-12 | B5: Inada 2009 (supplement) | C5: of:=IF(COUNTIF([.A5:.A$65];[.A5]) > 1; 1; 0) -> 0
A6: 2019-02-18 | B6: Inada 2009 (supplement) | C6: of:=IF(COUNTIF([.A6:.A$65];[.A6]) > 1; 1; 0) -> 0
A7: 2019-11-01 | B7: Inada 2009 | C7: of:=IF(COUNTIF([.A7:.A$65];[.A7]) > 1; 1; 0) -> 1
A8: 2019-11-01 | B8: Inada 2009 (supplement) | C8: of:=IF(COUNTIF([.A8:.A$65];[.A8]) > 1; 1; 0) -> 0
A9: 2019-11-02 | B9: Inada 2009 (supplement) | C9: of:=IF(COUNTIF([.A9:.A$65];[.A9]) > 1; 1; 0) -> 1
A10: 2019-11-02 | B10: Lindblad 1996 | C10: of:=IF(COUNTIF([.A10:.A$65];[.A10]) > 1; 1; 0) -> 1
A11: 2019-11-02 | B11: Lindblad 1996 | C11: of:=IF(COUNTIF([.A11:.A$65];[.A11]) > 1; 1; 0) -> 0
A12: 2019-11-03 | B12: Lindblad 1996 | C12: of:=IF(COUNTIF([.A12:.A$65];[.A12]) > 1; 1; 0) -> 0
A13: 2019-11-06 | B13: Lindblad 1996 | C13: of:=IF(COUNTIF([.A13:.A$65];[.A13]) > 1; 1; 0) -> 0
A14: 2019-11-08 | B14: Lindblad 1996 | C14: of:=IF(COUNTIF([.A14:.A$65];[.A14]) > 1; 1; 0) -> 1
A15: 2019-11-08 | B15: Wendt 1992 | C15: of:=IF(COUNTIF([.A15:.A$65];[.A15]) > 1; 1; 0) -> 0
A16: 2020-02-05 | B16: Lindblad 1996 | C16: of:=IF(COUNTIF([.A16:.A$65];[.A16]) > 1; 1; 0) -> 0
A17: 2020-02-06 | B17: Wendt 1992 | C17: of:=IF(COUNTIF([.A17:.A$65];[.A17]) > 1; 1; 0) -> 0
A18: 2020-02-10 | B18: Lindblad 1996 | C18: of:=IF(COUNTIF([.A18:.A$65];[.A18]) > 1; 1; 0) -> 0
A19: 2020-02-11 | B19: Inada 2009 (supplement) | C19: of:=IF(COUNTIF([.A19:.A$65];[.A19]) > 1; 1; 0) -> 1
A20: 2020-02-11 | B20: Lindblad 1996 | C20: of:=IF(COUNTIF([.A20:.A$65];[.A20]) > 1; 1; 0) -> 0
A21: 2020-02-15 | B21: Inada 2009 (supplement) | C21: of:=IF(COUNTIF([.A21:.A$65];[.A21]) > 1; 1; 0) -> 1
A22: 2020-02-15 | B22: Lindblad 1996 | C22: of:=IF(COUNTIF([.A22:.A$65];[.A22]) > 1; 1; 0) -> 0
A23: 2020-02-18 | B23: Inada 2009 (supplement) | C23: of:=IF(COUNTIF([.A23:.A$65];[.A23]) > 1; 1; 0) -> 0
A24: 2020-03-04 | B24: Dokos 1996 | C24: of:=IF(COUNTIF([.A24:.A$65];[.A24]) > 1; 1; 0) -> 1
A25: 2020-03-04 | B25: Inada 2009 (supplement) | C25: of:=IF(COUNTIF([.A25:.A$65];[.A25]) > 1; 1; 0) -> 1
A26: 2020-03-04 | B26: Kurata 2002 | C26: of:=IF(COUNTIF([.A26:.A$65];[.A26]) > 1; 1; 0) -> 1
A27: 2020-03-04 | B27: Matsuoka 1992 | C27: of:=IF(COUNTIF([.A27:.A$65];[.A27]) > 1; 1; 0) -> 0
A28: 2020-03-05 | B28: Dokos 1996 | C28: of:=IF(COUNTIF([.A28:.A$65];[.A28]) > 1; 1; 0) -> 1
A29: 2020-03-05 | B29: Inada 2009 (supplement) | C29: of:=IF(COUNTIF([.A29:.A$65];[.A29]) > 1; 1; 0) -> 1
A30: 2020-03-05 | B30: Kurata 2002 | C30: of:=IF(COUNTIF([.A30:.A$65];[.A30]) > 1; 1; 0) -> 1
A31: 2020-03-05 | B31: Matsuoka 1992 | C31: of:=IF(COUNTIF([.A31:.A$65];[.A31]) > 1; 1; 0) -> 0
A32: 2020-03-06 | B32: Dokos 1996 | C32: of:=IF(COUNTIF([.A32:.A$65];[.A32]) > 1; 1; 0) -> 1
A33: 2020-03-06 | B33: Inada 2009 (supplement) | C33: of:=IF(COUNTIF([.A33:.A$65];[.A33]) > 1; 1; 0) -> 1
A34: 2020-03-06 | B34: Kurata 2002 | C34: of:=IF(COUNTIF([.A34:.A$65];[.A34]) > 1; 1; 0) -> 0
A35: 2020-03-07 | B35: Inada 2009 (supplement) | C35: of:=IF(COUNTIF([.A35:.A$65];[.A35]) > 1; 1; 0) -> 0
A36: 2020-03-08 | B36: Dokos 1996 | C36: of:=IF(COUNTIF([.A36:.A$65];[.A36]) > 1; 1; 0) -> 1
A37: 2020-03-08 | B37: Kurata 2002 | C37: of:=IF(COUNTIF([.A37:.A$65];[.A37]) > 1; 1; 0) -> 1
A38: 2020-03-08 | B38: Luo 1994 | C38: of:=IF(COUNTIF([.A38:.A$65];[.A38]) > 1; 1; 0) -> 0
A39: 2020-03-24 | B39: Inada 2009 (supplement) | C39: of:=IF(COUNTIF([.A39:.A$65];[.A39]) > 1; 1; 0) -> 0
A40: 2020-03-26 | B40: Inada 2009 (supplement) | C40: of:=IF(COUNTIF([.A40:.A$65];[.A40]) > 1; 1; 0) -> 0
A41: 2020-03-27 | B41: Inada 2009 (supplement) | C41: of:=IF(COUNTIF([.A41:.A$65];[.A41]) > 1; 1; 0) -> 1
A42: 2020-03-27 | B42: Kurata 2002 | C42: of:=IF(COUNTIF([.A42:.A$65];[.A42]) > 1; 1; 0) -> 0
A43: 2020-03-28 | B43: Kurata 2002 | C43: of:=IF(COUNTIF([.A43:.A$65];[.A43]) > 1; 1; 0) -> 0
A44: 2020-03-29 | B44: Inada 2009 (supplement) | C44: of:=IF(COUNTIF([.A44:.A$65];[.A44]) > 1; 1; 0) -> 0
A45: 2020-03-30 | B45: Inada 2009 (supplement) | C45: of:=IF(COUNTIF([.A45:.A$65];[.A45]) > 1; 1; 0) -> 0
A46: 2020-04-01 | B46: Demir 1994 | C46: of:=IF(COUNTIF([.A46:.A$65];[.A46]) > 1; 1; 0) -> 1
A47: 2020-04-01 | B47: Kurata 2002 | C47: of:=IF(COUNTIF([.A47:.A$65];[.A47]) > 1; 1; 0) -> 1
A48: 2020-04-01 | B48: Zhang 2000 | C48: of:=IF(COUNTIF([.A48:.A$65];[.A48]) > 1; 1; 0) -> 0
A49: 2020-04-02 | B49: Dokos 1996 | C49: of:=IF(COUNTIF([.A49:.A$65];[.A49]) > 1; 1; 0) -> 1
A50: 2020-04-02 | B50: Kurata 2002 | C50: of:=IF(COUNTIF([.A50:.A$65];[.A50]) > 1; 1; 0) -> 1
A51: 2020-04-02 | B51: Matsuoka 1992 | C51: of:=IF(COUNTIF([.A51:.A$65];[.A51]) > 1; 1; 0) -> 0
A52: 2020-04-03 | B52: Demir 1994 | C52: of:=IF(COUNTIF([.A52:.A$65];[.A52]) > 1; 1; 0) -> 0
A53: 2020-04-07 | B53: Matsuoka 1992 | C53: of:=IF(COUNTIF([.A53:.A$65];[.A53]) > 1; 1; 0) -> 0
A54: 2020-04-09 | B54: Convery 2000 | C54: of:=IF(COUNTIF([.A54:.A$65];[.A54]) > 1; 1; 0) -> 0
A55: 2020-04-10 | B55: Matsuoka 1992 | C55: of:=IF(COUNTIF([.A55:.A$65];[.A55]) > 1; 1; 0) -> 0
A56: 2020-04-11 | B56: Matsuoka 1992 | C56: of:=IF(COUNTIF([.A56:.A$65];[.A56]) > 1; 1; 0) -> 0
A57: 2020-04-29 | B57: Inada 2009 (supplement) | C57: of:=IF(COUNTIF([.A57:.A$65];[.A57]) > 1; 1; 0) -> 0
A58: 2020-05-07 | B58: Inada 2009 (supplement) | C58: of:=IF(COUNTIF([.A58:.A$65];[.A58]) > 1; 1; 0) -> 1
A59: 2020-05-07 | B59: Kurata 2002 | C59: of:=IF(COUNTIF([.A59:.A$65];[.A59]) > 1; 1; 0) -> 0
A60: 2020-05-19 | B60: Inada 2009 (supplement) | C60: of:=IF(COUNTIF([.A60:.A$65];[.A60]) > 1; 1; 0) -> 0
A61: 2020-06-22 | B61: Inada 2009 (supplement) | C61: of:=IF(COUNTIF([.A61:.A$65];[.A61]) > 1; 1; 0) -> 0
A62: 2020-07-13 | B62: Lindblad 1996 | C62: of:=IF(COUNTIF([.A62:.A$65];[.A62]) > 1; 1; 0) -> 0
A63: 2020-07-17 | B63: Lindblad 1996 | C63: of:=IF(COUNTIF([.A63:.A$65];[.A63]) > 1; 1; 0) -> 0
A64: 2020-07-23 | B64: Inada 2009 (supplement) | C64: of:=IF(COUNTIF([.A64:.A$65];[.A64]) > 1; 1; 0) -> 0
A65: 2020-07-28 | B65: Inada 2009 (supplement) | C65: of:=IF(COUNTIF([.A65:.A$65];[.A65]) > 1; 1; 0) -> 0

Sheet: Commits
A1: Date | B1: is duplicate | C1: Count w/o Duplicates | D1: of:=COUNTIF([.B2:.B1000];0) -> 75
A2: 2020-10-05 | B2: of:=IF(COUNTIF([.A2:.A$1000];[.A2]) > 1; 1; 0) -> 1
A3: 2020-10-05 | B3: of:=IF(COUNTIF([.A3:.A$1000];[.A3]) > 1; 1; 0) -> 1
A4: 2020-10-05 | B4: of:=IF(COUNTIF([.A4:.A$1000];[.A4]) > 1; 1; 0) -> 1
A5: 2020-10-05 | B5: of:=IF(COUNTIF([.A5:.A$1000];[.A5]) > 1; 1; 0) -> 1
A6: 2020-10-05 | B6: of:=IF(COUNTIF([.A6:.A$1000];[.A6]) > 1; 1; 0) -> 0
A7: 2020-10-02 | B7: of:=IF(COUNTIF([.A7:.A$1000];[.A7]) > 1; 1; 0) -> 1
A8: 2020-10-02 | B8: of:=IF(COUNTIF([.A8:.A$1000];[.A8]) > 1; 1; 0) -> 1
A9: 2020-10-02 | B9: of:=IF(COUNTIF([.A9:.A$1000];[.A9]) > 1; 1; 0) -> 1
A10: 2020-10-02 | B10: of:=IF(COUNTIF([.A10:.A$1000];[.A10]) > 1; 1; 0) -> 1
A11: 2020-10-02 | B11: of:=IF(COUNTIF([.A11:.A$1000];[.A11]) > 1; 1; 0) -> 1
A12: 2020-10-02 | B12: of:=IF(COUNTIF([.A12:.A$1000];[.A12]) > 1; 1; 0) -> 1
A13: 2020-10-02 | B13: of:=IF(COUNTIF([.A13:.A$1000];[.A13]) > 1; 1; 0) -> 1
A14: 2020-10-02 | B14: of:=IF(COUNTIF([.A14:.A$1000];[.A14]) > 1; 1; 0) -> 1
A15: 2020-10-02 | B15: of:=IF(COUNTIF([.A15:.A$1000];[.A15]) > 1; 1; 0) -> 1
A16: 2020-10-02 | B16: of:=IF(COUNTIF([.A16:.A$1000];[.A16]) > 1; 1; 0) -> 1
A17: 2020-10-02 | B17: of:=IF(COUNTIF([.A17:.A$1000];[.A17]) > 1; 1; 0) -> 1
A18: 2020-10-02 | B18: of:=IF(COUNTIF([.A18:.A$1000];[.A18]) > 1; 1; 0) -> 1
A19: 2020-10-02 | B19: of:=IF(COUNTIF([.A19:.A$1000];[.A19]) > 1; 1; 0) -> 1
A20: 2020-10-02 | B20: of:=IF(COUNTIF([.A20:.A$1000];[.A20]) > 1; 1; 0) -> 1
A21: 2020-10-02 | B21: of:=IF(COUNTIF([.A21:.A$1000];[.A21]) > 1; 1; 0) -> 0
A22: 2020-10-01 | B22: of:=IF(COUNTIF([.A22:.A$1000];[.A22]) > 1; 1; 0) -> 1
A23: 2020-10-01 | B23: of:=IF(COUNTIF([.A23:.A$1000];[.A23]) > 1; 1; 0) -> 1
A24: 2020-10-01 | B24: of:=IF(COUNTIF([.A24:.A$1000];[.A24]) > 1; 1; 0) -> 1
A25: 2020-10-01 | B25: of:=IF(COUNTIF([.A25:.A$1000];[.A25]) > 1; 1; 0) -> 1
A26: 2020-10-01 | B26: of:=IF(COUNTIF([.A26:.A$1000];[.A26]) > 1; 1; 0) -> 1
A27: 2020-10-01 | B27: of:=IF(COUNTIF([.A27:.A$1000];[.A27]) > 1; 1; 0) -> 1
A28: 2020-10-01 | B28: of:=IF(COUNTIF([.A28:.A$1000];[.A28]) > 1; 1; 0) -> 1
A29: 2020-10-01 | B29: of:=IF(COUNTIF([.A29:.A$1000];[.A29]) > 1; 1; 0) -> 1
A30: 2020-10-01 | B30: of:=IF(COUNTIF([.A30:.A$1000];[.A30]) > 1; 1; 0) -> 1
A31: 2020-10-01 | B31: of:=IF(COUNTIF([.A31:.A$1000];[.A31]) > 1; 1; 0) -> 1
A32: 2020-10-01 | B32: of:=IF(COUNTIF([.A32:.A$1000];[.A32]) > 1; 1; 0) -> 1
A33: 2020-10-01 | B33: of:=IF(COUNTIF([.A33:.A$1000];[.A33]) > 1; 1; 0) -> 1
A34: 2020-10-01 | B34: of:=IF(COUNTIF([.A34:.A$1000];[.A34]) > 1; 1; 0) -> 1
A35: 2020-10-01 | B35: of:=IF(COUNTIF([.A35:.A$1000];[.A35]) > 1; 1; 0) -> 1
A36: 2020-10-01 | B36: of:=IF(COUNTIF([.A36:.A$1000];[.A36]) > 1; 1; 0) -> 1
A37: 2020-10-01 | B37: of:=IF(COUNTIF([.A37:.A$1000];[.A37]) > 1; 1; 0) -> 1
A38: 2020-10-01 | B38: of:=IF(COUNTIF([.A38:.A$1000];[.A38]) > 1; 1; 0) -> 1
A39: 2020-10-01 | B39: of:=IF(COUNTIF([.A39:.A$1000];[.A39]) > 1; 1; 0) -> 1
A40: 2020-10-01 | B40: of:=IF(COUNTIF([.A40:.A$1000];[.A40]) > 1; 1; 0) -> 1
A41: 2020-10-01 | B41: of:=IF(COUNTIF([.A41:.A$1000];[.A41]) > 1; 1; 0) -> 1
A42: 2020-10-01 | B42: of:=IF(COUNTIF([.A42:.A$1000];[.A42]) > 1; 1; 0) -> 1
A43: 2020-10-01 | B43: of:=IF(COUNTIF([.A43:.A$1000];[.A43]) > 1; 1; 0) -> 0
A44: 2020-09-30 | B44: of:=IF(COUNTIF([.A44:.A$1000];[.A44]) > 1; 1; 0) -> 1
A45: 2020-09-30 | B45: of:=IF(COUNTIF([.A45:.A$1000];[.A45]) > 1; 1; 0) -> 1
A46: 2020-09-30 | B46: of:=IF(COUNTIF([.A46:.A$1000];[.A46]) > 1; 1; 0) -> 1
A47: 2020-09-30 | B47: of:=IF(COUNTIF([.A47:.A$1000];[.A47]) > 1; 1; 0) -> 1
A48: 2020-09-30 | B48: of:=IF(COUNTIF([.A48:.A$1000];[.A48]) > 1; 1; 0) -> 1
A49: 2020-09-30 | B49: of:=IF(COUNTIF([.A49:.A$1000];[.A49]) > 1; 1; 0) -> 1
A50: 2020-09-30 | B50: of:=IF(COUNTIF([.A50:.A$1000];[.A50]) > 1; 1; 0) -> 1
A51: 2020-09-30 | B51: of:=IF(COUNTIF([.A51:.A$1000];[.A51]) > 1; 1; 0) -> 1
A52: 2020-09-30 | B52: of:=IF(COUNTIF([.A52:.A$1000];[.A52]) > 1; 1; 0) -> 1
A53: 2020-09-30 | B53: of:=IF(COUNTIF([.A53:.A$1000];[.A53]) > 1; 1; 0) -> 0
A54: 2020-09-16 | B54: of:=IF(COUNTIF([.A54:.A$1000];[.A54]) > 1; 1; 0) -> 1
A55: 2020-09-16 | B55: of:=IF(COUNTIF([.A55:.A$1000];[.A55]) > 1; 1; 0) -> 1
A56: 2020-09-16 | B56: of:=IF(COUNTIF([.A56:.A$1000];[.A56]) > 1; 1; 0) -> 1
A57: 2020-09-16 | B57: of:=IF(COUNTIF([.A57:.A$1000];[.A57]) > 1; 1; 0) -> 1
A58: 2020-09-16 | B58: of:=IF(COUNTIF([.A58:.A$1000];[.A58]) > 1; 1; 0) -> 1
A59: 2020-09-16 | B59: of:=IF(COUNTIF([.A59:.A$1000];[.A59]) > 1; 1; 0) -> 1
A60: 2020-09-16 | B60: of:=IF(COUNTIF([.A60:.A$1000];[.A60]) > 1; 1; 0) -> 1
A61: 2020-09-16 | B61: of:=IF(COUNTIF([.A61:.A$1000];[.A61]) > 1; 1; 0) -> 1
A62: 2020-09-16 | B62: of:=IF(COUNTIF([.A62:.A$1000];[.A62]) > 1; 1; 0) -> 1
A63: 2020-09-16 | B63: of:=IF(COUNTIF([.A63:.A$1000];[.A63]) > 1; 1; 0) -> 1
A64: 2020-09-16 | B64: of:=IF(COUNTIF([.A64:.A$1000];[.A64]) > 1; 1; 0) -> 1
A65: 2020-09-16 | B65: of:=IF(COUNTIF([.A65:.A$1000];[.A65]) > 1; 1; 0) -> 1
A66: 2020-09-16 | B66: of:=IF(COUNTIF([.A66:.A$1000];[.A66]) > 1; 1; 0) -> 1
A67: 2020-09-16 | B67: of:=IF(COUNTIF([.A67:.A$1000];[.A67]) > 1; 1; 0) -> 0
A68: 2020-09-15 | B68: of:=IF(COUNTIF([.A68:.A$1000];[.A68]) > 1; 1; 0) -> 1
A69: 2020-09-15 | B69: of:=IF(COUNTIF([.A69:.A$1000];[.A69]) > 1; 1; 0) -> 1
A70: 2020-09-15 | B70: of:=IF(COUNTIF([.A70:.A$1000];[.A70]) > 1; 1; 0) -> 1
A71: 2020-09-15 | B71: of:=IF(COUNTIF([.A71:.A$1000];[.A71]) > 1; 1; 0) -> 1
A72: 2020-09-15 | B72: of:=IF(COUNTIF([.A72:.A$1000];[.A72]) > 1; 1; 0) -> 1
A73: 2020-09-15 | B73: of:=IF(COUNTIF([.A73:.A$1000];[.A73]) > 1; 1; 0) -> 1
A74: 2020-09-15 | B74: of:=IF(COUNTIF([.A74:.A$1000];[.A74]) > 1; 1; 0) -> 1
A75: 2020-09-15 | B75: of:=IF(COUNTIF([.A75:.A$1000];[.A75]) > 1; 1; 0) -> 1
A76: 2020-09-15 | B76: of:=IF(COUNTIF([.A76:.A$1000];[.A76]) > 1; 1; 0) -> 0
A77: 2020-09-13 | B77: of:=IF(COUNTIF([.A77:.A$1000];[.A77]) > 1; 1; 0) -> 0
A78: 2020-09-08 | B78: of:=IF(COUNTIF([.A78:.A$1000];[.A78]) > 1; 1; 0) -> 1
A79: 2020-09-08 | B79: of:=IF(COUNTIF([.A79:.A$1000];[.A79]) > 1; 1; 0) -> 1
A80: 2020-09-08 | B80: of:=IF(COUNTIF([.A80:.A$1000];[.A80]) > 1; 1; 0) -> 1
A81: 2020-09-08 | B81: of:=IF(COUNTIF([.A81:.A$1000];[.A81]) > 1; 1; 0) -> 1
A82: 2020-09-08 | B82: of:=IF(COUNTIF([.A82:.A$1000];[.A82]) > 1; 1; 0) -> 1
A83: 2020-09-08 | B83: of:=IF(COUNTIF([.A83:.A$1000];[.A83]) > 1; 1; 0) -> 1
A84: 2020-09-08 | B84: of:=IF(COUNTIF([.A84:.A$1000];[.A84]) > 1; 1; 0) -> 1
A85: 2020-09-08 | B85: of:=IF(COUNTIF([.A85:.A$1000];[.A85]) > 1; 1; 0) -> 1
A86: 2020-09-08 | B86: of:=IF(COUNTIF([.A86:.A$1000];[.A86]) > 1; 1; 0) -> 1
A87: 2020-09-08 | B87: of:=IF(COUNTIF([.A87:.A$1000];[.A87]) > 1; 1; 0) -> 1
A88: 2020-09-08 | B88: of:=IF(COUNTIF([.A88:.A$1000];[.A88]) > 1; 1; 0) -> 1
A89: 2020-09-08 | B89: of:=IF(COUNTIF([.A89:.A$1000];[.A89]) > 1; 1; 0) -> 1
A90: 2020-09-08 | B90: of:=IF(COUNTIF([.A90:.A$1000];[.A90]) > 1; 1; 0) -> 1
A91: 2020-09-08 | B91: of:=IF(COUNTIF([.A91:.A$1000];[.A91]) > 1; 1; 0) -> 1
A92: 2020-09-08 | B92: of:=IF(COUNTIF([.A92:.A$1000];[.A92]) > 1; 1; 0) -> 1
A93: 2020-09-08 | B93: of:=IF(COUNTIF([.A93:.A$1000];[.A93]) > 1; 1; 0) -> 1
A94: 2020-09-08 | B94: of:=IF(COUNTIF([.A94:.A$1000];[.A94]) > 1; 1; 0) -> 1
A95: 2020-09-08 | B95: of:=IF(COUNTIF([.A95:.A$1000];[.A95]) > 1; 1; 0) -> 1
A96: 2020-09-08 | B96: of:=IF(COUNTIF([.A96:.A$1000];[.A96]) > 1; 1; 0) -> 1
A97: 2020-09-08 | B97: of:=IF(COUNTIF([.A97:.A$1000];[.A97]) > 1; 1; 0) -> 1
A98: 2020-09-08 | B98: of:=IF(COUNTIF([.A98:.A$1000];[.A98]) > 1; 1; 0) -> 1
A99: 2020-09-08 | B99: of:=IF(COUNTIF([.A99:.A$1000];[.A99]) > 1; 1; 0) -> 1
A100: 2020-09-08 | B100: of:=IF(COUNTIF([.A100:.A$1000];[.A100]) > 1; 1; 0) -> 1
A101: 2020-09-08 | B101: of:=IF(COUNTIF([.A101:.A$1000];[.A101]) > 1; 1; 0) -> 0
A102: 2020-09-07 | B102: of:=IF(COUNTIF([.A102:.A$1000];[.A102]) > 1; 1; 0) -> 1
A103: 2020-09-07 | B103: of:=IF(COUNTIF([.A103:.A$1000];[.A103]) > 1; 1; 0) -> 1
A104: 2020-09-07 | B104: of:=IF(COUNTIF([.A104:.A$1000];[.A104]) > 1; 1; 0) -> 1
A105: 2020-09-07 | B105: of:=IF(COUNTIF([.A105:.A$1000];[.A105]) > 1; 1; 0) -> 1
A106: 2020-09-07 | B106: of:=IF(COUNTIF([.A106:.A$1000];[.A106]) > 1; 1; 0) -> 1
A107: 2020-09-07 | B107: of:=IF(COUNTIF([.A107:.A$1000];[.A107]) > 1; 1; 0) -> 1
A108: 2020-09-07 | B108: of:=IF(COUNTIF([.A108:.A$1000];[.A108]) > 1; 1; 0) -> 1
A109: 2020-09-07 | B109: of:=IF(COUNTIF([.A109:.A$1000];[.A109]) > 1; 1; 0) -> 1
A110: 2020-09-07 | B110: of:=IF(COUNTIF([.A110:.A$1000];[.A110]) > 1; 1; 0) -> 1
A111: 2020-09-07 | B111: of:=IF(COUNTIF([.A111:.A$1000];[.A111]) > 1; 1; 0) -> 1
A112: 2020-09-07 | B112: of:=IF(COUNTIF([.A112:.A$1000];[.A112]) > 1; 1; 0) -> 1
A113: 2020-09-07 | B113: of:=IF(COUNTIF([.A113:.A$1000];[.A113]) > 1; 1; 0) -> 1
A114: 2020-09-07 | B114: of:=IF(COUNTIF([.A114:.A$1000];[.A114]) > 1; 1; 0) -> 1
A115: 2020-09-07 | B115: of:=IF(COUNTIF([.A115:.A$1000];[.A115]) > 1; 1; 0) -> 1
A116: 2020-09-07 | B116: of:=IF(COUNTIF([.A116:.A$1000];[.A116]) > 1; 1; 0) -> 1
A117: 2020-09-07 | B117: of:=IF(COUNTIF([.A117:.A$1000];[.A117]) > 1; 1; 0) -> 1
A118: 2020-09-07 | B118: of:=IF(COUNTIF([.A118:.A$1000];[.A118]) > 1; 1; 0) -> 1
A119: 2020-09-07 | B119: of:=IF(COUNTIF([.A119:.A$1000];[.A119]) > 1; 1; 0) -> 1
A120: 2020-09-07 | B120: of:=IF(COUNTIF([.A120:.A$1000];[.A120]) > 1; 1; 0) -> 1
A121: 2020-09-07 | B121: of:=IF(COUNTIF([.A121:.A$1000];[.A121]) > 1; 1; 0) -> 1
A122: 2020-09-07 | B122: of:=IF(COUNTIF([.A122:.A$1000];[.A122]) > 1; 1; 0) -> 1
A123: 2020-09-07 | B123: of:=IF(COUNTIF([.A123:.A$1000];[.A123]) > 1; 1; 0) -> 0
A124: 2020-09-04 | B124: of:=IF(COUNTIF([.A124:.A$1000];[.A124]) > 1; 1; 0) -> 1
A125: 2020-09-04 | B125: of:=IF(COUNTIF([.A125:.A$1000];[.A125]) > 1; 1; 0) -> 1
A126: 2020-09-04 | B126: of:=IF(COUNTIF([.A126:.A$1000];[.A126]) > 1; 1; 0) -> 1
A127: 2020-09-04 | B127: of:=IF(COUNTIF([.A127:.A$1000];[.A127]) > 1; 1; 0) -> 1
A128: 2020-09-04 | B128: of:=IF(COUNTIF([.A128:.A$1000];[.A128]) > 1; 1; 0) -> 1
A129: 2020-09-04 | B129: of:=IF(COUNTIF([.A129:.A$1000];[.A129]) > 1; 1; 0) -> 1
A130: 2020-09-04 | B130: of:=IF(COUNTIF([.A130:.A$1000];[.A130]) > 1; 1; 0) -> 1
A131: 2020-09-04 | B131: of:=IF(COUNTIF([.A131:.A$1000];[.A131]) > 1; 1; 0) -> 1
A132: 2020-09-04 | B132: of:=IF(COUNTIF([.A132:.A$1000];[.A132]) > 1; 1; 0) -> 1
A133: 2020-09-04 | B133: of:=IF(COUNTIF([.A133:.A$1000];[.A133]) > 1; 1; 0) -> 1
A134: 2020-09-04 | B134: of:=IF(COUNTIF([.A134:.A$1000];[.A134]) > 1; 1; 0) -> 1
A135: 2020-09-04 | B135: of:=IF(COUNTIF([.A135:.A$1000];[.A135]) > 1; 1; 0) -> 1
A136: 2020-09-04 | B136: of:=IF(COUNTIF([.A136:.A$1000];[.A136]) > 1; 1; 0) -> 1
A137: 2020-09-04 | B137: of:=IF(COUNTIF([.A137:.A$1000];[.A137]) > 1; 1; 0) -> 1
A138: 2020-09-04 | B138: of:=IF(COUNTIF([.A138:.A$1000];[.A138]) > 1; 1; 0) -> 1
A139: 2020-09-04 | B139: of:=IF(COUNTIF([.A139:.A$1000];[.A139]) > 1; 1; 0) -> 1
A140: 2020-09-04 | B140: of:=IF(COUNTIF([.A140:.A$1000];[.A140]) > 1; 1; 0) -> 1
A141: 2020-09-04 | B141: of:=IF(COUNTIF([.A141:.A$1000];[.A141]) > 1; 1; 0) -> 1
A142: 2020-09-04 | B142: of:=IF(COUNTIF([.A142:.A$1000];[.A142]) > 1; 1; 0) -> 1
A143: 2020-09-04 | B143: of:=IF(COUNTIF([.A143:.A$1000];[.A143]) > 1; 1; 0) -> 1
A144: 2020-09-04 | B144: of:=IF(COUNTIF([.A144:.A$1000];[.A144]) > 1; 1; 0) -> 1
A145: 2020-09-04 | B145: of:=IF(COUNTIF([.A145:.A$1000];[.A145]) > 1; 1; 0) -> 1
A146: 2020-09-04 | B146: of:=IF(COUNTIF([.A146:.A$1000];[.A146]) > 1; 1; 0) -> 1
A147: 2020-09-04 | B147: of:=IF(COUNTIF([.A147:.A$1000];[.A147]) > 1; 1; 0) -> 1
A148: 2020-09-04 | B148: of:=IF(COUNTIF([.A148:.A$1000];[.A148]) > 1; 1; 0) -> 1
A149: 2020-09-04 | B149: of:=IF(COUNTIF([.A149:.A$1000];[.A149]) > 1; 1; 0) -> 1
A150: 2020-09-04 | B150: of:=IF(COUNTIF([.A150:.A$1000];[.A150]) > 1; 1; 0) -> 1
A151: 2020-09-04 | B151: of:=IF(COUNTIF([.A151:.A$1000];[.A151]) > 1; 1; 0) -> 1
A152: 2020-09-04 | B152: of:=IF(COUNTIF([.A152:.A$1000];[.A152]) > 1; 1; 0) -> 1
A153: 2020-09-04 | B153: of:=IF(COUNTIF([.A153:.A$1000];[.A153]) > 1; 1; 0) -> 1
A154: 2020-09-04 | B154: of:=IF(COUNTIF([.A154:.A$1000];[.A154]) > 1; 1; 0) -> 1
A155: 2020-09-04 | B155: of:=IF(COUNTIF([.A155:.A$1000];[.A155]) > 1; 1; 0) -> 1
A156: 2020-09-04 | B156: of:=IF(COUNTIF([.A156:.A$1000];[.A156]) > 1; 1; 0) -> 1
A157: 2020-09-04 | B157: of:=IF(COUNTIF([.A157:.A$1000];[.A157]) > 1; 1; 0) -> 1
A158: 2020-09-04 | B158: of:=IF(COUNTIF([.A158:.A$1000];[.A158]) > 1; 1; 0) -> 1
A159: 2020-09-04 | B159: of:=IF(COUNTIF([.A159:.A$1000];[.A159]) > 1; 1; 0) -> 0
A160: 2020-09-03 | B160: of:=IF(COUNTIF([.A160:.A$1000];[.A160]) > 1; 1; 0) -> 1
A161: 2020-09-03 | B161: of:=IF(COUNTIF([.A161:.A$1000];[.A161]) > 1; 1; 0) -> 1
A162: 2020-09-03 | B162: of:=IF(COUNTIF([.A162:.A$1000];[.A162]) > 1; 1; 0) -> 1
A163: 2020-09-03 | B163: of:=IF(COUNTIF([.A163:.A$1000];[.A163]) > 1; 1; 0) -> 1
A164: 2020-09-03 | B164: of:=IF(COUNTIF([.A164:.A$1000];[.A164]) > 1; 1; 0) -> 1
A165: 2020-09-03 | B165: of:=IF(COUNTIF([.A165:.A$1000];[.A165]) > 1; 1; 0) -> 1
A166: 2020-09-03 | B166: of:=IF(COUNTIF([.A166:.A$1000];[.A166]) > 1; 1; 0) -> 1
A167: 2020-09-03 | B167: of:=IF(COUNTIF([.A167:.A$1000];[.A167]) > 1; 1; 0) -> 1
A168: 2020-09-03 | B168: of:=IF(COUNTIF([.A168:.A$1000];[.A168]) > 1; 1; 0) -> 1
A169: 2020-09-03 | B169: of:=IF(COUNTIF([.A169:.A$1000];[.A169]) > 1; 1; 0) -> 1
A170: 2020-09-03 | B170: of:=IF(COUNTIF([.A170:.A$1000];[.A170]) > 1; 1; 0) -> 1
A171: 2020-09-03 | B171: of:=IF(COUNTIF([.A171:.A$1000];[.A171]) > 1; 1; 0) -> 1
A172: 2020-09-03 | B172: of:=IF(COUNTIF([.A172:.A$1000];[.A172]) > 1; 1; 0) -> 1
A173: 2020-09-03 | B173: of:=IF(COUNTIF([.A173:.A$1000];[.A173]) > 1; 1; 0) -> 1
A174: 2020-09-03 | B174: of:=IF(COUNTIF([.A174:.A$1000];[.A174]) > 1; 1; 0) -> 1
A175: 2020-09-03 | B175: of:=IF(COUNTIF([.A175:.A$1000];[.A175]) > 1; 1; 0) -> 1
A176: 2020-09-03 | B176: of:=IF(COUNTIF([.A176:.A$1000];[.A176]) > 1; 1; 0) -> 0
A177: 2020-09-02 | B177: of:=IF(COUNTIF([.A177:.A$1000];[.A177]) > 1; 1; 0) -> 1
A178: 2020-09-02 | B178: of:=IF(COUNTIF([.A178:.A$1000];[.A178]) > 1; 1; 0) -> 1
A179: 2020-09-02 | B179: of:=IF(COUNTIF([.A179:.A$1000];[.A179]) > 1; 1; 0) -> 1
A180: 2020-09-02 | B180: of:=IF(COUNTIF([.A180:.A$1000];[.A180]) > 1; 1; 0) -> 1
A181: 2020-09-02 | B181: of:=IF(COUNTIF([.A181:.A$1000];[.A181]) > 1; 1; 0) -> 1
A182: 2020-09-02 | B182: of:=IF(COUNTIF([.A182:.A$1000];[.A182]) > 1; 1; 0) -> 1
A183: 2020-09-02 | B183: of:=IF(COUNTIF([.A183:.A$1000];[.A183]) > 1; 1; 0) -> 1
A184: 2020-09-02 | B184: of:=IF(COUNTIF([.A184:.A$1000];[.A184]) > 1; 1; 0) -> 1
A185: 2020-09-02 | B185: of:=IF(COUNTIF([.A185:.A$1000];[.A185]) > 1; 1; 0) -> 1
A186: 2020-09-02 | B186: of:=IF(COUNTIF([.A186:.A$1000];[.A186]) > 1; 1; 0) -> 1
A187: 2020-09-02 | B187: of:=IF(COUNTIF([.A187:.A$1000];[.A187]) > 1; 1; 0) -> 0
A188: 2020-09-01 | B188: of:=IF(COUNTIF([.A188:.A$1000];[.A188]) > 1; 1; 0) -> 1
A189: 2020-09-01 | B189: of:=IF(COUNTIF([.A189:.A$1000];[.A189]) > 1; 1; 0) -> 1
A190: 2020-09-01 | B190: of:=IF(COUNTIF([.A190:.A$1000];[.A190]) > 1; 1; 0) -> 1
A191: 2020-09-01 | B191: of:=IF(COUNTIF([.A191:.A$1000];[.A191]) > 1; 1; 0) -> 0
A192: 2020-08-31 | B192: of:=IF(COUNTIF([.A192:.A$1000];[.A192]) > 1; 1; 0) -> 0
A193: 2020-08-28 | B193: of:=IF(COUNTIF([.A193:.A$1000];[.A193]) > 1; 1; 0) -> 0
A194: 2020-08-26 | B194: of:=IF(COUNTIF([.A194:.A$1000];[.A194]) > 1; 1; 0) -> 1
A195: 2020-08-26 | B195: of:=IF(COUNTIF([.A195:.A$1000];[.A195]) > 1; 1; 0) -> 1
A196: 2020-08-26 | B196: of:=IF(COUNTIF([.A196:.A$1000];[.A196]) > 1; 1; 0) -> 1
A197: 2020-08-26 | B197: of:=IF(COUNTIF([.A197:.A$1000];[.A197]) > 1; 1; 0) -> 1
A198: 2020-08-26 | B198: of:=IF(COUNTIF([.A198:.A$1000];[.A198]) > 1; 1; 0) -> 1
A199: 2020-08-26 | B199: of:=IF(COUNTIF([.A199:.A$1000];[.A199]) > 1; 1; 0) -> 0
A200: 2020-08-24 | B200: of:=IF(COUNTIF([.A200:.A$1000];[.A200]) > 1; 1; 0) -> 1
A201: 2020-08-24 | B201: of:=IF(COUNTIF([.A201:.A$1000];[.A201]) > 1; 1; 0) -> 1
A202: 2020-08-24 | B202: of:=IF(COUNTIF([.A202:.A$1000];[.A202]) > 1; 1; 0) -> 0
A203: 2020-07-27 | B203: of:=IF(COUNTIF([.A203:.A$1000];[.A203]) > 1; 1; 0) -> 1
A204: 2020-07-27 | B204: of:=IF(COUNTIF([.A204:.A$1000];[.A204]) > 1; 1; 0) -> 1
A205: 2020-07-27 | B205: of:=IF(COUNTIF([.A205:.A$1000];[.A205]) > 1; 1; 0) -> 1
A206: 2020-07-27 | B206: of:=IF(COUNTIF([.A206:.A$1000];[.A206]) > 1; 1; 0) -> 1
A207: 2020-07-27 | B207: of:=IF(COUNTIF([.A207:.A$1000];[.A207]) > 1; 1; 0) -> 1
A208: 2020-07-27 | B208: of:=IF(COUNTIF([.A208:.A$1000];[.A208]) > 1; 1; 0) -> 0
A209: 2020-07-24 | B209: of:=IF(COUNTIF([.A209:.A$1000];[.A209]) > 1; 1; 0) -> 1
A210: 2020-07-24 | B210: of:=IF(COUNTIF([.A210:.A$1000];[.A210]) > 1; 1; 0) -> 0
A211: 2020-07-22 | B211: of:=IF(COUNTIF([.A211:.A$1000];[.A211]) > 1; 1; 0) -> 1
A212: 2020-07-22 | B212: of:=IF(COUNTIF([.A212:.A$1000];[.A212]) > 1; 1; 0) -> 0
A213: 2020-07-17 | B213: of:=IF(COUNTIF([.A213:.A$1000];[.A213]) > 1; 1; 0) -> 1
A214: 2020-07-17 | B214: of:=IF(COUNTIF([.A214:.A$1000];[.A214]) > 1; 1; 0) -> 1
A215: 2020-07-17 | B215: of:=IF(COUNTIF([.A215:.A$1000];[.A215]) > 1; 1; 0) -> 1
A216: 2020-07-17 | B216: of:=IF(COUNTIF([.A216:.A$1000];[.A216]) > 1; 1; 0) -> 1
A217: 2020-07-17 | B217: of:=IF(COUNTIF([.A217:.A$1000];[.A217]) > 1; 1; 0) -> 1
A218: 2020-07-17 | B218: of:=IF(COUNTIF([.A218:.A$1000];[.A218]) > 1; 1; 0) -> 1
A219: 2020-07-17 | B219: of:=IF(COUNTIF([.A219:.A$1000];[.A219]) > 1; 1; 0) -> 1
A220: 2020-07-17 | B220: of:=IF(COUNTIF([.A220:.A$1000];[.A220]) > 1; 1; 0) -> 1
A221: 2020-07-17 | B221: of:=IF(COUNTIF([.A221:.A$1000];[.A221]) > 1; 1; 0) -> 1
A222: 2020-07-17 | B222: of:=IF(COUNTIF([.A222:.A$1000];[.A222]) > 1; 1; 0) -> 1
A223: 2020-07-17 | B223: of:=IF(COUNTIF([.A223:.A$1000];[.A223]) > 1; 1; 0) -> 1
A224: 2020-07-17 | B224: of:=IF(COUNTIF([.A224:.A$1000];[.A224]) > 1; 1; 0) -> 1
A225: 2020-07-17 | B225: of:=IF(COUNTIF([.A225:.A$1000];[.A225]) > 1; 1; 0) -> 1
A226: 2020-07-17 | B226: of:=IF(COUNTIF([.A226:.A$1000];[.A226]) > 1; 1; 0) -> 1
A227: 2020-07-17 | B227: of:=IF(COUNTIF([.A227:.A$1000];[.A227]) > 1; 1; 0) -> 1
A228: 2020-07-17 | B228: of:=IF(COUNTIF([.A228:.A$1000];[.A228]) > 1; 1; 0) -> 1
A229: 2020-07-17 | B229: of:=IF(COUNTIF([.A229:.A$1000];[.A229]) > 1; 1; 0) -> 1
A230: 2020-07-17 | B230: of:=IF(COUNTIF([.A230:.A$1000];[.A230]) > 1; 1; 0) -> 1
A231: 2020-07-17 | B231: of:=IF(COUNTIF([.A231:.A$1000];[.A231]) > 1; 1; 0) -> 1
A232: 2020-07-17 | B232: of:=IF(COUNTIF([.A232:.A$1000];[.A232]) > 1; 1; 0) -> 1
A233: 2020-07-17 | B233: of:=IF(COUNTIF([.A233:.A$1000];[.A233]) > 1; 1; 0) -> 1
A234: 2020-07-17 | B234: of:=IF(COUNTIF([.A234:.A$1000];[.A234]) > 1; 1; 0) -> 1
A235: 2020-07-17 | B235: of:=IF(COUNTIF([.A235:.A$1000];[.A235]) > 1; 1; 0) -> 1
A236: 2020-07-17 | B236: of:=IF(COUNTIF([.A236:.A$1000];[.A236]) > 1; 1; 0) -> 1
A237: 2020-07-17 | B237: of:=IF(COUNTIF([.A237:.A$1000];[.A237]) > 1; 1; 0) -> 1
A238: 2020-07-17 | B238: of:=IF(COUNTIF([.A238:.A$1000];[.A238]) > 1; 1; 0) -> 0
A239: 2020-07-16 | B239: of:=IF(COUNTIF([.A239:.A$1000];[.A239]) > 1; 1; 0) -> 1
A240: 2020-07-16 | B240: of:=IF(COUNTIF([.A240:.A$1000];[.A240]) > 1; 1; 0) -> 1
A241: 2020-07-16 | B241: of:=IF(COUNTIF([.A241:.A$1000];[.A241]) > 1; 1; 0) -> 1
A242: 2020-07-16 | B242: of:=IF(COUNTIF([.A242:.A$1000];[.A242]) > 1; 1; 0) -> 1
A243: 2020-07-16 | B243: of:=IF(COUNTIF([.A243:.A$1000];[.A243]) > 1; 1; 0) -> 1
A244: 2020-07-16 | B244: of:=IF(COUNTIF([.A244:.A$1000];[.A244]) > 1; 1; 0) -> 1
A245: 2020-07-16 | B245: of:=IF(COUNTIF([.A245:.A$1000];[.A245]) > 1; 1; 0) -> 1
A246: 2020-07-16 | B246: of:=IF(COUNTIF([.A246:.A$1000];[.A246]) > 1; 1; 0) -> 1
A247: 2020-07-16 | B247: of:=IF(COUNTIF([.A247:.A$1000];[.A247]) > 1; 1; 0) -> 0
A248: 2020-07-15 | B248: of:=IF(COUNTIF([.A248:.A$1000];[.A248]) > 1; 1; 0) -> 1
A249: 2020-07-15 | B249: of:=IF(COUNTIF([.A249:.A$1000];[.A249]) > 1; 1; 0) -> 1
A250: 2020-07-15 | B250: of:=IF(COUNTIF([.A250:.A$1000];[.A250]) > 1; 1; 0) -> 1
A251: 2020-07-15 | B251: of:=IF(COUNTIF([.A251:.A$1000];[.A251]) > 1; 1; 0) -> 1
A252: 2020-07-15 | B252: of:=IF(COUNTIF([.A252:.A$1000];[.A252]) > 1; 1; 0) -> 0
A253: 2020-07-13 | B253: of:=IF(COUNTIF([.A253:.A$1000];[.A253]) > 1; 1; 0) -> 1
A254: 2020-07-13 | B254: of:=IF(COUNTIF([.A254:.A$1000];[.A254]) > 1; 1; 0) -> 1
A255: 2020-07-13 | B255: of:=IF(COUNTIF([.A255:.A$1000];[.A255]) > 1; 1; 0) -> 1
A256: 2020-07-13 | B256: of:=IF(COUNTIF([.A256:.A$1000];[.A256]) > 1; 1; 0) -> 1
A257: 2020-07-13 | B257: of:=IF(COUNTIF([.A257:.A$1000];[.A257]) > 1; 1; 0) -> 1
A258: 2020-07-13 | B258: of:=IF(COUNTIF([.A258:.A$1000];[.A258]) > 1; 1; 0) -> 1
A259: 2020-07-13 | B259: of:=IF(COUNTIF([.A259:.A$1000];[.A259]) > 1; 1; 0) -> 1
A260: 2020-07-13 | B260: of:=IF(COUNTIF([.A260:.A$1000];[.A260]) > 1; 1; 0) -> 1
A261: 2020-07-13 | B261: of:=IF(COUNTIF([.A261:.A$1000];[.A261]) > 1; 1; 0) -> 1
A262: 2020-07-13 | B262: of:=IF(COUNTIF([.A262:.A$1000];[.A262]) > 1; 1; 0) -> 1
A263: 2020-07-13 | B263: of:=IF(COUNTIF([.A263:.A$1000];[.A263]) > 1; 1; 0) -> 1
A264: 2020-07-13 | B264: of:=IF(COUNTIF([.A264:.A$1000];[.A264]) > 1; 1; 0) -> 0
A265: 2020-06-24 | B265: of:=IF(COUNTIF([.A265:.A$1000];[.A265]) > 1; 1; 0) -> 1
A266: 2020-06-24 | B266: of:=IF(COUNTIF([.A266:.A$1000];[.A266]) > 1; 1; 0) -> 1
A267: 2020-06-24 | B267: of:=IF(COUNTIF([.A267:.A$1000];[.A267]) > 1; 1; 0) -> 1
A268: 2020-06-24 | B268: of:=IF(COUNTIF([.A268:.A$1000];[.A268]) > 1; 1; 0) -> 1
A269: 2020-06-24 | B269: of:=IF(COUNTIF([.A269:.A$1000];[.A269]) > 1; 1; 0) -> 1
A270: 2020-06-24 | B270: of:=IF(COUNTIF([.A270:.A$1000];[.A270]) > 1; 1; 0) -> 1
A271: 2020-06-24 | B271: of:=IF(COUNTIF([.A271:.A$1000];[.A271]) > 1; 1; 0) -> 1
A272: 2020-06-24 | B272: of:=IF(COUNTIF([.A272:.A$1000];[.A272]) > 1; 1; 0) -> 1
A273: 2020-06-24 | B273: of:=IF(COUNTIF([.A273:.A$1000];[.A273]) > 1; 1; 0) -> 1
A274: 2020-06-24 | B274: of:=IF(COUNTIF([.A274:.A$1000];[.A274]) > 1; 1; 0) -> 0
A275: 2020-06-23 | B275: of:=IF(COUNTIF([.A275:.A$1000];[.A275]) > 1; 1; 0) -> 1
A276: 2020-06-23 | B276: of:=IF(COUNTIF([.A276:.A$1000];[.A276]) > 1; 1; 0) -> 1
A277: 2020-06-23 | B277: of:=IF(COUNTIF([.A277:.A$1000];[.A277]) > 1; 1; 0) -> 1
A278: 2020-06-23 | B278: of:=IF(COUNTIF([.A278:.A$1000];[.A278]) > 1; 1; 0) -> 1
A279: 2020-06-23 | B279: of:=IF(COUNTIF([.A279:.A$1000];[.A279]) > 1; 1; 0) -> 1
A280: 2020-06-23 | B280: of:=IF(COUNTIF([.A280:.A$1000];[.A280]) > 1; 1; 0) -> 1
A281: 2020-06-23 | B281: of:=IF(COUNTIF([.A281:.A$1000];[.A281]) > 1; 1; 0) -> 1
A282: 2020-06-23 | B282: of:=IF(COUNTIF([.A282:.A$1000];[.A282]) > 1; 1; 0) -> 1
A283: 2020-06-23 | B283: of:=IF(COUNTIF([.A283:.A$1000];[.A283]) > 1; 1; 0) -> 1
A284: 2020-06-23 | B284: of:=IF(COUNTIF([.A284:.A$1000];[.A284]) > 1; 1; 0) -> 1
A285: 2020-06-23 | B285: of:=IF(COUNTIF([.A285:.A$1000];[.A285]) > 1; 1; 0) -> 1
A286: 2020-06-23 | B286: of:=IF(COUNTIF([.A286:.A$1000];[.A286]) > 1; 1; 0) -> 1
A287: 2020-06-23 | B287: of:=IF(COUNTIF([.A287:.A$1000];[.A287]) > 1; 1; 0) -> 1
A288: 2020-06-23 | B288: of:=IF(COUNTIF([.A288:.A$1000];[.A288]) > 1; 1; 0) -> 1
A289: 2020-06-23 | B289: of:=IF(COUNTIF([.A289:.A$1000];[.A289]) > 1; 1; 0) -> 1
A290: 2020-06-23 | B290: of:=IF(COUNTIF([.A290:.A$1000];[.A290]) > 1; 1; 0) -> 1
A291: 2020-06-23 | B291: of:=IF(COUNTIF([.A291:.A$1000];[.A291]) > 1; 1; 0) -> 0
A292: 2020-06-22 | B292: of:=IF(COUNTIF([.A292:.A$1000];[.A292]) > 1; 1; 0) -> 1
A293: 2020-06-22 | B293: of:=IF(COUNTIF([.A293:.A$1000];[.A293]) > 1; 1; 0) -> 1
A294: 2020-06-22 | B294: of:=IF(COUNTIF([.A294:.A$1000];[.A294]) > 1; 1; 0) -> 1
A295: 2020-06-22 | B295: of:=IF(COUNTIF([.A295:.A$1000];[.A295]) > 1; 1; 0) -> 1
A296: 2020-06-22 | B296: of:=IF(COUNTIF([.A296:.A$1000];[.A296]) > 1; 1; 0) -> 1
A297: 2020-06-22 | B297: of:=IF(COUNTIF([.A297:.A$1000];[.A297]) > 1; 1; 0) -> 1
A298: 2020-06-22 | B298: of:=IF(COUNTIF([.A298:.A$1000];[.A298]) > 1; 1; 0) -> 1
A299: 2020-06-22 | B299: of:=IF(COUNTIF([.A299:.A$1000];[.A299]) > 1; 1; 0) -> 1
A300: 2020-06-22 | B300: of:=IF(COUNTIF([.A300:.A$1000];[.A300]) > 1; 1; 0) -> 1
A301: 2020-06-22 | B301: of:=IF(COUNTIF([.A301:.A$1000];[.A301]) > 1; 1; 0) -> 1
A302: 2020-06-22 | B302: of:=IF(COUNTIF([.A302:.A$1000];[.A302]) > 1; 1; 0) -> 1
A303: 2020-06-22 | B303: of:=IF(COUNTIF([.A303:.A$1000];[.A303]) > 1; 1; 0) -> 0
A304: 2020-06-18 | B304: of:=IF(COUNTIF([.A304:.A$1000];[.A304]) > 1; 1; 0) -> 1
A305: 2020-06-18 | B305: of:=IF(COUNTIF([.A305:.A$1000];[.A305]) > 1; 1; 0) -> 1
A306: 2020-06-18 | B306: of:=IF(COUNTIF([.A306:.A$1000];[.A306]) > 1; 1; 0) -> 1
A307: 2020-06-18 | B307: of:=IF(COUNTIF([.A307:.A$1000];[.A307]) > 1; 1; 0) -> 0
A308: 2020-06-16 | B308: of:=IF(COUNTIF([.A308:.A$1000];[.A308]) > 1; 1; 0) -> 1
A309: 2020-06-16 | B309: of:=IF(COUNTIF([.A309:.A$1000];[.A309]) > 1; 1; 0) -> 1
A310: 2020-06-16 | B310: of:=IF(COUNTIF([.A310:.A$1000];[.A310]) > 1; 1; 0) -> 1
A311: 2020-06-16 | B311: of:=IF(COUNTIF([.A311:.A$1000];[.A311]) > 1; 1; 0) -> 0
A312: 2020-05-20 | B312: of:=IF(COUNTIF([.A312:.A$1000];[.A312]) > 1; 1; 0) -> 1
A313: 2020-05-20 | B313: of:=IF(COUNTIF([.A313:.A$1000];[.A313]) > 1; 1; 0) -> 0
A314: 2020-05-19 | B314: of:=IF(COUNTIF([.A314:.A$1000];[.A314]) > 1; 1; 0) -> 1
A315: 2020-05-19 | B315: of:=IF(COUNTIF([.A315:.A$1000];[.A315]) > 1; 1; 0) -> 1
A316: 2020-05-19 | B316: of:=IF(COUNTIF([.A316:.A$1000];[.A316]) > 1; 1; 0) -> 1
A317: 2020-05-19 | B317: of:=IF(COUNTIF([.A317:.A$1000];[.A317]) > 1; 1; 0) -> 1
A318: 2020-05-19 | B318: of:=IF(COUNTIF([.A318:.A$1000];[.A318]) > 1; 1; 0) -> 1
A319: 2020-05-19 | B319: of:=IF(COUNTIF([.A319:.A$1000];[.A319]) > 1; 1; 0) -> 1
A320: 2020-05-19 | B320: of:=IF(COUNTIF([.A320:.A$1000];[.A320]) > 1; 1; 0) -> 1
A321: 2020-05-19 | B321: of:=IF(COUNTIF([.A321:.A$1000];[.A321]) > 1; 1; 0) -> 1
A322: 2020-05-19 | B322: of:=IF(COUNTIF([.A322:.A$1000];[.A322]) > 1; 1; 0) -> 1
A323: 2020-05-19 | B323: of:=IF(COUNTIF([.A323:.A$1000];[.A323]) > 1; 1; 0) -> 1
A324: 2020-05-19 | B324: of:=IF(COUNTIF([.A324:.A$1000];[.A324]) > 1; 1; 0) -> 1
A325: 2020-05-19 | B325: of:=IF(COUNTIF([.A325:.A$1000];[.A325]) > 1; 1; 0) -> 1
A326: 2020-05-19 | B326: of:=IF(COUNTIF([.A326:.A$1000];[.A326]) > 1; 1; 0) -> 1
A327: 2020-05-19 | B327: of:=IF(COUNTIF([.A327:.A$1000];[.A327]) > 1; 1; 0) -> 0
A328: 2020-05-18 | B328: of:=IF(COUNTIF([.A328:.A$1000];[.A328]) > 1; 1; 0) -> 1
A329: 2020-05-18 | B329: of:=IF(COUNTIF([.A329:.A$1000];[.A329]) > 1; 1; 0) -> 1
A330: 2020-05-18 | B330: of:=IF(COUNTIF([.A330:.A$1000];[.A330]) > 1; 1; 0) -> 1
A331: 2020-05-18 | B331: of:=IF(COUNTIF([.A331:.A$1000];[.A331]) > 1; 1; 0) -> 1
A332: 2020-05-18 | B332: of:=IF(COUNTIF([.A332:.A$1000];[.A332]) > 1; 1; 0) -> 1
A333: 2020-05-18 | B333: of:=IF(COUNTIF([.A333:.A$1000];[.A333]) > 1; 1; 0) -> 1
A334: 2020-05-18 | B334: of:=IF(COUNTIF([.A334:.A$1000];[.A334]) > 1; 1; 0) -> 0
A335: 2020-05-09 | B335: of:=IF(COUNTIF([.A335:.A$1000];[.A335]) > 1; 1; 0) -> 1
A336: 2020-05-09 | B336: of:=IF(COUNTIF([.A336:.A$1000];[.A336]) > 1; 1; 0) -> 1
A337: 2020-05-09 | B337: of:=IF(COUNTIF([.A337:.A$1000];[.A337]) > 1; 1; 0) -> 1
A338: 2020-05-09 | B338: of:=IF(COUNTIF([.A338:.A$1000];[.A338]) > 1; 1; 0) -> 1
A339: 2020-05-09 | B339: of:=IF(COUNTIF([.A339:.A$1000];[.A339]) > 1; 1; 0) -> 1
A340: 2020-05-09 | B340: of:=IF(COUNTIF([.A340:.A$1000];[.A340]) > 1; 1; 0) -> 1
A341: 2020-05-09 | B341: of:=IF(COUNTIF([.A341:.A$1000];[.A341]) > 1; 1; 0) -> 1
A342: 2020-05-09 | B342: of:=IF(COUNTIF([.A342:.A$1000];[.A342]) > 1; 1; 0) -> 0
A343: 2020-05-07 | B343: of:=IF(COUNTIF([.A343:.A$1000];[.A343]) > 1; 1; 0) -> 1
A344: 2020-05-07 | B344: of:=IF(COUNTIF([.A344:.A$1000];[.A344]) > 1; 1; 0) -> 1
A345: 2020-05-07 | B345: of:=IF(COUNTIF([.A345:.A$1000];[.A345]) > 1; 1; 0) -> 1
A346: 2020-05-07 | B346: of:=IF(COUNTIF([.A346:.A$1000];[.A346]) > 1; 1; 0) -> 1
A347: 2020-05-07 | B347: of:=IF(COUNTIF([.A347:.A$1000];[.A347]) > 1; 1; 0) -> 1
A348: 2020-05-07 | B348: of:=IF(COUNTIF([.A348:.A$1000];[.A348]) > 1; 1; 0) -> 1
A349: 2020-05-07 | B349: of:=IF(COUNTIF([.A349:.A$1000];[.A349]) > 1; 1; 0) -> 1
A350: 2020-05-07 | B350: of:=IF(COUNTIF([.A350:.A$1000];[.A350]) > 1; 1; 0) -> 1
A351: 2020-05-07 | B351: of:=IF(COUNTIF([.A351:.A$1000];[.A351]) > 1; 1; 0) -> 1
A352: 2020-05-07 | B352: of:=IF(COUNTIF([.A352:.A$1000];[.A352]) > 1; 1; 0) -> 1
A353: 2020-05-07 | B353: of:=IF(COUNTIF([.A353:.A$1000];[.A353]) > 1; 1; 0) -> 1
A354: 2020-05-07 | B354: of:=IF(COUNTIF([.A354:.A$1000];[.A354]) > 1; 1; 0) -> 1
A355: 2020-05-07 | B355: of:=IF(COUNTIF([.A355:.A$1000];[.A355]) > 1; 1; 0) -> 1
A356: 2020-05-07 | B356: of:=IF(COUNTIF([.A356:.A$1000];[.A356]) > 1; 1; 0) -> 1
A357: 2020-05-07 | B357: of:=IF(COUNTIF([.A357:.A$1000];[.A357]) > 1; 1; 0) -> 1
A358: 2020-05-07 | B358: of:=IF(COUNTIF([.A358:.A$1000];[.A358]) > 1; 1; 0) -> 1
A359: 2020-05-07 | B359: of:=IF(COUNTIF([.A359:.A$1000];[.A359]) > 1; 1; 0) -> 1
A360: 2020-05-07 | B360: of:=IF(COUNTIF([.A360:.A$1000];[.A360]) > 1; 1; 0) -> 1
A361: 2020-05-07 | B361: of:=IF(COUNTIF([.A361:.A$1000];[.A361]) > 1; 1; 0) -> 1
A362: 2020-05-07 | B362: of:=IF(COUNTIF([.A362:.A$1000];[.A362]) > 1; 1; 0) -> 1
A363: 2020-05-07 | B363: of:=IF(COUNTIF([.A363:.A$1000];[.A363]) > 1; 1; 0) -> 1
A364: 2020-05-07 | B364: of:=IF(COUNTIF([.A364:.A$1000];[.A364]) > 1; 1; 0) -> 1
A365: 2020-05-07 | B365: of:=IF(COUNTIF([.A365:.A$1000];[.A365]) > 1; 1; 0) -> 0
A366: 2020-05-06 | B366: of:=IF(COUNTIF([.A366:.A$1000];[.A366]) > 1; 1; 0) -> 1
A367: 2020-05-06 | B367: of:=IF(COUNTIF([.A367:.A$1000];[.A367]) > 1; 1; 0) -> 1
A368: 2020-05-06 | B368: of:=IF(COUNTIF([.A368:.A$1000];[.A368]) > 1; 1; 0) -> 1
A369: 2020-05-06 | B369: of:=IF(COUNTIF([.A369:.A$1000];[.A369]) > 1; 1; 0) -> 1
A370: 2020-05-06 | B370: of:=IF(COUNTIF([.A370:.A$1000];[.A370]) > 1; 1; 0) -> 1
A371: 2020-05-06 | B371: of:=IF(COUNTIF([.A371:.A$1000];[.A371]) > 1; 1; 0) -> 1
A372: 2020-05-06 | B372: of:=IF(COUNTIF([.A372:.A$1000];[.A372]) > 1; 1; 0) -> 0
A373: 2020-05-05 | B373: of:=IF(COUNTIF([.A373:.A$1000];[.A373]) > 1; 1; 0) -> 1
A374: 2020-05-05 | B374: of:=IF(COUNTIF([.A374:.A$1000];[.A374]) > 1; 1; 0) -> 1
A375: 2020-05-05 | B375: of:=IF(COUNTIF([.A375:.A$1000];[.A375]) > 1; 1; 0) -> 1
A376: 2020-05-05 | B376: of:=IF(COUNTIF([.A376:.A$1000];[.A376]) > 1; 1; 0) -> 0
A377: 2020-05-01 | B377: of:=IF(COUNTIF([.A377:.A$1000];[.A377]) > 1; 1; 0) -> 1
A378: 2020-05-01 | B378: of:=IF(COUNTIF([.A378:.A$1000];[.A378]) > 1; 1; 0) -> 1
A379: 2020-05-01 | B379: of:=IF(COUNTIF([.A379:.A$1000];[.A379]) > 1; 1; 0) -> 1
A380: 2020-05-01 | B380: of:=IF(COUNTIF([.A380:.A$1000];[.A380]) > 1; 1; 0) -> 1
A381: 2020-05-01 | B381: of:=IF(COUNTIF([.A381:.A$1000];[.A381]) > 1; 1; 0) -> 1
A382: 2020-05-01 | B382: of:=IF(COUNTIF([.A382:.A$1000];[.A382]) > 1; 1; 0) -> 1
A383: 2020-05-01 | B383: of:=IF(COUNTIF([.A383:.A$1000];[.A383]) > 1; 1; 0) -> 0
A384: 2020-04-30 | B384: of:=IF(COUNTIF([.A384:.A$1000];[.A384]) > 1; 1; 0) -> 1
A385: 2020-04-30 | B385: of:=IF(COUNTIF([.A385:.A$1000];[.A385]) > 1; 1; 0) -> 1
A386: 2020-04-30 | B386: of:=IF(COUNTIF([.A386:.A$1000];[.A386]) > 1; 1; 0) -> 1
A387: 2020-04-30 | B387: of:=IF(COUNTIF([.A387:.A$1000];[.A387]) > 1; 1; 0) -> 1
A388: 2020-04-30 | B388: of:=IF(COUNTIF([.A388:.A$1000];[.A388]) > 1; 1; 0) -> 1
A389: 2020-04-30 | B389: of:=IF(COUNTIF([.A389:.A$1000];[.A389]) > 1; 1; 0) -> 1
A390: 2020-04-30 | B390: of:=IF(COUNTIF([.A390:.A$1000];[.A390]) > 1; 1; 0) -> 1
A391: 2020-04-30 | B391: of:=IF(COUNTIF([.A391:.A$1000];[.A391]) > 1; 1; 0) -> 1
A392: 2020-04-30 | B392: of:=IF(COUNTIF([.A392:.A$1000];[.A392]) > 1; 1; 0) -> 1
A393: 2020-04-30 | B393: of:=IF(COUNTIF([.A393:.A$1000];[.A393]) > 1; 1; 0) -> 1
A394: 2020-04-30 | B394: of:=IF(COUNTIF([.A394:.A$1000];[.A394]) > 1; 1; 0) -> 1
A395: 2020-04-30 | B395: of:=IF(COUNTIF([.A395:.A$1000];[.A395]) > 1; 1; 0) -> 1
A396: 2020-04-30 | B396: of:=IF(COUNTIF([.A396:.A$1000];[.A396]) > 1; 1; 0) -> 0
A397: 2020-04-14 | B397: of:=IF(COUNTIF([.A397:.A$1000];[.A397]) > 1; 1; 0) -> 1
A398: 2020-04-14 | B398: of:=IF(COUNTIF([.A398:.A$1000];[.A398]) > 1; 1; 0) -> 1
A399: 2020-04-14 | B399: of:=IF(COUNTIF([.A399:.A$1000];[.A399]) > 1; 1; 0) -> 1
A400: 2020-04-14 | B400: of:=IF(COUNTIF([.A400:.A$1000];[.A400]) > 1; 1; 0) -> 0
A401: 2020-04-11 | B401: of:=IF(COUNTIF([.A401:.A$1000];[.A401]) > 1; 1; 0) -> 1
A402: 2020-04-11 | B402: of:=IF(COUNTIF([.A402:.A$1000];[.A402]) > 1; 1; 0) -> 1
A403: 2020-04-11 | B403: of:=IF(COUNTIF([.A403:.A$1000];[.A403]) > 1; 1; 0) -> 1
A404: 2020-04-11 | B404: of:=IF(COUNTIF([.A404:.A$1000];[.A404]) > 1; 1; 0) -> 1
A405: 2020-04-11 | B405: of:=IF(COUNTIF([.A405:.A$1000];[.A405]) > 1; 1; 0) -> 1
A406: 2020-04-11 | B406: of:=IF(COUNTIF([.A406:.A$1000];[.A406]) > 1; 1; 0) -> 1
A407: 2020-04-11 | B407: of:=IF(COUNTIF([.A407:.A$1000];[.A407]) > 1; 1; 0) -> 1
A408: 2020-04-11 | B408: of:=IF(COUNTIF([.A408:.A$1000];[.A408]) > 1; 1; 0) -> 1
A409: 2020-04-11 | B409: of:=IF(COUNTIF([.A409:.A$1000];[.A409]) > 1; 1; 0) -> 1
A410: 2020-04-11 | B410: of:=IF(COUNTIF([.A410:.A$1000];[.A410]) > 1; 1; 0) -> 0
A411: 2020-04-10 | B411: of:=IF(COUNTIF([.A411:.A$1000];[.A411]) > 1; 1; 0) -> 1
A412: 2020-04-10 | B412: of:=IF(COUNTIF([.A412:.A$1000];[.A412]) > 1; 1; 0) -> 1
A413: 2020-04-10 | B413: of:=IF(COUNTIF([.A413:.A$1000];[.A413]) > 1; 1; 0) -> 1
A414: 2020-04-10 | B414: of:=IF(COUNTIF([.A414:.A$1000];[.A414]) > 1; 1; 0) -> 0
A415: 2020-04-09 | B415: of:=IF(COUNTIF([.A415:.A$1000];[.A415]) > 1; 1; 0) -> 1
A416: 2020-04-09 | B416: of:=IF(COUNTIF([.A416:.A$1000];[.A416]) > 1; 1; 0) -> 1
A417: 2020-04-09 | B417: of:=IF(COUNTIF([.A417:.A$1000];[.A417]) > 1; 1; 0) -> 1
A418: 2020-04-09 | B418: of:=IF(COUNTIF([.A418:.A$1000];[.A418]) > 1; 1; 0) -> 1
A419: 2020-04-09 | B419: of:=IF(COUNTIF([.A419:.A$1000];[.A419]) > 1; 1; 0) -> 1
A420: 2020-04-09 | B420: of:=IF(COUNTIF([.A420:.A$1000];[.A420]) > 1; 1; 0) -> 1
A421: 2020-04-09 | B421: of:=IF(COUNTIF([.A421:.A$1000];[.A421]) > 1; 1; 0) -> 1
A422: 2020-04-09 | B422: of:=IF(COUNTIF([.A422:.A$1000];[.A422]) > 1; 1; 0) -> 1
A423: 2020-04-09 | B423: of:=IF(COUNTIF([.A423:.A$1000];[.A423]) > 1; 1; 0) -> 1
A424: 2020-04-09 | B424: of:=IF(COUNTIF([.A424:.A$1000];[.A424]) > 1; 1; 0) -> 1
A425: 2020-04-09 | B425: of:=IF(COUNTIF([.A425:.A$1000];[.A425]) > 1; 1; 0) -> 1
A426: 2020-04-09 | B426: of:=IF(COUNTIF([.A426:.A$1000];[.A426]) > 1; 1; 0) -> 1
A427: 2020-04-09 | B427: of:=IF(COUNTIF([.A427:.A$1000];[.A427]) > 1; 1; 0) -> 1
A428: 2020-04-09 | B428: of:=IF(COUNTIF([.A428:.A$1000];[.A428]) > 1; 1; 0) -> 1
A429: 2020-04-09 | B429: of:=IF(COUNTIF([.A429:.A$1000];[.A429]) > 1; 1; 0) -> 1
A430: 2020-04-09 | B430: of:=IF(COUNTIF([.A430:.A$1000];[.A430]) > 1; 1; 0) -> 1
A431: 2020-04-09 | B431: of:=IF(COUNTIF([.A431:.A$1000];[.A431]) > 1; 1; 0) -> 1
A432: 2020-04-09 | B432: of:=IF(COUNTIF([.A432:.A$1000];[.A432]) > 1; 1; 0) -> 1
A433: 2020-04-09 | B433: of:=IF(COUNTIF([.A433:.A$1000];[.A433]) > 1; 1; 0) -> 1
A434: 2020-04-09 | B434: of:=IF(COUNTIF([.A434:.A$1000];[.A434]) > 1; 1; 0) -> 0
A435: 2020-04-07 | B435: of:=IF(COUNTIF([.A435:.A$1000];[.A435]) > 1; 1; 0) -> 1
A436: 2020-04-07 | B436: of:=IF(COUNTIF([.A436:.A$1000];[.A436]) > 1; 1; 0) -> 1
A437: 2020-04-07 | B437: of:=IF(COUNTIF([.A437:.A$1000];[.A437]) > 1; 1; 0) -> 1
A438: 2020-04-07 | B438: of:=IF(COUNTIF([.A438:.A$1000];[.A438]) > 1; 1; 0) -> 1
A439: 2020-04-07 | B439: of:=IF(COUNTIF([.A439:.A$1000];[.A439]) > 1; 1; 0) -> 1
A440: 2020-04-07 | B440: of:=IF(COUNTIF([.A440:.A$1000];[.A440]) > 1; 1; 0) -> 1
A441: 2020-04-07 | B441: of:=IF(COUNTIF([.A441:.A$1000];[.A441]) > 1; 1; 0) -> 1
A442: 2020-04-07 | B442: of:=IF(COUNTIF([.A442:.A$1000];[.A442]) > 1; 1; 0) -> 1
A443: 2020-04-07 | B443: of:=IF(COUNTIF([.A443:.A$1000];[.A443]) > 1; 1; 0) -> 1
A444: 2020-04-07 | B444: of:=IF(COUNTIF([.A444:.A$1000];[.A444]) > 1; 1; 0) -> 1
A445: 2020-04-07 | B445: of:=IF(COUNTIF([.A445:.A$1000];[.A445]) > 1; 1; 0) -> 1
A446: 2020-04-07 | B446: of:=IF(COUNTIF([.A446:.A$1000];[.A446]) > 1; 1; 0) -> 1
A447: 2020-04-07 | B447: of:=IF(COUNTIF([.A447:.A$1000];[.A447]) > 1; 1; 0) -> 1
A448: 2020-04-07 | B448: of:=IF(COUNTIF([.A448:.A$1000];[.A448]) > 1; 1; 0) -> 0
A449: 2020-04-06 | B449: of:=IF(COUNTIF([.A449:.A$1000];[.A449]) > 1; 1; 0) -> 1
A450: 2020-04-06 | B450: of:=IF(COUNTIF([.A450:.A$1000];[.A450]) > 1; 1; 0) -> 1
A451: 2020-04-06 | B451: of:=IF(COUNTIF([.A451:.A$1000];[.A451]) > 1; 1; 0) -> 1
A452: 2020-04-06 | B452: of:=IF(COUNTIF([.A452:.A$1000];[.A452]) > 1; 1; 0) -> 1
A453: 2020-04-06 | B453: of:=IF(COUNTIF([.A453:.A$1000];[.A453]) > 1; 1; 0) -> 1
A454: 2020-04-06 | B454: of:=IF(COUNTIF([.A454:.A$1000];[.A454]) > 1; 1; 0) -> 1
A455: 2020-04-06 | B455: of:=IF(COUNTIF([.A455:.A$1000];[.A455]) > 1; 1; 0) -> 1
A456: 2020-04-06 | B456: of:=IF(COUNTIF([.A456:.A$1000];[.A456]) > 1; 1; 0) -> 1
A457: 2020-04-06 | B457: of:=IF(COUNTIF([.A457:.A$1000];[.A457]) > 1; 1; 0) -> 1
A458: 2020-04-06 | B458: of:=IF(COUNTIF([.A458:.A$1000];[.A458]) > 1; 1; 0) -> 1
A459: 2020-04-06 | B459: of:=IF(COUNTIF([.A459:.A$1000];[.A459]) > 1; 1; 0) -> 1
A460: 2020-04-06 | B460: of:=IF(COUNTIF([.A460:.A$1000];[.A460]) > 1; 1; 0) -> 1
A461: 2020-04-06 | B461: of:=IF(COUNTIF([.A461:.A$1000];[.A461]) > 1; 1; 0) -> 0
A462: 2020-04-02 | B462: of:=IF(COUNTIF([.A462:.A$1000];[.A462]) > 1; 1; 0) -> 1
A463: 2020-04-02 | B463: of:=IF(COUNTIF([.A463:.A$1000];[.A463]) > 1; 1; 0) -> 1
A464: 2020-04-02 | B464: of:=IF(COUNTIF([.A464:.A$1000];[.A464]) > 1; 1; 0) -> 1
A465: 2020-04-02 | B465: of:=IF(COUNTIF([.A465:.A$1000];[.A465]) > 1; 1; 0) -> 1
A466: 2020-04-02 | B466: of:=IF(COUNTIF([.A466:.A$1000];[.A466]) > 1; 1; 0) -> 1
A467: 2020-04-02 | B467: of:=IF(COUNTIF([.A467:.A$1000];[.A467]) > 1; 1; 0) -> 1
A468: 2020-04-02 | B468: of:=IF(COUNTIF([.A468:.A$1000];[.A468]) > 1; 1; 0) -> 0
A469: 2020-04-01 | B469: of:=IF(COUNTIF([.A469:.A$1000];[.A469]) > 1; 1; 0) -> 1
A470: 2020-04-01 | B470: of:=IF(COUNTIF([.A470:.A$1000];[.A470]) > 1; 1; 0) -> 1
A471: 2020-04-01 | B471: of:=IF(COUNTIF([.A471:.A$1000];[.A471]) > 1; 1; 0) -> 1
A472: 2020-04-01 | B472: of:=IF(COUNTIF([.A472:.A$1000];[.A472]) > 1; 1; 0) -> 1
A473: 2020-04-01 | B473: of:=IF(COUNTIF([.A473:.A$1000];[.A473]) > 1; 1; 0) -> 1
A474: 2020-04-01 | B474: of:=IF(COUNTIF([.A474:.A$1000];[.A474]) > 1; 1; 0) -> 1
A475: 2020-04-01 | B475: of:=IF(COUNTIF([.A475:.A$1000];[.A475]) > 1; 1; 0) -> 1
A476: 2020-04-01 | B476: of:=IF(COUNTIF([.A476:.A$1000];[.A476]) > 1; 1; 0) -> 1
A477: 2020-04-01 | B477: of:=IF(COUNTIF([.A477:.A$1000];[.A477]) > 1; 1; 0) -> 1
A478: 2020-04-01 | B478: of:=IF(COUNTIF([.A478:.A$1000];[.A478]) > 1; 1; 0) -> 1
A479: 2020-04-01 | B479: of:=IF(COUNTIF([.A479:.A$1000];[.A479]) > 1; 1; 0) -> 1
A480: 2020-04-01 | B480: of:=IF(COUNTIF([.A480:.A$1000];[.A480]) > 1; 1; 0) -> 1
A481: 2020-04-01 | B481: of:=IF(COUNTIF([.A481:.A$1000];[.A481]) > 1; 1; 0) -> 0
A482: 2020-03-31 | B482: of:=IF(COUNTIF([.A482:.A$1000];[.A482]) > 1; 1; 0) -> 1
A483: 2020-03-31 | B483: of:=IF(COUNTIF([.A483:.A$1000];[.A483]) > 1; 1; 0) -> 1
A484: 2020-03-31 | B484: of:=IF(COUNTIF([.A484:.A$1000];[.A484]) > 1; 1; 0) -> 1
A485: 2020-03-31 | B485: of:=IF(COUNTIF([.A485:.A$1000];[.A485]) > 1; 1; 0) -> 1
A486: 2020-03-31 | B486: of:=IF(COUNTIF([.A486:.A$1000];[.A486]) > 1; 1; 0) -> 1
A487: 2020-03-31 | B487: of:=IF(COUNTIF([.A487:.A$1000];[.A487]) > 1; 1; 0) -> 1
A488: 2020-03-31 | B488: of:=IF(COUNTIF([.A488:.A$1000];[.A488]) > 1; 1; 0) -> 1
A489: 2020-03-31 | B489: of:=IF(COUNTIF([.A489:.A$1000];[.A489]) > 1; 1; 0) -> 0
A490: 2020-03-30 | B490: of:=IF(COUNTIF([.A490:.A$1000];[.A490]) > 1; 1; 0) -> 1
A491: 2020-03-30 | B491: of:=IF(COUNTIF([.A491:.A$1000];[.A491]) > 1; 1; 0) -> 1
A492: 2020-03-30 | B492: of:=IF(COUNTIF([.A492:.A$1000];[.A492]) > 1; 1; 0) -> 1
A493: 2020-03-30 | B493: of:=IF(COUNTIF([.A493:.A$1000];[.A493]) > 1; 1; 0) -> 1
A494: 2020-03-30 | B494: of:=IF(COUNTIF([.A494:.A$1000];[.A494]) > 1; 1; 0) -> 1
A495: 2020-03-30 | B495: of:=IF(COUNTIF([.A495:.A$1000];[.A495]) > 1; 1; 0) -> 1
A496: 2020-03-30 | B496: of:=IF(COUNTIF([.A496:.A$1000];[.A496]) > 1; 1; 0) -> 1
A497: 2020-03-30 | B497: of:=IF(COUNTIF([.A497:.A$1000];[.A497]) > 1; 1; 0) -> 1
A498: 2020-03-30 | B498: of:=IF(COUNTIF([.A498:.A$1000];[.A498]) > 1; 1; 0) -> 1
A499: 2020-03-30 | B499: of:=IF(COUNTIF([.A499:.A$1000];[.A499]) > 1; 1; 0) -> 1
A500: 2020-03-30 | B500: of:=IF(COUNTIF([.A500:.A$1000];[.A500]) > 1; 1; 0) -> 1
A501: 2020-03-30 | B501: of:=IF(COUNTIF([.A501:.A$1000];[.A501]) > 1; 1; 0) -> 1
A502: 2020-03-30 | B502: of:=IF(COUNTIF([.A502:.A$1000];[.A502]) > 1; 1; 0) -> 1
A503: 2020-03-30 | B503: of:=IF(COUNTIF([.A503:.A$1000];[.A503]) > 1; 1; 0) -> 1
A504: 2020-03-30 | B504: of:=IF(COUNTIF([.A504:.A$1000];[.A504]) > 1; 1; 0) -> 1
A505: 2020-03-30 | B505: of:=IF(COUNTIF([.A505:.A$1000];[.A505]) > 1; 1; 0) -> 1
A506: 2020-03-30 | B506: of:=IF(COUNTIF([.A506:.A$1000];[.A506]) > 1; 1; 0) -> 1
A507: 2020-03-30 | B507: of:=IF(COUNTIF([.A507:.A$1000];[.A507]) > 1; 1; 0) -> 1
A508: 2020-03-30 | B508: of:=IF(COUNTIF([.A508:.A$1000];[.A508]) > 1; 1; 0) -> 1
A509: 2020-03-30 | B509: of:=IF(COUNTIF([.A509:.A$1000];[.A509]) > 1; 1; 0) -> 1
A510: 2020-03-30 | B510: of:=IF(COUNTIF([.A510:.A$1000];[.A510]) > 1; 1; 0) -> 1
A511: 2020-03-30 | B511: of:=IF(COUNTIF([.A511:.A$1000];[.A511]) > 1; 1; 0) -> 1
A512: 2020-03-30 | B512: of:=IF(COUNTIF([.A512:.A$1000];[.A512]) > 1; 1; 0) -> 0
A513: 2020-03-29 | B513: of:=IF(COUNTIF([.A513:.A$1000];[.A513]) > 1; 1; 0) -> 1
A514: 2020-03-29 | B514: of:=IF(COUNTIF([.A514:.A$1000];[.A514]) > 1; 1; 0) -> 1
A515: 2020-03-29 | B515: of:=IF(COUNTIF([.A515:.A$1000];[.A515]) > 1; 1; 0) -> 1
A516: 2020-03-29 | B516: of:=IF(COUNTIF([.A516:.A$1000];[.A516]) > 1; 1; 0) -> 1
A517: 2020-03-29 | B517: of:=IF(COUNTIF([.A517:.A$1000];[.A517]) > 1; 1; 0) -> 1
A518: 2020-03-29 | B518: of:=IF(COUNTIF([.A518:.A$1000];[.A518]) > 1; 1; 0) -> 1
A519: 2020-03-29 | B519: of:=IF(COUNTIF([.A519:.A$1000];[.A519]) > 1; 1; 0) -> 1
A520: 2020-03-29 | B520: of:=IF(COUNTIF([.A520:.A$1000];[.A520]) > 1; 1; 0) -> 1
A521: 2020-03-29 | B521: of:=IF(COUNTIF([.A521:.A$1000];[.A521]) > 1; 1; 0) -> 1
A522: 2020-03-29 | B522: of:=IF(COUNTIF([.A522:.A$1000];[.A522]) > 1; 1; 0) -> 1
A523: 2020-03-29 | B523: of:=IF(COUNTIF([.A523:.A$1000];[.A523]) > 1; 1; 0) -> 1
A524: 2020-03-29 | B524: of:=IF(COUNTIF([.A524:.A$1000];[.A524]) > 1; 1; 0) -> 1
A525: 2020-03-29 | B525: of:=IF(COUNTIF([.A525:.A$1000];[.A525]) > 1; 1; 0) -> 1
A526: 2020-03-29 | B526: of:=IF(COUNTIF([.A526:.A$1000];[.A526]) > 1; 1; 0) -> 1
A527: 2020-03-29 | B527: of:=IF(COUNTIF([.A527:.A$1000];[.A527]) > 1; 1; 0) -> 1
A528: 2020-03-29 | B528: of:=IF(COUNTIF([.A528:.A$1000];[.A528]) > 1; 1; 0) -> 1
A529: 2020-03-29 | B529: of:=IF(COUNTIF([.A529:.A$1000];[.A529]) > 1; 1; 0) -> 1
A530: 2020-03-29 | B530: of:=IF(COUNTIF([.A530:.A$1000];[.A530]) > 1; 1; 0) -> 1
A531: 2020-03-29 | B531: of:=IF(COUNTIF([.A531:.A$1000];[.A531]) > 1; 1; 0) -> 1
A532: 2020-03-29 | B532: of:=IF(COUNTIF([.A532:.A$1000];[.A532]) > 1; 1; 0) -> 0
A533: 2020-03-28 | B533: of:=IF(COUNTIF([.A533:.A$1000];[.A533]) > 1; 1; 0) -> 1
A534: 2020-03-28 | B534: of:=IF(COUNTIF([.A534:.A$1000];[.A534]) > 1; 1; 0) -> 1
A535: 2020-03-28 | B535: of:=IF(COUNTIF([.A535:.A$1000];[.A535]) > 1; 1; 0) -> 1
A536: 2020-03-28 | B536: of:=IF(COUNTIF([.A536:.A$1000];[.A536]) > 1; 1; 0) -> 1
A537: 2020-03-28 | B537: of:=IF(COUNTIF([.A537:.A$1000];[.A537]) > 1; 1; 0) -> 1
A538: 2020-03-28 | B538: of:=IF(COUNTIF([.A538:.A$1000];[.A538]) > 1; 1; 0) -> 1
A539: 2020-03-28 | B539: of:=IF(COUNTIF([.A539:.A$1000];[.A539]) > 1; 1; 0) -> 1
A540: 2020-03-28 | B540: of:=IF(COUNTIF([.A540:.A$1000];[.A540]) > 1; 1; 0) -> 1
A541: 2020-03-28 | B541: of:=IF(COUNTIF([.A541:.A$1000];[.A541]) > 1; 1; 0) -> 1
A542: 2020-03-28 | B542: of:=IF(COUNTIF([.A542:.A$1000];[.A542]) > 1; 1; 0) -> 1
A543: 2020-03-28 | B543: of:=IF(COUNTIF([.A543:.A$1000];[.A543]) > 1; 1; 0) -> 1
A544: 2020-03-28 | B544: of:=IF(COUNTIF([.A544:.A$1000];[.A544]) > 1; 1; 0) -> 1
A545: 2020-03-28 | B545: of:=IF(COUNTIF([.A545:.A$1000];[.A545]) > 1; 1; 0) -> 1
A546: 2020-03-28 | B546: of:=IF(COUNTIF([.A546:.A$1000];[.A546]) > 1; 1; 0) -> 1
A547: 2020-03-28 | B547: of:=IF(COUNTIF([.A547:.A$1000];[.A547]) > 1; 1; 0) -> 1
A548: 2020-03-28 | B548: of:=IF(COUNTIF([.A548:.A$1000];[.A548]) > 1; 1; 0) -> 0
A549: 2020-03-27 | B549: of:=IF(COUNTIF([.A549:.A$1000];[.A549]) > 1; 1; 0) -> 1
A550: 2020-03-27 | B550: of:=IF(COUNTIF([.A550:.A$1000];[.A550]) > 1; 1; 0) -> 1
A551: 2020-03-27 | B551: of:=IF(COUNTIF([.A551:.A$1000];[.A551]) > 1; 1; 0) -> 1
A552: 2020-03-27 | B552: of:=IF(COUNTIF([.A552:.A$1000];[.A552]) > 1; 1; 0) -> 1
A553: 2020-03-27 | B553: of:=IF(COUNTIF([.A553:.A$1000];[.A553]) > 1; 1; 0) -> 1
A554: 2020-03-27 | B554: of:=IF(COUNTIF([.A554:.A$1000];[.A554]) > 1; 1; 0) -> 1
A555: 2020-03-27 | B555: of:=IF(COUNTIF([.A555:.A$1000];[.A555]) > 1; 1; 0) -> 1
A556: 2020-03-27 | B556: of:=IF(COUNTIF([.A556:.A$1000];[.A556]) > 1; 1; 0) -> 1
A557: 2020-03-27 | B557: of:=IF(COUNTIF([.A557:.A$1000];[.A557]) > 1; 1; 0) -> 1
A558: 2020-03-27 | B558: of:=IF(COUNTIF([.A558:.A$1000];[.A558]) > 1; 1; 0) -> 1
A559: 2020-03-27 | B559: of:=IF(COUNTIF([.A559:.A$1000];[.A559]) > 1; 1; 0) -> 1
A560: 2020-03-27 | B560: of:=IF(COUNTIF([.A560:.A$1000];[.A560]) > 1; 1; 0) -> 1
A561: 2020-03-27 | B561: of:=IF(COUNTIF([.A561:.A$1000];[.A561]) > 1; 1; 0) -> 1
A562: 2020-03-27 | B562: of:=IF(COUNTIF([.A562:.A$1000];[.A562]) > 1; 1; 0) -> 1
A563: 2020-03-27 | B563: of:=IF(COUNTIF([.A563:.A$1000];[.A563]) > 1; 1; 0) -> 1
A564: 2020-03-27 | B564: of:=IF(COUNTIF([.A564:.A$1000];[.A564]) > 1; 1; 0) -> 1
A565: 2020-03-27 | B565: of:=IF(COUNTIF([.A565:.A$1000];[.A565]) > 1; 1; 0) -> 1
A566: 2020-03-27 | B566: of:=IF(COUNTIF([.A566:.A$1000];[.A566]) > 1; 1; 0) -> 1
A567: 2020-03-27 | B567: of:=IF(COUNTIF([.A567:.A$1000];[.A567]) > 1; 1; 0) -> 1
A568: 2020-03-27 | B568: of:=IF(COUNTIF([.A568:.A$1000];[.A568]) > 1; 1; 0) -> 1
A569: 2020-03-27 | B569: of:=IF(COUNTIF([.A569:.A$1000];[.A569]) > 1; 1; 0) -> 1
A570: 2020-03-27 | B570: of:=IF(COUNTIF([.A570:.A$1000];[.A570]) > 1; 1; 0) -> 1
A571: 2020-03-27 | B571: of:=IF(COUNTIF([.A571:.A$1000];[.A571]) > 1; 1; 0) -> 1
A572: 2020-03-27 | B572: of:=IF(COUNTIF([.A572:.A$1000];[.A572]) > 1; 1; 0) -> 1
A573: 2020-03-27 | B573: of:=IF(COUNTIF([.A573:.A$1000];[.A573]) > 1; 1; 0) -> 1
A574: 2020-03-27 | B574: of:=IF(COUNTIF([.A574:.A$1000];[.A574]) > 1; 1; 0) -> 1
A575: 2020-03-27 | B575: of:=IF(COUNTIF([.A575:.A$1000];[.A575]) > 1; 1; 0) -> 1
A576: 2020-03-27 | B576: of:=IF(COUNTIF([.A576:.A$1000];[.A576]) > 1; 1; 0) -> 1
A577: 2020-03-27 | B577: of:=IF(COUNTIF([.A577:.A$1000];[.A577]) > 1; 1; 0) -> 1
A578: 2020-03-27 | B578: of:=IF(COUNTIF([.A578:.A$1000];[.A578]) > 1; 1; 0) -> 1
A579: 2020-03-27 | B579: of:=IF(COUNTIF([.A579:.A$1000];[.A579]) > 1; 1; 0) -> 1
A580: 2020-03-27 | B580: of:=IF(COUNTIF([.A580:.A$1000];[.A580]) > 1; 1; 0) -> 0
A581: 2020-03-26 | B581: of:=IF(COUNTIF([.A581:.A$1000];[.A581]) > 1; 1; 0) -> 1
A582: 2020-03-26 | B582: of:=IF(COUNTIF([.A582:.A$1000];[.A582]) > 1; 1; 0) -> 1
A583: 2020-03-26 | B583: of:=IF(COUNTIF([.A583:.A$1000];[.A583]) > 1; 1; 0) -> 1
A584: 2020-03-26 | B584: of:=IF(COUNTIF([.A584:.A$1000];[.A584]) > 1; 1; 0) -> 1
A585: 2020-03-26 | B585: of:=IF(COUNTIF([.A585:.A$1000];[.A585]) > 1; 1; 0) -> 1
A586: 2020-03-26 | B586: of:=IF(COUNTIF([.A586:.A$1000];[.A586]) > 1; 1; 0) -> 1
A587: 2020-03-26 | B587: of:=IF(COUNTIF([.A587:.A$1000];[.A587]) > 1; 1; 0) -> 1
A588: 2020-03-26 | B588: of:=IF(COUNTIF([.A588:.A$1000];[.A588]) > 1; 1; 0) -> 1
A589: 2020-03-26 | B589: of:=IF(COUNTIF([.A589:.A$1000];[.A589]) > 1; 1; 0) -> 1
A590: 2020-03-26 | B590: of:=IF(COUNTIF([.A590:.A$1000];[.A590]) > 1; 1; 0) -> 1
A591: 2020-03-26 | B591: of:=IF(COUNTIF([.A591:.A$1000];[.A591]) > 1; 1; 0) -> 1
A592: 2020-03-26 | B592: of:=IF(COUNTIF([.A592:.A$1000];[.A592]) > 1; 1; 0) -> 1
A593: 2020-03-26 | B593: of:=IF(COUNTIF([.A593:.A$1000];[.A593]) > 1; 1; 0) -> 1
A594: 2020-03-26 | B594: of:=IF(COUNTIF([.A594:.A$1000];[.A594]) > 1; 1; 0) -> 1
A595: 2020-03-26 | B595: of:=IF(COUNTIF([.A595:.A$1000];[.A595]) > 1; 1; 0) -> 1
A596: 2020-03-26 | B596: of:=IF(COUNTIF([.A596:.A$1000];[.A596]) > 1; 1; 0) -> 1
A597: 2020-03-26 | B597: of:=IF(COUNTIF([.A597:.A$1000];[.A597]) > 1; 1; 0) -> 1
A598: 2020-03-26 | B598: of:=IF(COUNTIF([.A598:.A$1000];[.A598]) > 1; 1; 0) -> 1
A599: 2020-03-26 | B599: of:=IF(COUNTIF([.A599:.A$1000];[.A599]) > 1; 1; 0) -> 1
A600: 2020-03-26 | B600: of:=IF(COUNTIF([.A600:.A$1000];[.A600]) > 1; 1; 0) -> 1
A601: 2020-03-26 | B601: of:=IF(COUNTIF([.A601:.A$1000];[.A601]) > 1; 1; 0) -> 1
A602: 2020-03-26 | B602: of:=IF(COUNTIF([.A602:.A$1000];[.A602]) > 1; 1; 0) -> 0
A603: 2020-03-25 | B603: of:=IF(COUNTIF([.A603:.A$1000];[.A603]) > 1; 1; 0) -> 0
A604: 2020-03-24 | B604: of:=IF(COUNTIF([.A604:.A$1000];[.A604]) > 1; 1; 0) -> 1
A605: 2020-03-24 | B605: of:=IF(COUNTIF([.A605:.A$1000];[.A605]) > 1; 1; 0) -> 1
A606: 2020-03-24 | B606: of:=IF(COUNTIF([.A606:.A$1000];[.A606]) > 1; 1; 0) -> 1
A607: 2020-03-24 | B607: of:=IF(COUNTIF([.A607:.A$1000];[.A607]) > 1; 1; 0) -> 1
A608: 2020-03-24 | B608: of:=IF(COUNTIF([.A608:.A$1000];[.A608]) > 1; 1; 0) -> 1
A609: 2020-03-24 | B609: of:=IF(COUNTIF([.A609:.A$1000];[.A609]) > 1; 1; 0) -> 1
A610: 2020-03-24 | B610: of:=IF(COUNTIF([.A610:.A$1000];[.A610]) > 1; 1; 0) -> 1
A611: 2020-03-24 | B611: of:=IF(COUNTIF([.A611:.A$1000];[.A611]) > 1; 1; 0) -> 1
A612: 2020-03-24 | B612: of:=IF(COUNTIF([.A612:.A$1000];[.A612]) > 1; 1; 0) -> 1
A613: 2020-03-24 | B613: of:=IF(COUNTIF([.A613:.A$1000];[.A613]) > 1; 1; 0) -> 1
A614: 2020-03-24 | B614: of:=IF(COUNTIF([.A614:.A$1000];[.A614]) > 1; 1; 0) -> 1
A615: 2020-03-24 | B615: of:=IF(COUNTIF([.A615:.A$1000];[.A615]) > 1; 1; 0) -> 1
A616: 2020-03-24 | B616: of:=IF(COUNTIF([.A616:.A$1000];[.A616]) > 1; 1; 0) -> 0
A617: 2020-03-23 | B617: of:=IF(COUNTIF([.A617:.A$1000];[.A617]) > 1; 1; 0) -> 1
A618: 2020-03-23 | B618: of:=IF(COUNTIF([.A618:.A$1000];[.A618]) > 1; 1; 0) -> 1
A619: 2020-03-23 | B619: of:=IF(COUNTIF([.A619:.A$1000];[.A619]) > 1; 1; 0) -> 1
A620: 2020-03-23 | B620: of:=IF(COUNTIF([.A620:.A$1000];[.A620]) > 1; 1; 0) -> 1
A621: 2020-03-23 | B621: of:=IF(COUNTIF([.A621:.A$1000];[.A621]) > 1; 1; 0) -> 1
A622: 2020-03-23 | B622: of:=IF(COUNTIF([.A622:.A$1000];[.A622]) > 1; 1; 0) -> 1
A623: 2020-03-23 | B623: of:=IF(COUNTIF([.A623:.A$1000];[.A623]) > 1; 1; 0) -> 1
A624: 2020-03-23 | B624: of:=IF(COUNTIF([.A624:.A$1000];[.A624]) > 1; 1; 0) -> 1
A625: 2020-03-23 | B625: of:=IF(COUNTIF([.A625:.A$1000];[.A625]) > 1; 1; 0) -> 1
A626: 2020-03-23 | B626: of:=IF(COUNTIF([.A626:.A$1000];[.A626]) > 1; 1; 0) -> 1
A627: 2020-03-23 | B627: of:=IF(COUNTIF([.A627:.A$1000];[.A627]) > 1; 1; 0) -> 1
A628: 2020-03-23 | B628: of:=IF(COUNTIF([.A628:.A$1000];[.A628]) > 1; 1; 0) -> 0
A629: 2020-03-11 | B629: of:=IF(COUNTIF([.A629:.A$1000];[.A629]) > 1; 1; 0) -> 1
A630: 2020-03-11 | B630: of:=IF(COUNTIF([.A630:.A$1000];[.A630]) > 1; 1; 0) -> 1
A631: 2020-03-11 | B631: of:=IF(COUNTIF([.A631:.A$1000];[.A631]) > 1; 1; 0) -> 1
A632: 2020-03-11 | B632: of:=IF(COUNTIF([.A632:.A$1000];[.A632]) > 1; 1; 0) -> 1
A633: 2020-03-11 | B633: of:=IF(COUNTIF([.A633:.A$1000];[.A633]) > 1; 1; 0) -> 1
A634: 2020-03-11 | B634: of:=IF(COUNTIF([.A634:.A$1000];[.A634]) > 1; 1; 0) -> 1
A635: 2020-03-11 | B635: of:=IF(COUNTIF([.A635:.A$1000];[.A635]) > 1; 1; 0) -> 0
A636: 2020-03-10 | B636: of:=IF(COUNTIF([.A636:.A$1000];[.A636]) > 1; 1; 0) -> 1
A637: 2020-03-10 | B637: of:=IF(COUNTIF([.A637:.A$1000];[.A637]) > 1; 1; 0) -> 1
A638: 2020-03-10 | B638: of:=IF(COUNTIF([.A638:.A$1000];[.A638]) > 1; 1; 0) -> 1
A639: 2020-03-10 | B639: of:=IF(COUNTIF([.A639:.A$1000];[.A639]) > 1; 1; 0) -> 1
A640: 2020-03-10 | B640: of:=IF(COUNTIF([.A640:.A$1000];[.A640]) > 1; 1; 0) -> 1
A641: 2020-03-10 | B641: of:=IF(COUNTIF([.A641:.A$1000];[.A641]) > 1; 1; 0) -> 1
A642: 2020-03-10 | B642: of:=IF(COUNTIF([.A642:.A$1000];[.A642]) > 1; 1; 0) -> 1
A643: 2020-03-10 | B643: of:=IF(COUNTIF([.A643:.A$1000];[.A643]) > 1; 1; 0) -> 1
A644: 2020-03-10 | B644: of:=IF(COUNTIF([.A644:.A$1000];[.A644]) > 1; 1; 0) -> 1
A645: 2020-03-10 | B645: of:=IF(COUNTIF([.A645:.A$1000];[.A645]) > 1; 1; 0) -> 1
A646: 2020-03-10 | B646: of:=IF(COUNTIF([.A646:.A$1000];[.A646]) > 1; 1; 0) -> 1
A647: 2020-03-10 | B647: of:=IF(COUNTIF([.A647:.A$1000];[.A647]) > 1; 1; 0) -> 1
A648: 2020-03-10 | B648: of:=IF(COUNTIF([.A648:.A$1000];[.A648]) > 1; 1; 0) -> 1
A649: 2020-03-10 | B649: of:=IF(COUNTIF([.A649:.A$1000];[.A649]) > 1; 1; 0) -> 1
A650: 2020-03-10 | B650: of:=IF(COUNTIF([.A650:.A$1000];[.A650]) > 1; 1; 0) -> 1
A651: 2020-03-10 | B651: of:=IF(COUNTIF([.A651:.A$1000];[.A651]) > 1; 1; 0) -> 1
A652: 2020-03-10 | B652: of:=IF(COUNTIF([.A652:.A$1000];[.A652]) > 1; 1; 0) -> 1
A653: 2020-03-10 | B653: of:=IF(COUNTIF([.A653:.A$1000];[.A653]) > 1; 1; 0) -> 1
A654: 2020-03-10 | B654: of:=IF(COUNTIF([.A654:.A$1000];[.A654]) > 1; 1; 0) -> 1
A655: 2020-03-10 | B655: of:=IF(COUNTIF([.A655:.A$1000];[.A655]) > 1; 1; 0) -> 1
A656: 2020-03-10 | B656: of:=IF(COUNTIF([.A656:.A$1000];[.A656]) > 1; 1; 0) -> 1
A657: 2020-03-10 | B657: of:=IF(COUNTIF([.A657:.A$1000];[.A657]) > 1; 1; 0) -> 1
A658: 2020-03-10 | B658: of:=IF(COUNTIF([.A658:.A$1000];[.A658]) > 1; 1; 0) -> 1
A659: 2020-03-10 | B659: of:=IF(COUNTIF([.A659:.A$1000];[.A659]) > 1; 1; 0) -> 1
A660: 2020-03-10 | B660: of:=IF(COUNTIF([.A660:.A$1000];[.A660]) > 1; 1; 0) -> 0
A661: 2020-03-08 | B661: of:=IF(COUNTIF([.A661:.A$1000];[.A661]) > 1; 1; 0) -> 1
A662: 2020-03-08 | B662: of:=IF(COUNTIF([.A662:.A$1000];[.A662]) > 1; 1; 0) -> 1
A663: 2020-03-08 | B663: of:=IF(COUNTIF([.A663:.A$1000];[.A663]) > 1; 1; 0) -> 0
A664: 2020-03-06 | B664: of:=IF(COUNTIF([.A664:.A$1000];[.A664]) > 1; 1; 0) -> 1
A665: 2020-03-06 | B665: of:=IF(COUNTIF([.A665:.A$1000];[.A665]) > 1; 1; 0) -> 1
A666: 2020-03-06 | B666: of:=IF(COUNTIF([.A666:.A$1000];[.A666]) > 1; 1; 0) -> 1
A667: 2020-03-06 | B667: of:=IF(COUNTIF([.A667:.A$1000];[.A667]) > 1; 1; 0) -> 1
A668: 2020-03-06 | B668: of:=IF(COUNTIF([.A668:.A$1000];[.A668]) > 1; 1; 0) -> 0
A669: 2020-03-05 | B669: of:=IF(COUNTIF([.A669:.A$1000];[.A669]) > 1; 1; 0) -> 1
A670: 2020-03-05 | B670: of:=IF(COUNTIF([.A670:.A$1000];[.A670]) > 1; 1; 0) -> 0
A671: 2020-02-18 | B671: of:=IF(COUNTIF([.A671:.A$1000];[.A671]) > 1; 1; 0) -> 1
A672: 2020-02-18 | B672: of:=IF(COUNTIF([.A672:.A$1000];[.A672]) > 1; 1; 0) -> 1
A673: 2020-02-18 | B673: of:=IF(COUNTIF([.A673:.A$1000];[.A673]) > 1; 1; 0) -> 1
A674: 2020-02-18 | B674: of:=IF(COUNTIF([.A674:.A$1000];[.A674]) > 1; 1; 0) -> 1
A675: 2020-02-18 | B675: of:=IF(COUNTIF([.A675:.A$1000];[.A675]) > 1; 1; 0) -> 1
A676: 2020-02-18 | B676: of:=IF(COUNTIF([.A676:.A$1000];[.A676]) > 1; 1; 0) -> 1
A677: 2020-02-18 | B677: of:=IF(COUNTIF([.A677:.A$1000];[.A677]) > 1; 1; 0) -> 1
A678: 2020-02-18 | B678: of:=IF(COUNTIF([.A678:.A$1000];[.A678]) > 1; 1; 0) -> 1
A679: 2020-02-18 | B679: of:=IF(COUNTIF([.A679:.A$1000];[.A679]) > 1; 1; 0) -> 1
A680: 2020-02-18 | B680: of:=IF(COUNTIF([.A680:.A$1000];[.A680]) > 1; 1; 0) -> 1
A681: 2020-02-18 | B681: of:=IF(COUNTIF([.A681:.A$1000];[.A681]) > 1; 1; 0) -> 1
A682: 2020-02-18 | B682: of:=IF(COUNTIF([.A682:.A$1000];[.A682]) > 1; 1; 0) -> 0
A683: 2020-02-17 | B683: of:=IF(COUNTIF([.A683:.A$1000];[.A683]) > 1; 1; 0) -> 1
A684: 2020-02-17 | B684: of:=IF(COUNTIF([.A684:.A$1000];[.A684]) > 1; 1; 0) -> 1
A685: 2020-02-17 | B685: of:=IF(COUNTIF([.A685:.A$1000];[.A685]) > 1; 1; 0) -> 0
A686: 2020-02-16 | B686: of:=IF(COUNTIF([.A686:.A$1000];[.A686]) > 1; 1; 0) -> 1
A687: 2020-02-16 | B687: of:=IF(COUNTIF([.A687:.A$1000];[.A687]) > 1; 1; 0) -> 1
A688: 2020-02-16 | B688: of:=IF(COUNTIF([.A688:.A$1000];[.A688]) > 1; 1; 0) -> 1
A689: 2020-02-16 | B689: of:=IF(COUNTIF([.A689:.A$1000];[.A689]) > 1; 1; 0) -> 1
A690: 2020-02-16 | B690: of:=IF(COUNTIF([.A690:.A$1000];[.A690]) > 1; 1; 0) -> 1
A691: 2020-02-16 | B691: of:=IF(COUNTIF([.A691:.A$1000];[.A691]) > 1; 1; 0) -> 1
A692: 2020-02-16 | B692: of:=IF(COUNTIF([.A692:.A$1000];[.A692]) > 1; 1; 0) -> 1
A693: 2020-02-16 | B693: of:=IF(COUNTIF([.A693:.A$1000];[.A693]) > 1; 1; 0) -> 1
A694: 2020-02-16 | B694: of:=IF(COUNTIF([.A694:.A$1000];[.A694]) > 1; 1; 0) -> 1
A695: 2020-02-16 | B695: of:=IF(COUNTIF([.A695:.A$1000];[.A695]) > 1; 1; 0) -> 1
A696: 2020-02-16 | B696: of:=IF(COUNTIF([.A696:.A$1000];[.A696]) > 1; 1; 0) -> 1
A697: 2020-02-16 | B697: of:=IF(COUNTIF([.A697:.A$1000];[.A697]) > 1; 1; 0) -> 1
A698: 2020-02-16 | B698: of:=IF(COUNTIF([.A698:.A$1000];[.A698]) > 1; 1; 0) -> 1
A699: 2020-02-16 | B699: of:=IF(COUNTIF([.A699:.A$1000];[.A699]) > 1; 1; 0) -> 1
A700: 2020-02-16 | B700: of:=IF(COUNTIF([.A700:.A$1000];[.A700]) > 1; 1; 0) -> 1
A701: 2020-02-16 | B701: of:=IF(COUNTIF([.A701:.A$1000];[.A701]) > 1; 1; 0) -> 1
A702: 2020-02-16 | B702: of:=IF(COUNTIF([.A702:.A$1000];[.A702]) > 1; 1; 0) -> 1
A703: 2020-02-16 | B703: of:=IF(COUNTIF([.A703:.A$1000];[.A703]) > 1; 1; 0) -> 0
A704: 2020-02-15 | B704: of:=IF(COUNTIF([.A704:.A$1000];[.A704]) > 1; 1; 0) -> 1
A705: 2020-02-15 | B705: of:=IF(COUNTIF([.A705:.A$1000];[.A705]) > 1; 1; 0) -> 1
A706: 2020-02-15 | B706: of:=IF(COUNTIF([.A706:.A$1000];[.A706]) > 1; 1; 0) -> 0
A707: 2020-02-11 | B707: of:=IF(COUNTIF([.A707:.A$1000];[.A707]) > 1; 1; 0) -> 1
A708: 2020-02-11 | B708: of:=IF(COUNTIF([.A708:.A$1000];[.A708]) > 1; 1; 0) -> 0
A709: 2020-02-10 | B709: of:=IF(COUNTIF([.A709:.A$1000];[.A709]) > 1; 1; 0) -> 1
A710: 2020-02-10 | B710: of:=IF(COUNTIF([.A710:.A$1000];[.A710]) > 1; 1; 0) -> 1
A711: 2020-02-10 | B711: of:=IF(COUNTIF([.A711:.A$1000];[.A711]) > 1; 1; 0) -> 1
A712: 2020-02-10 | B712: of:=IF(COUNTIF([.A712:.A$1000];[.A712]) > 1; 1; 0) -> 1
A713: 2020-02-10 | B713: of:=IF(COUNTIF([.A713:.A$1000];[.A713]) > 1; 1; 0) -> 1
A714: 2020-02-10 | B714: of:=IF(COUNTIF([.A714:.A$1000];[.A714]) > 1; 1; 0) -> 1
A715: 2020-02-10 | B715: of:=IF(COUNTIF([.A715:.A$1000];[.A715]) > 1; 1; 0) -> 1
A716: 2020-02-10 | B716: of:=IF(COUNTIF([.A716:.A$1000];[.A716]) > 1; 1; 0) -> 1
A717: 2020-02-10 | B717: of:=IF(COUNTIF([.A717:.A$1000];[.A717]) > 1; 1; 0) -> 1
A718: 2020-02-10 | B718: of:=IF(COUNTIF([.A718:.A$1000];[.A718]) > 1; 1; 0) -> 1
A719: 2020-02-10 | B719: of:=IF(COUNTIF([.A719:.A$1000];[.A719]) > 1; 1; 0) -> 1
A720: 2020-02-10 | B720: of:=IF(COUNTIF([.A720:.A$1000];[.A720]) > 1; 1; 0) -> 0
A721: 2020-02-07 | B721: of:=IF(COUNTIF([.A721:.A$1000];[.A721]) > 1; 1; 0) -> 1
A722: 2020-02-07 | B722: of:=IF(COUNTIF([.A722:.A$1000];[.A722]) > 1; 1; 0) -> 1
A723: 2020-02-07 | B723: of:=IF(COUNTIF([.A723:.A$1000];[.A723]) > 1; 1; 0) -> 1
A724: 2020-02-07 | B724: of:=IF(COUNTIF([.A724:.A$1000];[.A724]) > 1; 1; 0) -> 1
A725: 2020-02-07 | B725: of:=IF(COUNTIF([.A725:.A$1000];[.A725]) > 1; 1; 0) -> 0
A726: 2020-02-06 | B726: of:=IF(COUNTIF([.A726:.A$1000];[.A726]) > 1; 1; 0) -> 1
A727: 2020-02-06 | B727: of:=IF(COUNTIF([.A727:.A$1000];[.A727]) > 1; 1; 0) -> 1
A728: 2020-02-06 | B728: of:=IF(COUNTIF([.A728:.A$1000];[.A728]) > 1; 1; 0) -> 1
A729: 2020-02-06 | B729: of:=IF(COUNTIF([.A729:.A$1000];[.A729]) > 1; 1; 0) -> 1
A730: 2020-02-06 | B730: of:=IF(COUNTIF([.A730:.A$1000];[.A730]) > 1; 1; 0) -> 1
A731: 2020-02-06 | B731: of:=IF(COUNTIF([.A731:.A$1000];[.A731]) > 1; 1; 0) -> 1
A732: 2020-02-06 | B732: of:=IF(COUNTIF([.A732:.A$1000];[.A732]) > 1; 1; 0) -> 1
A733: 2020-02-06 | B733: of:=IF(COUNTIF([.A733:.A$1000];[.A733]) > 1; 1; 0) -> 1
A734: 2020-02-06 | B734: of:=IF(COUNTIF([.A734:.A$1000];[.A734]) > 1; 1; 0) -> 1
A735: 2020-02-06 | B735: of:=IF(COUNTIF([.A735:.A$1000];[.A735]) > 1; 1; 0) -> 1
A736: 2020-02-06 | B736: of:=IF(COUNTIF([.A736:.A$1000];[.A736]) > 1; 1; 0) -> 1
A737: 2020-02-06 | B737: of:=IF(COUNTIF([.A737:.A$1000];[.A737]) > 1; 1; 0) -> 1
A738: 2020-02-06 | B738: of:=IF(COUNTIF([.A738:.A$1000];[.A738]) > 1; 1; 0) -> 1
A739: 2020-02-06 | B739: of:=IF(COUNTIF([.A739:.A$1000];[.A739]) > 1; 1; 0) -> 1
A740: 2020-02-06 | B740: of:=IF(COUNTIF([.A740:.A$1000];[.A740]) > 1; 1; 0) -> 1
A741: 2020-02-06 | B741: of:=IF(COUNTIF([.A741:.A$1000];[.A741]) > 1; 1; 0) -> 0
A742: 2020-02-05 | B742: of:=IF(COUNTIF([.A742:.A$1000];[.A742]) > 1; 1; 0) -> 1
A743: 2020-02-05 | B743: of:=IF(COUNTIF([.A743:.A$1000];[.A743]) > 1; 1; 0) -> 1
A744: 2020-02-05 | B744: of:=IF(COUNTIF([.A744:.A$1000];[.A744]) > 1; 1; 0) -> 0
A745: 2019-11-16 | B745: of:=IF(COUNTIF([.A745:.A$1000];[.A745]) > 1; 1; 0) -> 0
A746: 2019-11-12 | B746: of:=IF(COUNTIF([.A746:.A$1000];[.A746]) > 1; 1; 0) -> 1
A747: 2019-11-12 | B747: of:=IF(COUNTIF([.A747:.A$1000];[.A747]) > 1; 1; 0) -> 1
A748: 2019-11-12 | B748: of:=IF(COUNTIF([.A748:.A$1000];[.A748]) > 1; 1; 0) -> 1
A749: 2019-11-12 | B749: of:=IF(COUNTIF([.A749:.A$1000];[.A749]) > 1; 1; 0) -> 1
A750: 2019-11-12 | B750: of:=IF(COUNTIF([.A750:.A$1000];[.A750]) > 1; 1; 0) -> 1
A751: 2019-11-12 | B751: of:=IF(COUNTIF([.A751:.A$1000];[.A751]) > 1; 1; 0) -> 1
A752: 2019-11-12 | B752: of:=IF(COUNTIF([.A752:.A$1000];[.A752]) > 1; 1; 0) -> 1
A753: 2019-11-12 | B753: of:=IF(COUNTIF([.A753:.A$1000];[.A753]) > 1; 1; 0) -> 1
A754: 2019-11-12 | B754: of:=IF(COUNTIF([.A754:.A$1000];[.A754]) > 1; 1; 0) -> 1
A755: 2019-11-12 | B755: of:=IF(COUNTIF([.A755:.A$1000];[.A755]) > 1; 1; 0) -> 1
A756: 2019-11-12 | B756: of:=IF(COUNTIF([.A756:.A$1000];[.A756]) > 1; 1; 0) -> 1
A757: 2019-11-12 | B757: of:=IF(COUNTIF([.A757:.A$1000];[.A757]) > 1; 1; 0) -> 1
A758: 2019-11-12 | B758: of:=IF(COUNTIF([.A758:.A$1000];[.A758]) > 1; 1; 0) -> 1
A759: 2019-11-12 | B759: of:=IF(COUNTIF([.A759:.A$1000];[.A759]) > 1; 1; 0) -> 1
A760: 2019-11-12 | B760: of:=IF(COUNTIF([.A760:.A$1000];[.A760]) > 1; 1; 0) -> 1
A761: 2019-11-12 | B761: of:=IF(COUNTIF([.A761:.A$1000];[.A761]) > 1; 1; 0) -> 1
A762: 2019-11-12 | B762: of:=IF(COUNTIF([.A762:.A$1000];[.A762]) > 1; 1; 0) -> 1
A763: 2019-11-12 | B763: of:=IF(COUNTIF([.A763:.A$1000];[.A763]) > 1; 1; 0) -> 1
A764: 2019-11-12 | B764: of:=IF(COUNTIF([.A764:.A$1000];[.A764]) > 1; 1; 0) -> 0
A765: 2019-11-06 | B765: of:=IF(COUNTIF([.A765:.A$1000];[.A765]) > 1; 1; 0) -> 1
A766: 2019-11-06 | B766: of:=IF(COUNTIF([.A766:.A$1000];[.A766]) > 1; 1; 0) -> 1
A767: 2019-11-06 | B767: of:=IF(COUNTIF([.A767:.A$1000];[.A767]) > 1; 1; 0) -> 1
A768: 2019-11-06 | B768: of:=IF(COUNTIF([.A768:.A$1000];[.A768]) > 1; 1; 0) -> 1
A769: 2019-11-06 | B769: of:=IF(COUNTIF([.A769:.A$1000];[.A769]) > 1; 1; 0) -> 1
A770: 2019-11-06 | B770: of:=IF(COUNTIF([.A770:.A$1000];[.A770]) > 1; 1; 0) -> 1
A771: 2019-11-06 | B771: of:=IF(COUNTIF([.A771:.A$1000];[.A771]) > 1; 1; 0) -> 1
A772: 2019-11-06 | B772: of:=IF(COUNTIF([.A772:.A$1000];[.A772]) > 1; 1; 0) -> 1
A773: 2019-11-06 | B773: of:=IF(COUNTIF([.A773:.A$1000];[.A773]) > 1; 1; 0) -> 1
A774: 2019-11-06 | B774: of:=IF(COUNTIF([.A774:.A$1000];[.A774]) > 1; 1; 0) -> 1
A775: 2019-11-06 | B775: of:=IF(COUNTIF([.A775:.A$1000];[.A775]) > 1; 1; 0) -> 0
A776: 2019-11-03 | B776: of:=IF(COUNTIF([.A776:.A$1000];[.A776]) > 1; 1; 0) -> 1
A777: 2019-11-03 | B777: of:=IF(COUNTIF([.A777:.A$1000];[.A777]) > 1; 1; 0) -> 1
A778: 2019-11-03 | B778: of:=IF(COUNTIF([.A778:.A$1000];[.A778]) > 1; 1; 0) -> 0
A779: 2019-11-02 | B779: of:=IF(COUNTIF([.A779:.A$1000];[.A779]) > 1; 1; 0) -> 1
A780: 2019-11-02 | B780: of:=IF(COUNTIF([.A780:.A$1000];[.A780]) > 1; 1; 0) -> 1
A781: 2019-11-02 | B781: of:=IF(COUNTIF([.A781:.A$1000];[.A781]) > 1; 1; 0) -> 1
A782: 2019-11-02 | B782: of:=IF(COUNTIF([.A782:.A$1000];[.A782]) > 1; 1; 0) -> 1
A783: 2019-11-02 | B783: of:=IF(COUNTIF([.A783:.A$1000];[.A783]) > 1; 1; 0) -> 1
A784: 2019-11-02 | B784: of:=IF(COUNTIF([.A784:.A$1000];[.A784]) > 1; 1; 0) -> 1
A785: 2019-11-02 | B785: of:=IF(COUNTIF([.A785:.A$1000];[.A785]) > 1; 1; 0) -> 1
A786: 2019-11-02 | B786: of:=IF(COUNTIF([.A786:.A$1000];[.A786]) > 1; 1; 0) -> 1
A787: 2019-11-02 | B787: of:=IF(COUNTIF([.A787:.A$1000];[.A787]) > 1; 1; 0) -> 1
A788: 2019-11-02 | B788: of:=IF(COUNTIF([.A788:.A$1000];[.A788]) > 1; 1; 0) -> 1
A789: 2019-11-02 | B789: of:=IF(COUNTIF([.A789:.A$1000];[.A789]) > 1; 1; 0) -> 1
A790: 2019-11-02 | B790: of:=IF(COUNTIF([.A790:.A$1000];[.A790]) > 1; 1; 0) -> 1
A791: 2019-11-02 | B791: of:=IF(COUNTIF([.A791:.A$1000];[.A791]) > 1; 1; 0) -> 1
A792: 2019-11-02 | B792: of:=IF(COUNTIF([.A792:.A$1000];[.A792]) > 1; 1; 0) -> 1
A793: 2019-11-02 | B793: of:=IF(COUNTIF([.A793:.A$1000];[.A793]) > 1; 1; 0) -> 1
A794: 2019-11-02 | B794: of:=IF(COUNTIF([.A794:.A$1000];[.A794]) > 1; 1; 0) -> 1
A795: 2019-11-02 | B795: of:=IF(COUNTIF([.A795:.A$1000];[.A795]) > 1; 1; 0) -> 1
A796: 2019-11-02 | B796: of:=IF(COUNTIF([.A796:.A$1000];[.A796]) > 1; 1; 0) -> 0
A797: 2019-11-01 | B797: of:=IF(COUNTIF([.A797:.A$1000];[.A797]) > 1; 1; 0) -> 1
A798: 2019-11-01 | B798: of:=IF(COUNTIF([.A798:.A$1000];[.A798]) > 1; 1; 0) -> 1
A799: 2019-11-01 | B799: of:=IF(COUNTIF([.A799:.A$1000];[.A799]) > 1; 1; 0) -> 1
A800: 2019-11-01 | B800: of:=IF(COUNTIF([.A800:.A$1000];[.A800]) > 1; 1; 0) -> 1
A801: 2019-11-01 | B801: of:=IF(COUNTIF([.A801:.A$1000];[.A801]) > 1; 1; 0) -> 1
A802: 2019-11-01 | B802: of:=IF(COUNTIF([.A802:.A$1000];[.A802]) > 1; 1; 0) -> 1
A803: 2019-11-01 | B803: of:=IF(COUNTIF([.A803:.A$1000];[.A803]) > 1; 1; 0) -> 0

Sheet: Diagram
B1: Days | C1: Corrected
A2: Research | B2: of:=SUMIF([$'Work items'.$B$2:$'Work items'.$B$51];[.A2];[$'Work items'.$E$2:$'Work items'.$E$51]) -> 41 | C2: of:=[.B2]/[.$B$7]*[$'Total time'.$D$1] -> 32.9532710280374
A3: Implementation | B3: of:=SUMIF([$'Work items'.$B$2:$'Work items'.$B$51];[.A3];[$'Work items'.$E$2:$'Work items'.$E$51]) -> 8.2 | C3: of:=[.B3]/[.$B$7]*[$'Total time'.$D$1] -> 6.59065420560748
A4: Testing | B4: of:=SUMIF([$'Work items'.$B$2:$'Work items'.$B$51];[.A4];[$'Work items'.$E$2:$'Work items'.$E$51]) -> 13.6 | C4: of:=[.B4]/[.$B$7]*[$'Total time'.$D$1] -> 10.9308411214953
A5: Bugfixing | B5: of:=SUMIF([$'Work items'.$B$2:$'Work items'.$B$51];[.A5];[$'Work items'.$E$2:$'Work items'.$E$51]) -> 23.9 | C5: of:=[.B5]/[.$B$7]*[$'Total time'.$D$1] -> 19.2093457943925
A6: Refactoring and Documentation | B6: of:=SUMIF([$'Work items'.$B$2:$'Work items'.$B$51];[.A6];[$'Work items'.$E$2:$'Work items'.$E$51]) -> 20.3 | C6: of:=[.B6]/[.$B$7]*[$'Total time'.$D$1] -> 16.3158878504673
A7: Sum | B7: of:=SUM([.B2:.B6]) -> 107 | C7: of:=[.B7]/[.$B$7]*[$'Total time'.$D$1] -> 86

Sheet: Total time
C1: Sum w/o duplicates | D1: of:=COUNTIF([.B4:.C2002];0) -> 86
C2: Overestimation ratio | D2: of:=[$Diagram.B7]/[.D1] -> 1.24418604651163
A3: Dates | B3: Type | C3: Is duplicate?
A4: 2020-10-05 | B4: Git Commit | C4: of:=IF(COUNTIF([.A4:.A$2002];[.A4]) > 1; 1; 0) -> 1
A5: 2020-10-05 | B5: Git Commit | C5: of:=IF(COUNTIF([.A5:.A$2002];[.A5]) > 1; 1; 0) -> 1
A6: 2020-10-05 | B6: Git Commit | C6: of:=IF(COUNTIF([.A6:.A$2002];[.A6]) > 1; 1; 0) -> 1
A7: 2020-10-05 | B7: Git Commit | C7: of:=IF(COUNTIF([.A7:.A$2002];[.A7]) > 1; 1; 0) -> 1
A8: 2020-10-05 | B8: Git Commit | C8: of:=IF(COUNTIF([.A8:.A$2002];[.A8]) > 1; 1; 0) -> 0
A9: 2020-10-02 | B9: Git Commit | C9: of:=IF(COUNTIF([.A9:.A$2002];[.A9]) > 1; 1; 0) -> 1
A10: 2020-10-02 | B10: Git Commit | C10: of:=IF(COUNTIF([.A10:.A$2002];[.A10]) > 1; 1; 0) -> 1
A11: 2020-10-02 | B11: Git Commit | C11: of:=IF(COUNTIF([.A11:.A$2002];[.A11]) > 1; 1; 0) -> 1
A12: 2020-10-02 | B12: Git Commit | C12: of:=IF(COUNTIF([.A12:.A$2002];[.A12]) > 1; 1; 0) -> 1
A13: 2020-10-02 | B13: Git Commit | C13: of:=IF(COUNTIF([.A13:.A$2002];[.A13]) > 1; 1; 0) -> 1
A14: 2020-10-02 | B14: Git Commit | C14: of:=IF(COUNTIF([.A14:.A$2002];[.A14]) > 1; 1; 0) -> 1
A15: 2020-10-02 | B15: Git Commit | C15: of:=IF(COUNTIF([.A15:.A$2002];[.A15]) > 1; 1; 0) -> 1
A16: 2020-10-02 | B16: Git Commit | C16: of:=IF(COUNTIF([.A16:.A$2002];[.A16]) > 1; 1; 0) -> 1
A17: 2020-10-02 | B17: Git Commit | C17: of:=IF(COUNTIF([.A17:.A$2002];[.A17]) > 1; 1; 0) -> 1
A18: 2020-10-02 | B18: Git Commit | C18: of:=IF(COUNTIF([.A18:.A$2002];[.A18]) > 1; 1; 0) -> 1
A19: 2020-10-02 | B19: Git Commit | C19: of:=IF(COUNTIF([.A19:.A$2002];[.A19]) > 1; 1; 0) -> 1
A20: 2020-10-02 | B20: Git Commit | C20: of:=IF(COUNTIF([.A20:.A$2002];[.A20]) > 1; 1; 0) -> 1
A21: 2020-10-02 | B21: Git Commit | C21: of:=IF(COUNTIF([.A21:.A$2002];[.A21]) > 1; 1; 0) -> 1
A22: 2020-10-02 | B22: Git Commit | C22: of:=IF(COUNTIF([.A22:.A$2002];[.A22]) > 1; 1; 0) -> 1
A23: 2020-10-02 | B23: Git Commit | C23: of:=IF(COUNTIF([.A23:.A$2002];[.A23]) > 1; 1; 0) -> 0
A24: 2020-10-01 | B24: Git Commit | C24: of:=IF(COUNTIF([.A24:.A$2002];[.A24]) > 1; 1; 0) -> 1
A25: 2020-10-01 | B25: Git Commit | C25: of:=IF(COUNTIF([.A25:.A$2002];[.A25]) > 1; 1; 0) -> 1
A26: 2020-10-01 | B26: Git Commit | C26: of:=IF(COUNTIF([.A26:.A$2002];[.A26]) > 1; 1; 0) -> 1
A27: 2020-10-01 | B27: Git Commit | C27: of:=IF(COUNTIF([.A27:.A$2002];[.A27]) > 1; 1; 0) -> 1
A28: 2020-10-01 | B28: Git Commit | C28: of:=IF(COUNTIF([.A28:.A$2002];[.A28]) > 1; 1; 0) -> 1
A29: 2020-10-01 | B29: Git Commit | C29: of:=IF(COUNTIF([.A29:.A$2002];[.A29]) > 1; 1; 0) -> 1
A30: 2020-10-01 | B30: Git Commit | C30: of:=IF(COUNTIF([.A30:.A$2002];[.A30]) > 1; 1; 0) -> 1
A31: 2020-10-01 | B31: Git Commit | C31: of:=IF(COUNTIF([.A31:.A$2002];[.A31]) > 1; 1; 0) -> 1
A32: 2020-10-01 | B32: Git Commit | C32: of:=IF(COUNTIF([.A32:.A$2002];[.A32]) > 1; 1; 0) -> 1
A33: 2020-10-01 | B33: Git Commit | C33: of:=IF(COUNTIF([.A33:.A$2002];[.A33]) > 1; 1; 0) -> 1
A34: 2020-10-01 | B34: Git Commit | C34: of:=IF(COUNTIF([.A34:.A$2002];[.A34]) > 1; 1; 0) -> 1
A35: 2020-10-01 | B35: Git Commit | C35: of:=IF(COUNTIF([.A35:.A$2002];[.A35]) > 1; 1; 0) -> 1
A36: 2020-10-01 | B36: Git Commit | C36: of:=IF(COUNTIF([.A36:.A$2002];[.A36]) > 1; 1; 0) -> 1
A37: 2020-10-01 | B37: Git Commit | C37: of:=IF(COUNTIF([.A37:.A$2002];[.A37]) > 1; 1; 0) -> 1
A38: 2020-10-01 | B38: Git Commit | C38: of:=IF(COUNTIF([.A38:.A$2002];[.A38]) > 1; 1; 0) -> 1
A39: 2020-10-01 | B39: Git Commit | C39: of:=IF(COUNTIF([.A39:.A$2002];[.A39]) > 1; 1; 0) -> 1
A40: 2020-10-01 | B40: Git Commit | C40: of:=IF(COUNTIF([.A40:.A$2002];[.A40]) > 1; 1; 0) -> 1
A41: 2020-10-01 | B41: Git Commit | C41: of:=IF(COUNTIF([.A41:.A$2002];[.A41]) > 1; 1; 0) -> 1
A42: 2020-10-01 | B42: Git Commit | C42: of:=IF(COUNTIF([.A42:.A$2002];[.A42]) > 1; 1; 0) -> 1
A43: 2020-10-01 | B43: Git Commit | C43: of:=IF(COUNTIF([.A43:.A$2002];[.A43]) > 1; 1; 0) -> 1
A44: 2020-10-01 | B44: Git Commit | C44: of:=IF(COUNTIF([.A44:.A$2002];[.A44]) > 1; 1; 0) -> 1
A45: 2020-10-01 | B45: Git Commit | C45: of:=IF(COUNTIF([.A45:.A$2002];[.A45]) > 1; 1; 0) -> 0
A46: 2020-09-30 | B46: Git Commit | C46: of:=IF(COUNTIF([.A46:.A$2002];[.A46]) > 1; 1; 0) -> 1
A47: 2020-09-30 | B47: Git Commit | C47: of:=IF(COUNTIF([.A47:.A$2002];[.A47]) > 1; 1; 0) -> 1
A48: 2020-09-30 | B48: Git Commit | C48: of:=IF(COUNTIF([.A48:.A$2002];[.A48]) > 1; 1; 0) -> 1
A49: 2020-09-30 | B49: Git Commit | C49: of:=IF(COUNTIF([.A49:.A$2002];[.A49]) > 1; 1; 0) -> 1
A50: 2020-09-30 | B50: Git Commit | C50: of:=IF(COUNTIF([.A50:.A$2002];[.A50]) > 1; 1; 0) -> 1
A51: 2020-09-30 | B51: Git Commit | C51: of:=IF(COUNTIF([.A51:.A$2002];[.A51]) > 1; 1; 0) -> 1
A52: 2020-09-30 | B52: Git Commit | C52: of:=IF(COUNTIF([.A52:.A$2002];[.A52]) > 1; 1; 0) -> 1
A53: 2020-09-30 | B53: Git Commit | C53: of:=IF(COUNTIF([.A53:.A$2002];[.A53]) > 1; 1; 0) -> 1
A54: 2020-09-30 | B54: Git Commit | C54: of:=IF(COUNTIF([.A54:.A$2002];[.A54]) > 1; 1; 0) -> 1
A55: 2020-09-30 | B55: Git Commit | C55: of:=IF(COUNTIF([.A55:.A$2002];[.A55]) > 1; 1; 0) -> 0
A56: 2020-09-16 | B56: Git Commit | C56: of:=IF(COUNTIF([.A56:.A$2002];[.A56]) > 1; 1; 0) -> 1
A57: 2020-09-16 | B57: Git Commit | C57: of:=IF(COUNTIF([.A57:.A$2002];[.A57]) > 1; 1; 0) -> 1
A58: 2020-09-16 | B58: Git Commit | C58: of:=IF(COUNTIF([.A58:.A$2002];[.A58]) > 1; 1; 0) -> 1
A59: 2020-09-16 | B59: Git Commit | C59: of:=IF(COUNTIF([.A59:.A$2002];[.A59]) > 1; 1; 0) -> 1
A60: 2020-09-16 | B60: Git Commit | C60: of:=IF(COUNTIF([.A60:.A$2002];[.A60]) > 1; 1; 0) -> 1
A61: 2020-09-16 | B61: Git Commit | C61: of:=IF(COUNTIF([.A61:.A$2002];[.A61]) > 1; 1; 0) -> 1
A62: 2020-09-16 | B62: Git Commit | C62: of:=IF(COUNTIF([.A62:.A$2002];[.A62]) > 1; 1; 0) -> 1
A63: 2020-09-16 | B63: Git Commit | C63: of:=IF(COUNTIF([.A63:.A$2002];[.A63]) > 1; 1; 0) -> 1
A64: 2020-09-16 | B64: Git Commit | C64: of:=IF(COUNTIF([.A64:.A$2002];[.A64]) > 1; 1; 0) -> 1
A65: 2020-09-16 | B65: Git Commit | C65: of:=IF(COUNTIF([.A65:.A$2002];[.A65]) > 1; 1; 0) -> 1
A66: 2020-09-16 | B66: Git Commit | C66: of:=IF(COUNTIF([.A66:.A$2002];[.A66]) > 1; 1; 0) -> 1
A67: 2020-09-16 | B67: Git Commit | C67: of:=IF(COUNTIF([.A67:.A$2002];[.A67]) > 1; 1; 0) -> 1
A68: 2020-09-16 | B68: Git Commit | C68: of:=IF(COUNTIF([.A68:.A$2002];[.A68]) > 1; 1; 0) -> 1
A69: 2020-09-16 | B69: Git Commit | C69: of:=IF(COUNTIF([.A69:.A$2002];[.A69]) > 1; 1; 0) -> 0
A70: 2020-09-15 | B70: Git Commit | C70: of:=IF(COUNTIF([.A70:.A$2002];[.A70]) > 1; 1; 0) -> 1
A71: 2020-09-15 | B71: Git Commit | C71: of:=IF(COUNTIF([.A71:.A$2002];[.A71]) > 1; 1; 0) -> 1
A72: 2020-09-15 | B72: Git Commit | C72: of:=IF(COUNTIF([.A72:.A$2002];[.A72]) > 1; 1; 0) -> 1
A73: 2020-09-15 | B73: Git Commit | C73: of:=IF(COUNTIF([.A73:.A$2002];[.A73]) > 1; 1; 0) -> 1
A74: 2020-09-15 | B74: Git Commit | C74: of:=IF(COUNTIF([.A74:.A$2002];[.A74]) > 1; 1; 0) -> 1
A75: 2020-09-15 | B75: Git Commit | C75: of:=IF(COUNTIF([.A75:.A$2002];[.A75]) > 1; 1; 0) -> 1
A76: 2020-09-15 | B76: Git Commit | C76: of:=IF(COUNTIF([.A76:.A$2002];[.A76]) > 1; 1; 0) -> 1
A77: 2020-09-15 | B77: Git Commit | C77: of:=IF(COUNTIF([.A77:.A$2002];[.A77]) > 1; 1; 0) -> 1
A78: 2020-09-15 | B78: Git Commit | C78: of:=IF(COUNTIF([.A78:.A$2002];[.A78]) > 1; 1; 0) -> 0
A79: 2020-09-13 | B79: Git Commit | C79: of:=IF(COUNTIF([.A79:.A$2002];[.A79]) > 1; 1; 0) -> 0
A80: 2020-09-08 | B80: Git Commit | C80: of:=IF(COUNTIF([.A80:.A$2002];[.A80]) > 1; 1; 0) -> 1
A81: 2020-09-08 | B81: Git Commit | C81: of:=IF(COUNTIF([.A81:.A$2002];[.A81]) > 1; 1; 0) -> 1
A82: 2020-09-08 | B82: Git Commit | C82: of:=IF(COUNTIF([.A82:.A$2002];[.A82]) > 1; 1; 0) -> 1
A83: 2020-09-08 | B83: Git Commit | C83: of:=IF(COUNTIF([.A83:.A$2002];[.A83]) > 1; 1; 0) -> 1
A84: 2020-09-08 | B84: Git Commit | C84: of:=IF(COUNTIF([.A84:.A$2002];[.A84]) > 1; 1; 0) -> 1
A85: 2020-09-08 | B85: Git Commit | C85: of:=IF(COUNTIF([.A85:.A$2002];[.A85]) > 1; 1; 0) -> 1
A86: 2020-09-08 | B86: Git Commit | C86: of:=IF(COUNTIF([.A86:.A$2002];[.A86]) > 1; 1; 0) -> 1
A87: 2020-09-08 | B87: Git Commit | C87: of:=IF(COUNTIF([.A87:.A$2002];[.A87]) > 1; 1; 0) -> 1
A88: 2020-09-08 | B88: Git Commit | C88: of:=IF(COUNTIF([.A88:.A$2002];[.A88]) > 1; 1; 0) -> 1
A89: 2020-09-08 | B89: Git Commit | C89: of:=IF(COUNTIF([.A89:.A$2002];[.A89]) > 1; 1; 0) -> 1
A90: 2020-09-08 | B90: Git Commit | C90: of:=IF(COUNTIF([.A90:.A$2002];[.A90]) > 1; 1; 0) -> 1
A91: 2020-09-08 | B91: Git Commit | C91: of:=IF(COUNTIF([.A91:.A$2002];[.A91]) > 1; 1; 0) -> 1
A92: 2020-09-08 | B92: Git Commit | C92: of:=IF(COUNTIF([.A92:.A$2002];[.A92]) > 1; 1; 0) -> 1
A93: 2020-09-08 | B93: Git Commit | C93: of:=IF(COUNTIF([.A93:.A$2002];[.A93]) > 1; 1; 0) -> 1
A94: 2020-09-08 | B94: Git Commit | C94: of:=IF(COUNTIF([.A94:.A$2002];[.A94]) > 1; 1; 0) -> 1
A95: 2020-09-08 | B95: Git Commit | C95: of:=IF(COUNTIF([.A95:.A$2002];[.A95]) > 1; 1; 0) -> 1
A96: 2020-09-08 | B96: Git Commit | C96: of:=IF(COUNTIF([.A96:.A$2002];[.A96]) > 1; 1; 0) -> 1
A97: 2020-09-08 | B97: Git Commit | C97: of:=IF(COUNTIF([.A97:.A$2002];[.A97]) > 1; 1; 0) -> 1
A98: 2020-09-08 | B98: Git Commit | C98: of:=IF(COUNTIF([.A98:.A$2002];[.A98]) > 1; 1; 0) -> 1
A99: 2020-09-08 | B99: Git Commit | C99: of:=IF(COUNTIF([.A99:.A$2002];[.A99]) > 1; 1; 0) -> 1
A100: 2020-09-08 | B100: Git Commit | C100: of:=IF(COUNTIF([.A100:.A$2002];[.A100]) > 1; 1; 0) -> 1
A101: 2020-09-08 | B101: Git Commit | C101: of:=IF(COUNTIF([.A101:.A$2002];[.A101]) > 1; 1; 0) -> 1
A102: 2020-09-08 | B102: Git Commit | C102: of:=IF(COUNTIF([.A102:.A$2002];[.A102]) > 1; 1; 0) -> 1
A103: 2020-09-08 | B103: Git Commit | C103: of:=IF(COUNTIF([.A103:.A$2002];[.A103]) > 1; 1; 0) -> 0
A104: 2020-09-07 | B104: Git Commit | C104: of:=IF(COUNTIF([.A104:.A$2002];[.A104]) > 1; 1; 0) -> 1
A105: 2020-09-07 | B105: Git Commit | C105: of:=IF(COUNTIF([.A105:.A$2002];[.A105]) > 1; 1; 0) -> 1
A106: 2020-09-07 | B106: Git Commit | C106: of:=IF(COUNTIF([.A106:.A$2002];[.A106]) > 1; 1; 0) -> 1
A107: 2020-09-07 | B107: Git Commit | C107: of:=IF(COUNTIF([.A107:.A$2002];[.A107]) > 1; 1; 0) -> 1
A108: 2020-09-07 | B108: Git Commit | C108: of:=IF(COUNTIF([.A108:.A$2002];[.A108]) > 1; 1; 0) -> 1
A109: 2020-09-07 | B109: Git Commit | C109: of:=IF(COUNTIF([.A109:.A$2002];[.A109]) > 1; 1; 0) -> 1
A110: 2020-09-07 | B110: Git Commit | C110: of:=IF(COUNTIF([.A110:.A$2002];[.A110]) > 1; 1; 0) -> 1
A111: 2020-09-07 | B111: Git Commit | C111: of:=IF(COUNTIF([.A111:.A$2002];[.A111]) > 1; 1; 0) -> 1
A112: 2020-09-07 | B112: Git Commit | C112: of:=IF(COUNTIF([.A112:.A$2002];[.A112]) > 1; 1; 0) -> 1
A113: 2020-09-07 | B113: Git Commit | C113: of:=IF(COUNTIF([.A113:.A$2002];[.A113]) > 1; 1; 0) -> 1
A114: 2020-09-07 | B114: Git Commit | C114: of:=IF(COUNTIF([.A114:.A$2002];[.A114]) > 1; 1; 0) -> 1
A115: 2020-09-07 | B115: Git Commit | C115: of:=IF(COUNTIF([.A115:.A$2002];[.A115]) > 1; 1; 0) -> 1
A116: 2020-09-07 | B116: Git Commit | C116: of:=IF(COUNTIF([.A116:.A$2002];[.A116]) > 1; 1; 0) -> 1
A117: 2020-09-07 | B117: Git Commit | C117: of:=IF(COUNTIF([.A117:.A$2002];[.A117]) > 1; 1; 0) -> 1
A118: 2020-09-07 | B118: Git Commit | C118: of:=IF(COUNTIF([.A118:.A$2002];[.A118]) > 1; 1; 0) -> 1
A119: 2020-09-07 | B119: Git Commit | C119: of:=IF(COUNTIF([.A119:.A$2002];[.A119]) > 1; 1; 0) -> 1
A120: 2020-09-07 | B120: Git Commit | C120: of:=IF(COUNTIF([.A120:.A$2002];[.A120]) > 1; 1; 0) -> 1
A121: 2020-09-07 | B121: Git Commit | C121: of:=IF(COUNTIF([.A121:.A$2002];[.A121]) > 1; 1; 0) -> 1
A122: 2020-09-07 | B122: Git Commit | C122: of:=IF(COUNTIF([.A122:.A$2002];[.A122]) > 1; 1; 0) -> 1
A123: 2020-09-07 | B123: Git Commit | C123: of:=IF(COUNTIF([.A123:.A$2002];[.A123]) > 1; 1; 0) -> 1
A124: 2020-09-07 | B124: Git Commit | C124: of:=IF(COUNTIF([.A124:.A$2002];[.A124]) > 1; 1; 0) -> 1
A125: 2020-09-07 | B125: Git Commit | C125: of:=IF(COUNTIF([.A125:.A$2002];[.A125]) > 1; 1; 0) -> 0
A126: 2020-09-04 | B126: Git Commit | C126: of:=IF(COUNTIF([.A126:.A$2002];[.A126]) > 1; 1; 0) -> 1
A127: 2020-09-04 | B127: Git Commit | C127: of:=IF(COUNTIF([.A127:.A$2002];[.A127]) > 1; 1; 0) -> 1
A128: 2020-09-04 | B128: Git Commit | C128: of:=IF(COUNTIF([.A128:.A$2002];[.A128]) > 1; 1; 0) -> 1
A129: 2020-09-04 | B129: Git Commit | C129: of:=IF(COUNTIF([.A129:.A$2002];[.A129]) > 1; 1; 0) -> 1
A130: 2020-09-04 | B130: Git Commit | C130: of:=IF(COUNTIF([.A130:.A$2002];[.A130]) > 1; 1; 0) -> 1
A131: 2020-09-04 | B131: Git Commit | C131: of:=IF(COUNTIF([.A131:.A$2002];[.A131]) > 1; 1; 0) -> 1
A132: 2020-09-04 | B132: Git Commit | C132: of:=IF(COUNTIF([.A132:.A$2002];[.A132]) > 1; 1; 0) -> 1
A133: 2020-09-04 | B133: Git Commit | C133: of:=IF(COUNTIF([.A133:.A$2002];[.A133]) > 1; 1; 0) -> 1
A134: 2020-09-04 | B134: Git Commit | C134: of:=IF(COUNTIF([.A134:.A$2002];[.A134]) > 1; 1; 0) -> 1
A135: 2020-09-04 | B135: Git Commit | C135: of:=IF(COUNTIF([.A135:.A$2002];[.A135]) > 1; 1; 0) -> 1
A136: 2020-09-04 | B136: Git Commit | C136: of:=IF(COUNTIF([.A136:.A$2002];[.A136]) > 1; 1; 0) -> 1
A137: 2020-09-04 | B137: Git Commit | C137: of:=IF(COUNTIF([.A137:.A$2002];[.A137]) > 1; 1; 0) -> 1
A138: 2020-09-04 | B138: Git Commit | C138: of:=IF(COUNTIF([.A138:.A$2002];[.A138]) > 1; 1; 0) -> 1
A139: 2020-09-04 | B139: Git Commit | C139: of:=IF(COUNTIF([.A139:.A$2002];[.A139]) > 1; 1; 0) -> 1
A140: 2020-09-04 | B140: Git Commit | C140: of:=IF(COUNTIF([.A140:.A$2002];[.A140]) > 1; 1; 0) -> 1
A141: 2020-09-04 | B141: Git Commit | C141: of:=IF(COUNTIF([.A141:.A$2002];[.A141]) > 1; 1; 0) -> 1
A142: 2020-09-04 | B142: Git Commit | C142: of:=IF(COUNTIF([.A142:.A$2002];[.A142]) > 1; 1; 0) -> 1
A143: 2020-09-04 | B143: Git Commit | C143: of:=IF(COUNTIF([.A143:.A$2002];[.A143]) > 1; 1; 0) -> 1
A144: 2020-09-04 | B144: Git Commit | C144: of:=IF(COUNTIF([.A144:.A$2002];[.A144]) > 1; 1; 0) -> 1
A145: 2020-09-04 | B145: Git Commit | C145: of:=IF(COUNTIF([.A145:.A$2002];[.A145]) > 1; 1; 0) -> 1
A146: 2020-09-04 | B146: Git Commit | C146: of:=IF(COUNTIF([.A146:.A$2002];[.A146]) > 1; 1; 0) -> 1
A147: 2020-09-04 | B147: Git Commit | C147: of:=IF(COUNTIF([.A147:.A$2002];[.A147]) > 1; 1; 0) -> 1
A148: 2020-09-04 | B148: Git Commit | C148: of:=IF(COUNTIF([.A148:.A$2002];[.A148]) > 1; 1; 0) -> 1
A149: 2020-09-04 | B149: Git Commit | C149: of:=IF(COUNTIF([.A149:.A$2002];[.A149]) > 1; 1; 0) -> 1
A150: 2020-09-04 | B150: Git Commit | C150: of:=IF(COUNTIF([.A150:.A$2002];[.A150]) > 1; 1; 0) -> 1
A151: 2020-09-04 | B151: Git Commit | C151: of:=IF(COUNTIF([.A151:.A$2002];[.A151]) > 1; 1; 0) -> 1
A152: 2020-09-04 | B152: Git Commit | C152: of:=IF(COUNTIF([.A152:.A$2002];[.A152]) > 1; 1; 0) -> 1
A153: 2020-09-04 | B153: Git Commit | C153: of:=IF(COUNTIF([.A153:.A$2002];[.A153]) > 1; 1; 0) -> 1
A154: 2020-09-04 | B154: Git Commit | C154: of:=IF(COUNTIF([.A154:.A$2002];[.A154]) > 1; 1; 0) -> 1
A155: 2020-09-04 | B155: Git Commit | C155: of:=IF(COUNTIF([.A155:.A$2002];[.A155]) > 1; 1; 0) -> 1
A156: 2020-09-04 | B156: Git Commit | C156: of:=IF(COUNTIF([.A156:.A$2002];[.A156]) > 1; 1; 0) -> 1
A157: 2020-09-04 | B157: Git Commit | C157: of:=IF(COUNTIF([.A157:.A$2002];[.A157]) > 1; 1; 0) -> 1
A158: 2020-09-04 | B158: Git Commit | C158: of:=IF(COUNTIF([.A158:.A$2002];[.A158]) > 1; 1; 0) -> 1
A159: 2020-09-04 | B159: Git Commit | C159: of:=IF(COUNTIF([.A159:.A$2002];[.A159]) > 1; 1; 0) -> 1
A160: 2020-09-04 | B160: Git Commit | C160: of:=IF(COUNTIF([.A160:.A$2002];[.A160]) > 1; 1; 0) -> 1
A161: 2020-09-04 | B161: Git Commit | C161: of:=IF(COUNTIF([.A161:.A$2002];[.A161]) > 1; 1; 0) -> 0
A162: 2020-09-03 | B162: Git Commit | C162: of:=IF(COUNTIF([.A162:.A$2002];[.A162]) > 1; 1; 0) -> 1
A163: 2020-09-03 | B163: Git Commit | C163: of:=IF(COUNTIF([.A163:.A$2002];[.A163]) > 1; 1; 0) -> 1
A164: 2020-09-03 | B164: Git Commit | C164: of:=IF(COUNTIF([.A164:.A$2002];[.A164]) > 1; 1; 0) -> 1
A165: 2020-09-03 | B165: Git Commit | C165: of:=IF(COUNTIF([.A165:.A$2002];[.A165]) > 1; 1; 0) -> 1
A166: 2020-09-03 | B166: Git Commit | C166: of:=IF(COUNTIF([.A166:.A$2002];[.A166]) > 1; 1; 0) -> 1
A167: 2020-09-03 | B167: Git Commit | C167: of:=IF(COUNTIF([.A167:.A$2002];[.A167]) > 1; 1; 0) -> 1
A168: 2020-09-03 | B168: Git Commit | C168: of:=IF(COUNTIF([.A168:.A$2002];[.A168]) > 1; 1; 0) -> 1
A169: 2020-09-03 | B169: Git Commit | C169: of:=IF(COUNTIF([.A169:.A$2002];[.A169]) > 1; 1; 0) -> 1
A170: 2020-09-03 | B170: Git Commit | C170: of:=IF(COUNTIF([.A170:.A$2002];[.A170]) > 1; 1; 0) -> 1
A171: 2020-09-03 | B171: Git Commit | C171: of:=IF(COUNTIF([.A171:.A$2002];[.A171]) > 1; 1; 0) -> 1
A172: 2020-09-03 | B172: Git Commit | C172: of:=IF(COUNTIF([.A172:.A$2002];[.A172]) > 1; 1; 0) -> 1
A173: 2020-09-03 | B173: Git Commit | C173: of:=IF(COUNTIF([.A173:.A$2002];[.A173]) > 1; 1; 0) -> 1
A174: 2020-09-03 | B174: Git Commit | C174: of:=IF(COUNTIF([.A174:.A$2002];[.A174]) > 1; 1; 0) -> 1
A175: 2020-09-03 | B175: Git Commit | C175: of:=IF(COUNTIF([.A175:.A$2002];[.A175]) > 1; 1; 0) -> 1
A176: 2020-09-03 | B176: Git Commit | C176: of:=IF(COUNTIF([.A176:.A$2002];[.A176]) > 1; 1; 0) -> 1
A177: 2020-09-03 | B177: Git Commit | C177: of:=IF(COUNTIF([.A177:.A$2002];[.A177]) > 1; 1; 0) -> 1
A178: 2020-09-03 | B178: Git Commit | C178: of:=IF(COUNTIF([.A178:.A$2002];[.A178]) > 1; 1; 0) -> 0
A179: 2020-09-02 | B179: Git Commit | C179: of:=IF(COUNTIF([.A179:.A$2002];[.A179]) > 1; 1; 0) -> 1
A180: 2020-09-02 | B180: Git Commit | C180: of:=IF(COUNTIF([.A180:.A$2002];[.A180]) > 1; 1; 0) -> 1
A181: 2020-09-02 | B181: Git Commit | C181: of:=IF(COUNTIF([.A181:.A$2002];[.A181]) > 1; 1; 0) -> 1
A182: 2020-09-02 | B182: Git Commit | C182: of:=IF(COUNTIF([.A182:.A$2002];[.A182]) > 1; 1; 0) -> 1
A183: 2020-09-02 | B183: Git Commit | C183: of:=IF(COUNTIF([.A183:.A$2002];[.A183]) > 1; 1; 0) -> 1
A184: 2020-09-02 | B184: Git Commit | C184: of:=IF(COUNTIF([.A184:.A$2002];[.A184]) > 1; 1; 0) -> 1
A185: 2020-09-02 | B185: Git Commit | C185: of:=IF(COUNTIF([.A185:.A$2002];[.A185]) > 1; 1; 0) -> 1
A186: 2020-09-02 | B186: Git Commit | C186: of:=IF(COUNTIF([.A186:.A$2002];[.A186]) > 1; 1; 0) -> 1
A187: 2020-09-02 | B187: Git Commit | C187: of:=IF(COUNTIF([.A187:.A$2002];[.A187]) > 1; 1; 0) -> 1
A188: 2020-09-02 | B188: Git Commit | C188: of:=IF(COUNTIF([.A188:.A$2002];[.A188]) > 1; 1; 0) -> 1
A189: 2020-09-02 | B189: Git Commit | C189: of:=IF(COUNTIF([.A189:.A$2002];[.A189]) > 1; 1; 0) -> 0
A190: 2020-09-01 | B190: Git Commit | C190: of:=IF(COUNTIF([.A190:.A$2002];[.A190]) > 1; 1; 0) -> 1
A191: 2020-09-01 | B191: Git Commit | C191: of:=IF(COUNTIF([.A191:.A$2002];[.A191]) > 1; 1; 0) -> 1
A192: 2020-09-01 | B192: Git Commit | C192: of:=IF(COUNTIF([.A192:.A$2002];[.A192]) > 1; 1; 0) -> 1
A193: 2020-09-01 | B193: Git Commit | C193: of:=IF(COUNTIF([.A193:.A$2002];[.A193]) > 1; 1; 0) -> 0
A194: 2020-08-31 | B194: Git Commit | C194: of:=IF(COUNTIF([.A194:.A$2002];[.A194]) > 1; 1; 0) -> 0
A195: 2020-08-28 | B195: Git Commit | C195: of:=IF(COUNTIF([.A195:.A$2002];[.A195]) > 1; 1; 0) -> 0
A196: 2020-08-26 | B196: Git Commit | C196: of:=IF(COUNTIF([.A196:.A$2002];[.A196]) > 1; 1; 0) -> 1
A197: 2020-08-26 | B197: Git Commit | C197: of:=IF(COUNTIF([.A197:.A$2002];[.A197]) > 1; 1; 0) -> 1
A198: 2020-08-26 | B198: Git Commit | C198: of:=IF(COUNTIF([.A198:.A$2002];[.A198]) > 1; 1; 0) -> 1
A199: 2020-08-26 | B199: Git Commit | C199: of:=IF(COUNTIF([.A199:.A$2002];[.A199]) > 1; 1; 0) -> 1
A200: 2020-08-26 | B200: Git Commit | C200: of:=IF(COUNTIF([.A200:.A$2002];[.A200]) > 1; 1; 0) -> 1
A201: 2020-08-26 | B201: Git Commit | C201: of:=IF(COUNTIF([.A201:.A$2002];[.A201]) > 1; 1; 0) -> 0
A202: 2020-08-24 | B202: Git Commit | C202: of:=IF(COUNTIF([.A202:.A$2002];[.A202]) > 1; 1; 0) -> 1
A203: 2020-08-24 | B203: Git Commit | C203: of:=IF(COUNTIF([.A203:.A$2002];[.A203]) > 1; 1; 0) -> 1
A204: 2020-08-24 | B204: Git Commit | C204: of:=IF(COUNTIF([.A204:.A$2002];[.A204]) > 1; 1; 0) -> 0
A205: 2020-07-27 | B205: Git Commit | C205: of:=IF(COUNTIF([.A205:.A$2002];[.A205]) > 1; 1; 0) -> 1
A206: 2020-07-27 | B206: Git Commit | C206: of:=IF(COUNTIF([.A206:.A$2002];[.A206]) > 1; 1; 0) -> 1
A207: 2020-07-27 | B207: Git Commit | C207: of:=IF(COUNTIF([.A207:.A$2002];[.A207]) > 1; 1; 0) -> 1
A208: 2020-07-27 | B208: Git Commit | C208: of:=IF(COUNTIF([.A208:.A$2002];[.A208]) > 1; 1; 0) -> 1
A209: 2020-07-27 | B209: Git Commit | C209: of:=IF(COUNTIF([.A209:.A$2002];[.A209]) > 1; 1; 0) -> 1
A210: 2020-07-27 | B210: Git Commit | C210: of:=IF(COUNTIF([.A210:.A$2002];[.A210]) > 1; 1; 0) -> 0
A211: 2020-07-24 | B211: Git Commit | C211: of:=IF(COUNTIF([.A211:.A$2002];[.A211]) > 1; 1; 0) -> 1
A212: 2020-07-24 | B212: Git Commit | C212: of:=IF(COUNTIF([.A212:.A$2002];[.A212]) > 1; 1; 0) -> 0
A213: 2020-07-22 | B213: Git Commit | C213: of:=IF(COUNTIF([.A213:.A$2002];[.A213]) > 1; 1; 0) -> 1
A214: 2020-07-22 | B214: Git Commit | C214: of:=IF(COUNTIF([.A214:.A$2002];[.A214]) > 1; 1; 0) -> 0
A215: 2020-07-17 | B215: Git Commit | C215: of:=IF(COUNTIF([.A215:.A$2002];[.A215]) > 1; 1; 0) -> 1
A216: 2020-07-17 | B216: Git Commit | C216: of:=IF(COUNTIF([.A216:.A$2002];[.A216]) > 1; 1; 0) -> 1
A217: 2020-07-17 | B217: Git Commit | C217: of:=IF(COUNTIF([.A217:.A$2002];[.A217]) > 1; 1; 0) -> 1
A218: 2020-07-17 | B218: Git Commit | C218: of:=IF(COUNTIF([.A218:.A$2002];[.A218]) > 1; 1; 0) -> 1
A219: 2020-07-17 | B219: Git Commit | C219: of:=IF(COUNTIF([.A219:.A$2002];[.A219]) > 1; 1; 0) -> 1
A220: 2020-07-17 | B220: Git Commit | C220: of:=IF(COUNTIF([.A220:.A$2002];[.A220]) > 1; 1; 0) -> 1
A221: 2020-07-17 | B221: Git Commit | C221: of:=IF(COUNTIF([.A221:.A$2002];[.A221]) > 1; 1; 0) -> 1
A222: 2020-07-17 | B222: Git Commit | C222: of:=IF(COUNTIF([.A222:.A$2002];[.A222]) > 1; 1; 0) -> 1
A223: 2020-07-17 | B223: Git Commit | C223: of:=IF(COUNTIF([.A223:.A$2002];[.A223]) > 1; 1; 0) -> 1
A224: 2020-07-17 | B224: Git Commit | C224: of:=IF(COUNTIF([.A224:.A$2002];[.A224]) > 1; 1; 0) -> 1
A225: 2020-07-17 | B225: Git Commit | C225: of:=IF(COUNTIF([.A225:.A$2002];[.A225]) > 1; 1; 0) -> 1
A226: 2020-07-17 | B226: Git Commit | C226: of:=IF(COUNTIF([.A226:.A$2002];[.A226]) > 1; 1; 0) -> 1
A227: 2020-07-17 | B227: Git Commit | C227: of:=IF(COUNTIF([.A227:.A$2002];[.A227]) > 1; 1; 0) -> 1
A228: 2020-07-17 | B228: Git Commit | C228: of:=IF(COUNTIF([.A228:.A$2002];[.A228]) > 1; 1; 0) -> 1
A229: 2020-07-17 | B229: Git Commit | C229: of:=IF(COUNTIF([.A229:.A$2002];[.A229]) > 1; 1; 0) -> 1
A230: 2020-07-17 | B230: Git Commit | C230: of:=IF(COUNTIF([.A230:.A$2002];[.A230]) > 1; 1; 0) -> 1
A231: 2020-07-17 | B231: Git Commit | C231: of:=IF(COUNTIF([.A231:.A$2002];[.A231]) > 1; 1; 0) -> 1
A232: 2020-07-17 | B232: Git Commit | C232: of:=IF(COUNTIF([.A232:.A$2002];[.A232]) > 1; 1; 0) -> 1
A233: 2020-07-17 | B233: Git Commit | C233: of:=IF(COUNTIF([.A233:.A$2002];[.A233]) > 1; 1; 0) -> 1
A234: 2020-07-17 | B234: Git Commit | C234: of:=IF(COUNTIF([.A234:.A$2002];[.A234]) > 1; 1; 0) -> 1
A235: 2020-07-17 | B235: Git Commit | C235: of:=IF(COUNTIF([.A235:.A$2002];[.A235]) > 1; 1; 0) -> 1
A236: 2020-07-17 | B236: Git Commit | C236: of:=IF(COUNTIF([.A236:.A$2002];[.A236]) > 1; 1; 0) -> 1
A237: 2020-07-17 | B237: Git Commit | C237: of:=IF(COUNTIF([.A237:.A$2002];[.A237]) > 1; 1; 0) -> 1
A238: 2020-07-17 | B238: Git Commit | C238: of:=IF(COUNTIF([.A238:.A$2002];[.A238]) > 1; 1; 0) -> 1
A239: 2020-07-17 | B239: Git Commit | C239: of:=IF(COUNTIF([.A239:.A$2002];[.A239]) > 1; 1; 0) -> 1
A240: 2020-07-17 | B240: Git Commit | C240: of:=IF(COUNTIF([.A240:.A$2002];[.A240]) > 1; 1; 0) -> 1
A241: 2020-07-16 | B241: Git Commit | C241: of:=IF(COUNTIF([.A241:.A$2002];[.A241]) > 1; 1; 0) -> 1
A242: 2020-07-16 | B242: Git Commit | C242: of:=IF(COUNTIF([.A242:.A$2002];[.A242]) > 1; 1; 0) -> 1
A243: 2020-07-16 | B243: Git Commit | C243: of:=IF(COUNTIF([.A243:.A$2002];[.A243]) > 1; 1; 0) -> 1
A244: 2020-07-16 | B244: Git Commit | C244: of:=IF(COUNTIF([.A244:.A$2002];[.A244]) > 1; 1; 0) -> 1
A245: 2020-07-16 | B245: Git Commit | C245: of:=IF(COUNTIF([.A245:.A$2002];[.A245]) > 1; 1; 0) -> 1
A246: 2020-07-16 | B246: Git Commit | C246: of:=IF(COUNTIF([.A246:.A$2002];[.A246]) > 1; 1; 0) -> 1
A247: 2020-07-16 | B247: Git Commit | C247: of:=IF(COUNTIF([.A247:.A$2002];[.A247]) > 1; 1; 0) -> 1
A248: 2020-07-16 | B248: Git Commit | C248: of:=IF(COUNTIF([.A248:.A$2002];[.A248]) > 1; 1; 0) -> 1
A249: 2020-07-16 | B249: Git Commit | C249: of:=IF(COUNTIF([.A249:.A$2002];[.A249]) > 1; 1; 0) -> 0
A250: 2020-07-15 | B250: Git Commit | C250: of:=IF(COUNTIF([.A250:.A$2002];[.A250]) > 1; 1; 0) -> 1
A251: 2020-07-15 | B251: Git Commit | C251: of:=IF(COUNTIF([.A251:.A$2002];[.A251]) > 1; 1; 0) -> 1
A252: 2020-07-15 | B252: Git Commit | C252: of:=IF(COUNTIF([.A252:.A$2002];[.A252]) > 1; 1; 0) -> 1
A253: 2020-07-15 | B253: Git Commit | C253: of:=IF(COUNTIF([.A253:.A$2002];[.A253]) > 1; 1; 0) -> 1
A254: 2020-07-15 | B254: Git Commit | C254: of:=IF(COUNTIF([.A254:.A$2002];[.A254]) > 1; 1; 0) -> 0
A255: 2020-07-13 | B255: Git Commit | C255: of:=IF(COUNTIF([.A255:.A$2002];[.A255]) > 1; 1; 0) -> 1
A256: 2020-07-13 | B256: Git Commit | C256: of:=IF(COUNTIF([.A256:.A$2002];[.A256]) > 1; 1; 0) -> 1
A257: 2020-07-13 | B257: Git Commit | C257: of:=IF(COUNTIF([.A257:.A$2002];[.A257]) > 1; 1; 0) -> 1
A258: 2020-07-13 | B258: Git Commit | C258: of:=IF(COUNTIF([.A258:.A$2002];[.A258]) > 1; 1; 0) -> 1
A259: 2020-07-13 | B259: Git Commit | C259: of:=IF(COUNTIF([.A259:.A$2002];[.A259]) > 1; 1; 0) -> 1
A260: 2020-07-13 | B260: Git Commit | C260: of:=IF(COUNTIF([.A260:.A$2002];[.A260]) > 1; 1; 0) -> 1
A261: 2020-07-13 | B261: Git Commit | C261: of:=IF(COUNTIF([.A261:.A$2002];[.A261]) > 1; 1; 0) -> 1
A262: 2020-07-13 | B262: Git Commit | C262: of:=IF(COUNTIF([.A262:.A$2002];[.A262]) > 1; 1; 0) -> 1
A263: 2020-07-13 | B263: Git Commit | C263: of:=IF(COUNTIF([.A263:.A$2002];[.A263]) > 1; 1; 0) -> 1
A264: 2020-07-13 | B264: Git Commit | C264: of:=IF(COUNTIF([.A264:.A$2002];[.A264]) > 1; 1; 0) -> 1
A265: 2020-07-13 | B265: Git Commit | C265: of:=IF(COUNTIF([.A265:.A$2002];[.A265]) > 1; 1; 0) -> 1
A266: 2020-07-13 | B266: Git Commit | C266: of:=IF(COUNTIF([.A266:.A$2002];[.A266]) > 1; 1; 0) -> 1
A267: 2020-06-24 | B267: Git Commit | C267: of:=IF(COUNTIF([.A267:.A$2002];[.A267]) > 1; 1; 0) -> 1
A268: 2020-06-24 | B268: Git Commit | C268: of:=IF(COUNTIF([.A268:.A$2002];[.A268]) > 1; 1; 0) -> 1
A269: 2020-06-24 | B269: Git Commit | C269: of:=IF(COUNTIF([.A269:.A$2002];[.A269]) > 1; 1; 0) -> 1
A270: 2020-06-24 | B270: Git Commit | C270: of:=IF(COUNTIF([.A270:.A$2002];[.A270]) > 1; 1; 0) -> 1
A271: 2020-06-24 | B271: Git Commit | C271: of:=IF(COUNTIF([.A271:.A$2002];[.A271]) > 1; 1; 0) -> 1
A272: 2020-06-24 | B272: Git Commit | C272: of:=IF(COUNTIF([.A272:.A$2002];[.A272]) > 1; 1; 0) -> 1
A273: 2020-06-24 | B273: Git Commit | C273: of:=IF(COUNTIF([.A273:.A$2002];[.A273]) > 1; 1; 0) -> 1
A274: 2020-06-24 | B274: Git Commit | C274: of:=IF(COUNTIF([.A274:.A$2002];[.A274]) > 1; 1; 0) -> 1
A275: 2020-06-24 | B275: Git Commit | C275: of:=IF(COUNTIF([.A275:.A$2002];[.A275]) > 1; 1; 0) -> 1
A276: 2020-06-24 | B276: Git Commit | C276: of:=IF(COUNTIF([.A276:.A$2002];[.A276]) > 1; 1; 0) -> 0
A277: 2020-06-23 | B277: Git Commit | C277: of:=IF(COUNTIF([.A277:.A$2002];[.A277]) > 1; 1; 0) -> 1
A278: 2020-06-23 | B278: Git Commit | C278: of:=IF(COUNTIF([.A278:.A$2002];[.A278]) > 1; 1; 0) -> 1
A279: 2020-06-23 | B279: Git Commit | C279: of:=IF(COUNTIF([.A279:.A$2002];[.A279]) > 1; 1; 0) -> 1
A280: 2020-06-23 | B280: Git Commit | C280: of:=IF(COUNTIF([.A280:.A$2002];[.A280]) > 1; 1; 0) -> 1
A281: 2020-06-23 | B281: Git Commit | C281: of:=IF(COUNTIF([.A281:.A$2002];[.A281]) > 1; 1; 0) -> 1
A282: 2020-06-23 | B282: Git Commit | C282: of:=IF(COUNTIF([.A282:.A$2002];[.A282]) > 1; 1; 0) -> 1
A283: 2020-06-23 | B283: Git Commit | C283: of:=IF(COUNTIF([.A283:.A$2002];[.A283]) > 1; 1; 0) -> 1
A284: 2020-06-23 | B284: Git Commit | C284: of:=IF(COUNTIF([.A284:.A$2002];[.A284]) > 1; 1; 0) -> 1
A285: 2020-06-23 | B285: Git Commit | C285: of:=IF(COUNTIF([.A285:.A$2002];[.A285]) > 1; 1; 0) -> 1
A286: 2020-06-23 | B286: Git Commit | C286: of:=IF(COUNTIF([.A286:.A$2002];[.A286]) > 1; 1; 0) -> 1
A287: 2020-06-23 | B287: Git Commit | C287: of:=IF(COUNTIF([.A287:.A$2002];[.A287]) > 1; 1; 0) -> 1
A288: 2020-06-23 | B288: Git Commit | C288: of:=IF(COUNTIF([.A288:.A$2002];[.A288]) > 1; 1; 0) -> 1
A289: 2020-06-23 | B289: Git Commit | C289: of:=IF(COUNTIF([.A289:.A$2002];[.A289]) > 1; 1; 0) -> 1
A290: 2020-06-23 | B290: Git Commit | C290: of:=IF(COUNTIF([.A290:.A$2002];[.A290]) > 1; 1; 0) -> 1
A291: 2020-06-23 | B291: Git Commit | C291: of:=IF(COUNTIF([.A291:.A$2002];[.A291]) > 1; 1; 0) -> 1
A292: 2020-06-23 | B292: Git Commit | C292: of:=IF(COUNTIF([.A292:.A$2002];[.A292]) > 1; 1; 0) -> 1
A293: 2020-06-23 | B293: Git Commit | C293: of:=IF(COUNTIF([.A293:.A$2002];[.A293]) > 1; 1; 0) -> 0
A294: 2020-06-22 | B294: Git Commit | C294: of:=IF(COUNTIF([.A294:.A$2002];[.A294]) > 1; 1; 0) -> 1
A295: 2020-06-22 | B295: Git Commit | C295: of:=IF(COUNTIF([.A295:.A$2002];[.A295]) > 1; 1; 0) -> 1
A296: 2020-06-22 | B296: Git Commit | C296: of:=IF(COUNTIF([.A296:.A$2002];[.A296]) > 1; 1; 0) -> 1
A297: 2020-06-22 | B297: Git Commit | C297: of:=IF(COUNTIF([.A297:.A$2002];[.A297]) > 1; 1; 0) -> 1
A298: 2020-06-22 | B298: Git Commit | C298: of:=IF(COUNTIF([.A298:.A$2002];[.A298]) > 1; 1; 0) -> 1
A299: 2020-06-22 | B299: Git Commit | C299: of:=IF(COUNTIF([.A299:.A$2002];[.A299]) > 1; 1; 0) -> 1
A300: 2020-06-22 | B300: Git Commit | C300: of:=IF(COUNTIF([.A300:.A$2002];[.A300]) > 1; 1; 0) -> 1
A301: 2020-06-22 | B301: Git Commit | C301: of:=IF(COUNTIF([.A301:.A$2002];[.A301]) > 1; 1; 0) -> 1
A302: 2020-06-22 | B302: Git Commit | C302: of:=IF(COUNTIF([.A302:.A$2002];[.A302]) > 1; 1; 0) -> 1
A303: 2020-06-22 | B303: Git Commit | C303: of:=IF(COUNTIF([.A303:.A$2002];[.A303]) > 1; 1; 0) -> 1
A304: 2020-06-22 | B304: Git Commit | C304: of:=IF(COUNTIF([.A304:.A$2002];[.A304]) > 1; 1; 0) -> 1
A305: 2020-06-22 | B305: Git Commit | C305: of:=IF(COUNTIF([.A305:.A$2002];[.A305]) > 1; 1; 0) -> 1
A306: 2020-06-18 | B306: Git Commit | C306: of:=IF(COUNTIF([.A306:.A$2002];[.A306]) > 1; 1; 0) -> 1
A307: 2020-06-18 | B307: Git Commit | C307: of:=IF(COUNTIF([.A307:.A$2002];[.A307]) > 1; 1; 0) -> 1
A308: 2020-06-18 | B308: Git Commit | C308: of:=IF(COUNTIF([.A308:.A$2002];[.A308]) > 1; 1; 0) -> 1
A309: 2020-06-18 | B309: Git Commit | C309: of:=IF(COUNTIF([.A309:.A$2002];[.A309]) > 1; 1; 0) -> 0
A310: 2020-06-16 | B310: Git Commit | C310: of:=IF(COUNTIF([.A310:.A$2002];[.A310]) > 1; 1; 0) -> 1
A311: 2020-06-16 | B311: Git Commit | C311: of:=IF(COUNTIF([.A311:.A$2002];[.A311]) > 1; 1; 0) -> 1
A312: 2020-06-16 | B312: Git Commit | C312: of:=IF(COUNTIF([.A312:.A$2002];[.A312]) > 1; 1; 0) -> 1
A313: 2020-06-16 | B313: Git Commit | C313: of:=IF(COUNTIF([.A313:.A$2002];[.A313]) > 1; 1; 0) -> 0
A314: 2020-05-20 | B314: Git Commit | C314: of:=IF(COUNTIF([.A314:.A$2002];[.A314]) > 1; 1; 0) -> 1
A315: 2020-05-20 | B315: Git Commit | C315: of:=IF(COUNTIF([.A315:.A$2002];[.A315]) > 1; 1; 0) -> 0
A316: 2020-05-19 | B316: Git Commit | C316: of:=IF(COUNTIF([.A316:.A$2002];[.A316]) > 1; 1; 0) -> 1
A317: 2020-05-19 | B317: Git Commit | C317: of:=IF(COUNTIF([.A317:.A$2002];[.A317]) > 1; 1; 0) -> 1
A318: 2020-05-19 | B318: Git Commit | C318: of:=IF(COUNTIF([.A318:.A$2002];[.A318]) > 1; 1; 0) -> 1
A319: 2020-05-19 | B319: Git Commit | C319: of:=IF(COUNTIF([.A319:.A$2002];[.A319]) > 1; 1; 0) -> 1
A320: 2020-05-19 | B320: Git Commit | C320: of:=IF(COUNTIF([.A320:.A$2002];[.A320]) > 1; 1; 0) -> 1
A321: 2020-05-19 | B321: Git Commit | C321: of:=IF(COUNTIF([.A321:.A$2002];[.A321]) > 1; 1; 0) -> 1
A322: 2020-05-19 | B322: Git Commit | C322: of:=IF(COUNTIF([.A322:.A$2002];[.A322]) > 1; 1; 0) -> 1
A323: 2020-05-19 | B323: Git Commit | C323: of:=IF(COUNTIF([.A323:.A$2002];[.A323]) > 1; 1; 0) -> 1
A324: 2020-05-19 | B324: Git Commit | C324: of:=IF(COUNTIF([.A324:.A$2002];[.A324]) > 1; 1; 0) -> 1
A325: 2020-05-19 | B325: Git Commit | C325: of:=IF(COUNTIF([.A325:.A$2002];[.A325]) > 1; 1; 0) -> 1
A326: 2020-05-19 | B326: Git Commit | C326: of:=IF(COUNTIF([.A326:.A$2002];[.A326]) > 1; 1; 0) -> 1
A327: 2020-05-19 | B327: Git Commit | C327: of:=IF(COUNTIF([.A327:.A$2002];[.A327]) > 1; 1; 0) -> 1
A328: 2020-05-19 | B328: Git Commit | C328: of:=IF(COUNTIF([.A328:.A$2002];[.A328]) > 1; 1; 0) -> 1
A329: 2020-05-19 | B329: Git Commit | C329: of:=IF(COUNTIF([.A329:.A$2002];[.A329]) > 1; 1; 0) -> 1
A330: 2020-05-18 | B330: Git Commit | C330: of:=IF(COUNTIF([.A330:.A$2002];[.A330]) > 1; 1; 0) -> 1
A331: 2020-05-18 | B331: Git Commit | C331: of:=IF(COUNTIF([.A331:.A$2002];[.A331]) > 1; 1; 0) -> 1
A332: 2020-05-18 | B332: Git Commit | C332: of:=IF(COUNTIF([.A332:.A$2002];[.A332]) > 1; 1; 0) -> 1
A333: 2020-05-18 | B333: Git Commit | C333: of:=IF(COUNTIF([.A333:.A$2002];[.A333]) > 1; 1; 0) -> 1
A334: 2020-05-18 | B334: Git Commit | C334: of:=IF(COUNTIF([.A334:.A$2002];[.A334]) > 1; 1; 0) -> 1
A335: 2020-05-18 | B335: Git Commit | C335: of:=IF(COUNTIF([.A335:.A$2002];[.A335]) > 1; 1; 0) -> 1
A336: 2020-05-18 | B336: Git Commit | C336: of:=IF(COUNTIF([.A336:.A$2002];[.A336]) > 1; 1; 0) -> 0
A337: 2020-05-09 | B337: Git Commit | C337: of:=IF(COUNTIF([.A337:.A$2002];[.A337]) > 1; 1; 0) -> 1
A338: 2020-05-09 | B338: Git Commit | C338: of:=IF(COUNTIF([.A338:.A$2002];[.A338]) > 1; 1; 0) -> 1
A339: 2020-05-09 | B339: Git Commit | C339: of:=IF(COUNTIF([.A339:.A$2002];[.A339]) > 1; 1; 0) -> 1
A340: 2020-05-09 | B340: Git Commit | C340: of:=IF(COUNTIF([.A340:.A$2002];[.A340]) > 1; 1; 0) -> 1
A341: 2020-05-09 | B341: Git Commit | C341: of:=IF(COUNTIF([.A341:.A$2002];[.A341]) > 1; 1; 0) -> 1
A342: 2020-05-09 | B342: Git Commit | C342: of:=IF(COUNTIF([.A342:.A$2002];[.A342]) > 1; 1; 0) -> 1
A343: 2020-05-09 | B343: Git Commit | C343: of:=IF(COUNTIF([.A343:.A$2002];[.A343]) > 1; 1; 0) -> 1
A344: 2020-05-09 | B344: Git Commit | C344: of:=IF(COUNTIF([.A344:.A$2002];[.A344]) > 1; 1; 0) -> 0
A345: 2020-05-07 | B345: Git Commit | C345: of:=IF(COUNTIF([.A345:.A$2002];[.A345]) > 1; 1; 0) -> 1
A346: 2020-05-07 | B346: Git Commit | C346: of:=IF(COUNTIF([.A346:.A$2002];[.A346]) > 1; 1; 0) -> 1
A347: 2020-05-07 | B347: Git Commit | C347: of:=IF(COUNTIF([.A347:.A$2002];[.A347]) > 1; 1; 0) -> 1
A348: 2020-05-07 | B348: Git Commit | C348: of:=IF(COUNTIF([.A348:.A$2002];[.A348]) > 1; 1; 0) -> 1
A349: 2020-05-07 | B349: Git Commit | C349: of:=IF(COUNTIF([.A349:.A$2002];[.A349]) > 1; 1; 0) -> 1
A350: 2020-05-07 | B350: Git Commit | C350: of:=IF(COUNTIF([.A350:.A$2002];[.A350]) > 1; 1; 0) -> 1
A351: 2020-05-07 | B351: Git Commit | C351: of:=IF(COUNTIF([.A351:.A$2002];[.A351]) > 1; 1; 0) -> 1
A352: 2020-05-07 | B352: Git Commit | C352: of:=IF(COUNTIF([.A352:.A$2002];[.A352]) > 1; 1; 0) -> 1
A353: 2020-05-07 | B353: Git Commit | C353: of:=IF(COUNTIF([.A353:.A$2002];[.A353]) > 1; 1; 0) -> 1
A354: 2020-05-07 | B354: Git Commit | C354: of:=IF(COUNTIF([.A354:.A$2002];[.A354]) > 1; 1; 0) -> 1
A355: 2020-05-07 | B355: Git Commit | C355: of:=IF(COUNTIF([.A355:.A$2002];[.A355]) > 1; 1; 0) -> 1
A356: 2020-05-07 | B356: Git Commit | C356: of:=IF(COUNTIF([.A356:.A$2002];[.A356]) > 1; 1; 0) -> 1
A357: 2020-05-07 | B357: Git Commit | C357: of:=IF(COUNTIF([.A357:.A$2002];[.A357]) > 1; 1; 0) -> 1
A358: 2020-05-07 | B358: Git Commit | C358: of:=IF(COUNTIF([.A358:.A$2002];[.A358]) > 1; 1; 0) -> 1
A359: 2020-05-07 | B359: Git Commit | C359: of:=IF(COUNTIF([.A359:.A$2002];[.A359]) > 1; 1; 0) -> 1
A360: 2020-05-07 | B360: Git Commit | C360: of:=IF(COUNTIF([.A360:.A$2002];[.A360]) > 1; 1; 0) -> 1
A361: 2020-05-07 | B361: Git Commit | C361: of:=IF(COUNTIF([.A361:.A$2002];[.A361]) > 1; 1; 0) -> 1
A362: 2020-05-07 | B362: Git Commit | C362: of:=IF(COUNTIF([.A362:.A$2002];[.A362]) > 1; 1; 0) -> 1
A363: 2020-05-07 | B363: Git Commit | C363: of:=IF(COUNTIF([.A363:.A$2002];[.A363]) > 1; 1; 0) -> 1
A364: 2020-05-07 | B364: Git Commit | C364: of:=IF(COUNTIF([.A364:.A$2002];[.A364]) > 1; 1; 0) -> 1
A365: 2020-05-07 | B365: Git Commit | C365: of:=IF(COUNTIF([.A365:.A$2002];[.A365]) > 1; 1; 0) -> 1
A366: 2020-05-07 | B366: Git Commit | C366: of:=IF(COUNTIF([.A366:.A$2002];[.A366]) > 1; 1; 0) -> 1
A367: 2020-05-07 | B367: Git Commit | C367: of:=IF(COUNTIF([.A367:.A$2002];[.A367]) > 1; 1; 0) -> 1
A368: 2020-05-06 | B368: Git Commit | C368: of:=IF(COUNTIF([.A368:.A$2002];[.A368]) > 1; 1; 0) -> 1
A369: 2020-05-06 | B369: Git Commit | C369: of:=IF(COUNTIF([.A369:.A$2002];[.A369]) > 1; 1; 0) -> 1
A370: 2020-05-06 | B370: Git Commit | C370: of:=IF(COUNTIF([.A370:.A$2002];[.A370]) > 1; 1; 0) -> 1
A371: 2020-05-06 | B371: Git Commit | C371: of:=IF(COUNTIF([.A371:.A$2002];[.A371]) > 1; 1; 0) -> 1
A372: 2020-05-06 | B372: Git Commit | C372: of:=IF(COUNTIF([.A372:.A$2002];[.A372]) > 1; 1; 0) -> 1
A373: 2020-05-06 | B373: Git Commit | C373: of:=IF(COUNTIF([.A373:.A$2002];[.A373]) > 1; 1; 0) -> 1
A374: 2020-05-06 | B374: Git Commit | C374: of:=IF(COUNTIF([.A374:.A$2002];[.A374]) > 1; 1; 0) -> 0
A375: 2020-05-05 | B375: Git Commit | C375: of:=IF(COUNTIF([.A375:.A$2002];[.A375]) > 1; 1; 0) -> 1
A376: 2020-05-05 | B376: Git Commit | C376: of:=IF(COUNTIF([.A376:.A$2002];[.A376]) > 1; 1; 0) -> 1
A377: 2020-05-05 | B377: Git Commit | C377: of:=IF(COUNTIF([.A377:.A$2002];[.A377]) > 1; 1; 0) -> 1
A378: 2020-05-05 | B378: Git Commit | C378: of:=IF(COUNTIF([.A378:.A$2002];[.A378]) > 1; 1; 0) -> 0
A379: 2020-05-01 | B379: Git Commit | C379: of:=IF(COUNTIF([.A379:.A$2002];[.A379]) > 1; 1; 0) -> 1
A380: 2020-05-01 | B380: Git Commit | C380: of:=IF(COUNTIF([.A380:.A$2002];[.A380]) > 1; 1; 0) -> 1
A381: 2020-05-01 | B381: Git Commit | C381: of:=IF(COUNTIF([.A381:.A$2002];[.A381]) > 1; 1; 0) -> 1
A382: 2020-05-01 | B382: Git Commit | C382: of:=IF(COUNTIF([.A382:.A$2002];[.A382]) > 1; 1; 0) -> 1
A383: 2020-05-01 | B383: Git Commit | C383: of:=IF(COUNTIF([.A383:.A$2002];[.A383]) > 1; 1; 0) -> 1
A384: 2020-05-01 | B384: Git Commit | C384: of:=IF(COUNTIF([.A384:.A$2002];[.A384]) > 1; 1; 0) -> 1
A385: 2020-05-01 | B385: Git Commit | C385: of:=IF(COUNTIF([.A385:.A$2002];[.A385]) > 1; 1; 0) -> 0
A386: 2020-04-30 | B386: Git Commit | C386: of:=IF(COUNTIF([.A386:.A$2002];[.A386]) > 1; 1; 0) -> 1
A387: 2020-04-30 | B387: Git Commit | C387: of:=IF(COUNTIF([.A387:.A$2002];[.A387]) > 1; 1; 0) -> 1
A388: 2020-04-30 | B388: Git Commit | C388: of:=IF(COUNTIF([.A388:.A$2002];[.A388]) > 1; 1; 0) -> 1
A389: 2020-04-30 | B389: Git Commit | C389: of:=IF(COUNTIF([.A389:.A$2002];[.A389]) > 1; 1; 0) -> 1
A390: 2020-04-30 | B390: Git Commit | C390: of:=IF(COUNTIF([.A390:.A$2002];[.A390]) > 1; 1; 0) -> 1
A391: 2020-04-30 | B391: Git Commit | C391: of:=IF(COUNTIF([.A391:.A$2002];[.A391]) > 1; 1; 0) -> 1
A392: 2020-04-30 | B392: Git Commit | C392: of:=IF(COUNTIF([.A392:.A$2002];[.A392]) > 1; 1; 0) -> 1
A393: 2020-04-30 | B393: Git Commit | C393: of:=IF(COUNTIF([.A393:.A$2002];[.A393]) > 1; 1; 0) -> 1
A394: 2020-04-30 | B394: Git Commit | C394: of:=IF(COUNTIF([.A394:.A$2002];[.A394]) > 1; 1; 0) -> 1
A395: 2020-04-30 | B395: Git Commit | C395: of:=IF(COUNTIF([.A395:.A$2002];[.A395]) > 1; 1; 0) -> 1
A396: 2020-04-30 | B396: Git Commit | C396: of:=IF(COUNTIF([.A396:.A$2002];[.A396]) > 1; 1; 0) -> 1
A397: 2020-04-30 | B397: Git Commit | C397: of:=IF(COUNTIF([.A397:.A$2002];[.A397]) > 1; 1; 0) -> 1
A398: 2020-04-30 | B398: Git Commit | C398: of:=IF(COUNTIF([.A398:.A$2002];[.A398]) > 1; 1; 0) -> 0
A399: 2020-04-14 | B399: Git Commit | C399: of:=IF(COUNTIF([.A399:.A$2002];[.A399]) > 1; 1; 0) -> 1
A400: 2020-04-14 | B400: Git Commit | C400: of:=IF(COUNTIF([.A400:.A$2002];[.A400]) > 1; 1; 0) -> 1
A401: 2020-04-14 | B401: Git Commit | C401: of:=IF(COUNTIF([.A401:.A$2002];[.A401]) > 1; 1; 0) -> 1
A402: 2020-04-14 | B402: Git Commit | C402: of:=IF(COUNTIF([.A402:.A$2002];[.A402]) > 1; 1; 0) -> 0
A403: 2020-04-11 | B403: Git Commit | C403: of:=IF(COUNTIF([.A403:.A$2002];[.A403]) > 1; 1; 0) -> 1
A404: 2020-04-11 | B404: Git Commit | C404: of:=IF(COUNTIF([.A404:.A$2002];[.A404]) > 1; 1; 0) -> 1
A405: 2020-04-11 | B405: Git Commit | C405: of:=IF(COUNTIF([.A405:.A$2002];[.A405]) > 1; 1; 0) -> 1
A406: 2020-04-11 | B406: Git Commit | C406: of:=IF(COUNTIF([.A406:.A$2002];[.A406]) > 1; 1; 0) -> 1
A407: 2020-04-11 | B407: Git Commit | C407: of:=IF(COUNTIF([.A407:.A$2002];[.A407]) > 1; 1; 0) -> 1
A408: 2020-04-11 | B408: Git Commit | C408: of:=IF(COUNTIF([.A408:.A$2002];[.A408]) > 1; 1; 0) -> 1
A409: 2020-04-11 | B409: Git Commit | C409: of:=IF(COUNTIF([.A409:.A$2002];[.A409]) > 1; 1; 0) -> 1
A410: 2020-04-11 | B410: Git Commit | C410: of:=IF(COUNTIF([.A410:.A$2002];[.A410]) > 1; 1; 0) -> 1
A411: 2020-04-11 | B411: Git Commit | C411: of:=IF(COUNTIF([.A411:.A$2002];[.A411]) > 1; 1; 0) -> 1
A412: 2020-04-11 | B412: Git Commit | C412: of:=IF(COUNTIF([.A412:.A$2002];[.A412]) > 1; 1; 0) -> 1
A413: 2020-04-10 | B413: Git Commit | C413: of:=IF(COUNTIF([.A413:.A$2002];[.A413]) > 1; 1; 0) -> 1
A414: 2020-04-10 | B414: Git Commit | C414: of:=IF(COUNTIF([.A414:.A$2002];[.A414]) > 1; 1; 0) -> 1
A415: 2020-04-10 | B415: Git Commit | C415: of:=IF(COUNTIF([.A415:.A$2002];[.A415]) > 1; 1; 0) -> 1
A416: 2020-04-10 | B416: Git Commit | C416: of:=IF(COUNTIF([.A416:.A$2002];[.A416]) > 1; 1; 0) -> 1
A417: 2020-04-09 | B417: Git Commit | C417: of:=IF(COUNTIF([.A417:.A$2002];[.A417]) > 1; 1; 0) -> 1
A418: 2020-04-09 | B418: Git Commit | C418: of:=IF(COUNTIF([.A418:.A$2002];[.A418]) > 1; 1; 0) -> 1
A419: 2020-04-09 | B419: Git Commit | C419: of:=IF(COUNTIF([.A419:.A$2002];[.A419]) > 1; 1; 0) -> 1
A420: 2020-04-09 | B420: Git Commit | C420: of:=IF(COUNTIF([.A420:.A$2002];[.A420]) > 1; 1; 0) -> 1
A421: 2020-04-09 | B421: Git Commit | C421: of:=IF(COUNTIF([.A421:.A$2002];[.A421]) > 1; 1; 0) -> 1
A422: 2020-04-09 | B422: Git Commit | C422: of:=IF(COUNTIF([.A422:.A$2002];[.A422]) > 1; 1; 0) -> 1
A423: 2020-04-09 | B423: Git Commit | C423: of:=IF(COUNTIF([.A423:.A$2002];[.A423]) > 1; 1; 0) -> 1
A424: 2020-04-09 | B424: Git Commit | C424: of:=IF(COUNTIF([.A424:.A$2002];[.A424]) > 1; 1; 0) -> 1
A425: 2020-04-09 | B425: Git Commit | C425: of:=IF(COUNTIF([.A425:.A$2002];[.A425]) > 1; 1; 0) -> 1
A426: 2020-04-09 | B426: Git Commit | C426: of:=IF(COUNTIF([.A426:.A$2002];[.A426]) > 1; 1; 0) -> 1
A427: 2020-04-09 | B427: Git Commit | C427: of:=IF(COUNTIF([.A427:.A$2002];[.A427]) > 1; 1; 0) -> 1
A428: 2020-04-09 | B428: Git Commit | C428: of:=IF(COUNTIF([.A428:.A$2002];[.A428]) > 1; 1; 0) -> 1
A429: 2020-04-09 | B429: Git Commit | C429: of:=IF(COUNTIF([.A429:.A$2002];[.A429]) > 1; 1; 0) -> 1
A430: 2020-04-09 | B430: Git Commit | C430: of:=IF(COUNTIF([.A430:.A$2002];[.A430]) > 1; 1; 0) -> 1
A431: 2020-04-09 | B431: Git Commit | C431: of:=IF(COUNTIF([.A431:.A$2002];[.A431]) > 1; 1; 0) -> 1
A432: 2020-04-09 | B432: Git Commit | C432: of:=IF(COUNTIF([.A432:.A$2002];[.A432]) > 1; 1; 0) -> 1
A433: 2020-04-09 | B433: Git Commit | C433: of:=IF(COUNTIF([.A433:.A$2002];[.A433]) > 1; 1; 0) -> 1
A434: 2020-04-09 | B434: Git Commit | C434: of:=IF(COUNTIF([.A434:.A$2002];[.A434]) > 1; 1; 0) -> 1
A435: 2020-04-09 | B435: Git Commit | C435: of:=IF(COUNTIF([.A435:.A$2002];[.A435]) > 1; 1; 0) -> 1
A436: 2020-04-09 | B436: Git Commit | C436: of:=IF(COUNTIF([.A436:.A$2002];[.A436]) > 1; 1; 0) -> 1
A437: 2020-04-07 | B437: Git Commit | C437: of:=IF(COUNTIF([.A437:.A$2002];[.A437]) > 1; 1; 0) -> 1
A438: 2020-04-07 | B438: Git Commit | C438: of:=IF(COUNTIF([.A438:.A$2002];[.A438]) > 1; 1; 0) -> 1
A439: 2020-04-07 | B439: Git Commit | C439: of:=IF(COUNTIF([.A439:.A$2002];[.A439]) > 1; 1; 0) -> 1
A440: 2020-04-07 | B440: Git Commit | C440: of:=IF(COUNTIF([.A440:.A$2002];[.A440]) > 1; 1; 0) -> 1
A441: 2020-04-07 | B441: Git Commit | C441: of:=IF(COUNTIF([.A441:.A$2002];[.A441]) > 1; 1; 0) -> 1
A442: 2020-04-07 | B442: Git Commit | C442: of:=IF(COUNTIF([.A442:.A$2002];[.A442]) > 1; 1; 0) -> 1
A443: 2020-04-07 | B443: Git Commit | C443: of:=IF(COUNTIF([.A443:.A$2002];[.A443]) > 1; 1; 0) -> 1
A444: 2020-04-07 | B444: Git Commit | C444: of:=IF(COUNTIF([.A444:.A$2002];[.A444]) > 1; 1; 0) -> 1
A445: 2020-04-07 | B445: Git Commit | C445: of:=IF(COUNTIF([.A445:.A$2002];[.A445]) > 1; 1; 0) -> 1
A446: 2020-04-07 | B446: Git Commit | C446: of:=IF(COUNTIF([.A446:.A$2002];[.A446]) > 1; 1; 0) -> 1
A447: 2020-04-07 | B447: Git Commit | C447: of:=IF(COUNTIF([.A447:.A$2002];[.A447]) > 1; 1; 0) -> 1
A448: 2020-04-07 | B448: Git Commit | C448: of:=IF(COUNTIF([.A448:.A$2002];[.A448]) > 1; 1; 0) -> 1
A449: 2020-04-07 | B449: Git Commit | C449: of:=IF(COUNTIF([.A449:.A$2002];[.A449]) > 1; 1; 0) -> 1
A450: 2020-04-07 | B450: Git Commit | C450: of:=IF(COUNTIF([.A450:.A$2002];[.A450]) > 1; 1; 0) -> 1
A451: 2020-04-06 | B451: Git Commit | C451: of:=IF(COUNTIF([.A451:.A$2002];[.A451]) > 1; 1; 0) -> 1
A452: 2020-04-06 | B452: Git Commit | C452: of:=IF(COUNTIF([.A452:.A$2002];[.A452]) > 1; 1; 0) -> 1
A453: 2020-04-06 | B453: Git Commit | C453: of:=IF(COUNTIF([.A453:.A$2002];[.A453]) > 1; 1; 0) -> 1
A454: 2020-04-06 | B454: Git Commit | C454: of:=IF(COUNTIF([.A454:.A$2002];[.A454]) > 1; 1; 0) -> 1
A455: 2020-04-06 | B455: Git Commit | C455: of:=IF(COUNTIF([.A455:.A$2002];[.A455]) > 1; 1; 0) -> 1
A456: 2020-04-06 | B456: Git Commit | C456: of:=IF(COUNTIF([.A456:.A$2002];[.A456]) > 1; 1; 0) -> 1
A457: 2020-04-06 | B457: Git Commit | C457: of:=IF(COUNTIF([.A457:.A$2002];[.A457]) > 1; 1; 0) -> 1
A458: 2020-04-06 | B458: Git Commit | C458: of:=IF(COUNTIF([.A458:.A$2002];[.A458]) > 1; 1; 0) -> 1
A459: 2020-04-06 | B459: Git Commit | C459: of:=IF(COUNTIF([.A459:.A$2002];[.A459]) > 1; 1; 0) -> 1
A460: 2020-04-06 | B460: Git Commit | C460: of:=IF(COUNTIF([.A460:.A$2002];[.A460]) > 1; 1; 0) -> 1
A461: 2020-04-06 | B461: Git Commit | C461: of:=IF(COUNTIF([.A461:.A$2002];[.A461]) > 1; 1; 0) -> 1
A462: 2020-04-06 | B462: Git Commit | C462: of:=IF(COUNTIF([.A462:.A$2002];[.A462]) > 1; 1; 0) -> 1
A463: 2020-04-06 | B463: Git Commit | C463: of:=IF(COUNTIF([.A463:.A$2002];[.A463]) > 1; 1; 0) -> 0
A464: 2020-04-02 | B464: Git Commit | C464: of:=IF(COUNTIF([.A464:.A$2002];[.A464]) > 1; 1; 0) -> 1
A465: 2020-04-02 | B465: Git Commit | C465: of:=IF(COUNTIF([.A465:.A$2002];[.A465]) > 1; 1; 0) -> 1
A466: 2020-04-02 | B466: Git Commit | C466: of:=IF(COUNTIF([.A466:.A$2002];[.A466]) > 1; 1; 0) -> 1
A467: 2020-04-02 | B467: Git Commit | C467: of:=IF(COUNTIF([.A467:.A$2002];[.A467]) > 1; 1; 0) -> 1
A468: 2020-04-02 | B468: Git Commit | C468: of:=IF(COUNTIF([.A468:.A$2002];[.A468]) > 1; 1; 0) -> 1
A469: 2020-04-02 | B469: Git Commit | C469: of:=IF(COUNTIF([.A469:.A$2002];[.A469]) > 1; 1; 0) -> 1
A470: 2020-04-02 | B470: Git Commit | C470: of:=IF(COUNTIF([.A470:.A$2002];[.A470]) > 1; 1; 0) -> 1
A471: 2020-04-01 | B471: Git Commit | C471: of:=IF(COUNTIF([.A471:.A$2002];[.A471]) > 1; 1; 0) -> 1
A472: 2020-04-01 | B472: Git Commit | C472: of:=IF(COUNTIF([.A472:.A$2002];[.A472]) > 1; 1; 0) -> 1
A473: 2020-04-01 | B473: Git Commit | C473: of:=IF(COUNTIF([.A473:.A$2002];[.A473]) > 1; 1; 0) -> 1
A474: 2020-04-01 | B474: Git Commit | C474: of:=IF(COUNTIF([.A474:.A$2002];[.A474]) > 1; 1; 0) -> 1
A475: 2020-04-01 | B475: Git Commit | C475: of:=IF(COUNTIF([.A475:.A$2002];[.A475]) > 1; 1; 0) -> 1
A476: 2020-04-01 | B476: Git Commit | C476: of:=IF(COUNTIF([.A476:.A$2002];[.A476]) > 1; 1; 0) -> 1
A477: 2020-04-01 | B477: Git Commit | C477: of:=IF(COUNTIF([.A477:.A$2002];[.A477]) > 1; 1; 0) -> 1
A478: 2020-04-01 | B478: Git Commit | C478: of:=IF(COUNTIF([.A478:.A$2002];[.A478]) > 1; 1; 0) -> 1
A479: 2020-04-01 | B479: Git Commit | C479: of:=IF(COUNTIF([.A479:.A$2002];[.A479]) > 1; 1; 0) -> 1
A480: 2020-04-01 | B480: Git Commit | C480: of:=IF(COUNTIF([.A480:.A$2002];[.A480]) > 1; 1; 0) -> 1
A481: 2020-04-01 | B481: Git Commit | C481: of:=IF(COUNTIF([.A481:.A$2002];[.A481]) > 1; 1; 0) -> 1
A482: 2020-04-01 | B482: Git Commit | C482: of:=IF(COUNTIF([.A482:.A$2002];[.A482]) > 1; 1; 0) -> 1
A483: 2020-04-01 | B483: Git Commit | C483: of:=IF(COUNTIF([.A483:.A$2002];[.A483]) > 1; 1; 0) -> 1
A484: 2020-03-31 | B484: Git Commit | C484: of:=IF(COUNTIF([.A484:.A$2002];[.A484]) > 1; 1; 0) -> 1
A485: 2020-03-31 | B485: Git Commit | C485: of:=IF(COUNTIF([.A485:.A$2002];[.A485]) > 1; 1; 0) -> 1
A486: 2020-03-31 | B486: Git Commit | C486: of:=IF(COUNTIF([.A486:.A$2002];[.A486]) > 1; 1; 0) -> 1
A487: 2020-03-31 | B487: Git Commit | C487: of:=IF(COUNTIF([.A487:.A$2002];[.A487]) > 1; 1; 0) -> 1
A488: 2020-03-31 | B488: Git Commit | C488: of:=IF(COUNTIF([.A488:.A$2002];[.A488]) > 1; 1; 0) -> 1
A489: 2020-03-31 | B489: Git Commit | C489: of:=IF(COUNTIF([.A489:.A$2002];[.A489]) > 1; 1; 0) -> 1
A490: 2020-03-31 | B490: Git Commit | C490: of:=IF(COUNTIF([.A490:.A$2002];[.A490]) > 1; 1; 0) -> 1
A491: 2020-03-31 | B491: Git Commit | C491: of:=IF(COUNTIF([.A491:.A$2002];[.A491]) > 1; 1; 0) -> 0
A492: 2020-03-30 | B492: Git Commit | C492: of:=IF(COUNTIF([.A492:.A$2002];[.A492]) > 1; 1; 0) -> 1
A493: 2020-03-30 | B493: Git Commit | C493: of:=IF(COUNTIF([.A493:.A$2002];[.A493]) > 1; 1; 0) -> 1
A494: 2020-03-30 | B494: Git Commit | C494: of:=IF(COUNTIF([.A494:.A$2002];[.A494]) > 1; 1; 0) -> 1
A495: 2020-03-30 | B495: Git Commit | C495: of:=IF(COUNTIF([.A495:.A$2002];[.A495]) > 1; 1; 0) -> 1
A496: 2020-03-30 | B496: Git Commit | C496: of:=IF(COUNTIF([.A496:.A$2002];[.A496]) > 1; 1; 0) -> 1
A497: 2020-03-30 | B497: Git Commit | C497: of:=IF(COUNTIF([.A497:.A$2002];[.A497]) > 1; 1; 0) -> 1
A498: 2020-03-30 | B498: Git Commit | C498: of:=IF(COUNTIF([.A498:.A$2002];[.A498]) > 1; 1; 0) -> 1
A499: 2020-03-30 | B499: Git Commit | C499: of:=IF(COUNTIF([.A499:.A$2002];[.A499]) > 1; 1; 0) -> 1
A500: 2020-03-30 | B500: Git Commit | C500: of:=IF(COUNTIF([.A500:.A$2002];[.A500]) > 1; 1; 0) -> 1
A501: 2020-03-30 | B501: Git Commit | C501: of:=IF(COUNTIF([.A501:.A$2002];[.A501]) > 1; 1; 0) -> 1
A502: 2020-03-30 | B502: Git Commit | C502: of:=IF(COUNTIF([.A502:.A$2002];[.A502]) > 1; 1; 0) -> 1
A503: 2020-03-30 | B503: Git Commit | C503: of:=IF(COUNTIF([.A503:.A$2002];[.A503]) > 1; 1; 0) -> 1
A504: 2020-03-30 | B504: Git Commit | C504: of:=IF(COUNTIF([.A504:.A$2002];[.A504]) > 1; 1; 0) -> 1
A505: 2020-03-30 | B505: Git Commit | C505: of:=IF(COUNTIF([.A505:.A$2002];[.A505]) > 1; 1; 0) -> 1
A506: 2020-03-30 | B506: Git Commit | C506: of:=IF(COUNTIF([.A506:.A$2002];[.A506]) > 1; 1; 0) -> 1
A507: 2020-03-30 | B507: Git Commit | C507: of:=IF(COUNTIF([.A507:.A$2002];[.A507]) > 1; 1; 0) -> 1
A508: 2020-03-30 | B508: Git Commit | C508: of:=IF(COUNTIF([.A508:.A$2002];[.A508]) > 1; 1; 0) -> 1
A509: 2020-03-30 | B509: Git Commit | C509: of:=IF(COUNTIF([.A509:.A$2002];[.A509]) > 1; 1; 0) -> 1
A510: 2020-03-30 | B510: Git Commit | C510: of:=IF(COUNTIF([.A510:.A$2002];[.A510]) > 1; 1; 0) -> 1
A511: 2020-03-30 | B511: Git Commit | C511: of:=IF(COUNTIF([.A511:.A$2002];[.A511]) > 1; 1; 0) -> 1
A512: 2020-03-30 | B512: Git Commit | C512: of:=IF(COUNTIF([.A512:.A$2002];[.A512]) > 1; 1; 0) -> 1
A513: 2020-03-30 | B513: Git Commit | C513: of:=IF(COUNTIF([.A513:.A$2002];[.A513]) > 1; 1; 0) -> 1
A514: 2020-03-30 | B514: Git Commit | C514: of:=IF(COUNTIF([.A514:.A$2002];[.A514]) > 1; 1; 0) -> 1
A515: 2020-03-29 | B515: Git Commit | C515: of:=IF(COUNTIF([.A515:.A$2002];[.A515]) > 1; 1; 0) -> 1
A516: 2020-03-29 | B516: Git Commit | C516: of:=IF(COUNTIF([.A516:.A$2002];[.A516]) > 1; 1; 0) -> 1
A517: 2020-03-29 | B517: Git Commit | C517: of:=IF(COUNTIF([.A517:.A$2002];[.A517]) > 1; 1; 0) -> 1
A518: 2020-03-29 | B518: Git Commit | C518: of:=IF(COUNTIF([.A518:.A$2002];[.A518]) > 1; 1; 0) -> 1
A519: 2020-03-29 | B519: Git Commit | C519: of:=IF(COUNTIF([.A519:.A$2002];[.A519]) > 1; 1; 0) -> 1
A520: 2020-03-29 | B520: Git Commit | C520: of:=IF(COUNTIF([.A520:.A$2002];[.A520]) > 1; 1; 0) -> 1
A521: 2020-03-29 | B521: Git Commit | C521: of:=IF(COUNTIF([.A521:.A$2002];[.A521]) > 1; 1; 0) -> 1
A522: 2020-03-29 | B522: Git Commit | C522: of:=IF(COUNTIF([.A522:.A$2002];[.A522]) > 1; 1; 0) -> 1
A523: 2020-03-29 | B523: Git Commit | C523: of:=IF(COUNTIF([.A523:.A$2002];[.A523]) > 1; 1; 0) -> 1
A524: 2020-03-29 | B524: Git Commit | C524: of:=IF(COUNTIF([.A524:.A$2002];[.A524]) > 1; 1; 0) -> 1
A525: 2020-03-29 | B525: Git Commit | C525: of:=IF(COUNTIF([.A525:.A$2002];[.A525]) > 1; 1; 0) -> 1
A526: 2020-03-29 | B526: Git Commit | C526: of:=IF(COUNTIF([.A526:.A$2002];[.A526]) > 1; 1; 0) -> 1
A527: 2020-03-29 | B527: Git Commit | C527: of:=IF(COUNTIF([.A527:.A$2002];[.A527]) > 1; 1; 0) -> 1
A528: 2020-03-29 | B528: Git Commit | C528: of:=IF(COUNTIF([.A528:.A$2002];[.A528]) > 1; 1; 0) -> 1
A529: 2020-03-29 | B529: Git Commit | C529: of:=IF(COUNTIF([.A529:.A$2002];[.A529]) > 1; 1; 0) -> 1
A530: 2020-03-29 | B530: Git Commit | C530: of:=IF(COUNTIF([.A530:.A$2002];[.A530]) > 1; 1; 0) -> 1
A531: 2020-03-29 | B531: Git Commit | C531: of:=IF(COUNTIF([.A531:.A$2002];[.A531]) > 1; 1; 0) -> 1
A532: 2020-03-29 | B532: Git Commit | C532: of:=IF(COUNTIF([.A532:.A$2002];[.A532]) > 1; 1; 0) -> 1
A533: 2020-03-29 | B533: Git Commit | C533: of:=IF(COUNTIF([.A533:.A$2002];[.A533]) > 1; 1; 0) -> 1
A534: 2020-03-29 | B534: Git Commit | C534: of:=IF(COUNTIF([.A534:.A$2002];[.A534]) > 1; 1; 0) -> 1
A535: 2020-03-28 | B535: Git Commit | C535: of:=IF(COUNTIF([.A535:.A$2002];[.A535]) > 1; 1; 0) -> 1
A536: 2020-03-28 | B536: Git Commit | C536: of:=IF(COUNTIF([.A536:.A$2002];[.A536]) > 1; 1; 0) -> 1
A537: 2020-03-28 | B537: Git Commit | C537: of:=IF(COUNTIF([.A537:.A$2002];[.A537]) > 1; 1; 0) -> 1
A538: 2020-03-28 | B538: Git Commit | C538: of:=IF(COUNTIF([.A538:.A$2002];[.A538]) > 1; 1; 0) -> 1
A539: 2020-03-28 | B539: Git Commit | C539: of:=IF(COUNTIF([.A539:.A$2002];[.A539]) > 1; 1; 0) -> 1
A540: 2020-03-28 | B540: Git Commit | C540: of:=IF(COUNTIF([.A540:.A$2002];[.A540]) > 1; 1; 0) -> 1
A541: 2020-03-28 | B541: Git Commit | C541: of:=IF(COUNTIF([.A541:.A$2002];[.A541]) > 1; 1; 0) -> 1
A542: 2020-03-28 | B542: Git Commit | C542: of:=IF(COUNTIF([.A542:.A$2002];[.A542]) > 1; 1; 0) -> 1
A543: 2020-03-28 | B543: Git Commit | C543: of:=IF(COUNTIF([.A543:.A$2002];[.A543]) > 1; 1; 0) -> 1
A544: 2020-03-28 | B544: Git Commit | C544: of:=IF(COUNTIF([.A544:.A$2002];[.A544]) > 1; 1; 0) -> 1
A545: 2020-03-28 | B545: Git Commit | C545: of:=IF(COUNTIF([.A545:.A$2002];[.A545]) > 1; 1; 0) -> 1
A546: 2020-03-28 | B546: Git Commit | C546: of:=IF(COUNTIF([.A546:.A$2002];[.A546]) > 1; 1; 0) -> 1
A547: 2020-03-28 | B547: Git Commit | C547: of:=IF(COUNTIF([.A547:.A$2002];[.A547]) > 1; 1; 0) -> 1
A548: 2020-03-28 | B548: Git Commit | C548: of:=IF(COUNTIF([.A548:.A$2002];[.A548]) > 1; 1; 0) -> 1
A549: 2020-03-28 | B549: Git Commit | C549: of:=IF(COUNTIF([.A549:.A$2002];[.A549]) > 1; 1; 0) -> 1
A550: 2020-03-28 | B550: Git Commit | C550: of:=IF(COUNTIF([.A550:.A$2002];[.A550]) > 1; 1; 0) -> 1
A551: 2020-03-27 | B551: Git Commit | C551: of:=IF(COUNTIF([.A551:.A$2002];[.A551]) > 1; 1; 0) -> 1
A552: 2020-03-27 | B552: Git Commit | C552: of:=IF(COUNTIF([.A552:.A$2002];[.A552]) > 1; 1; 0) -> 1
A553: 2020-03-27 | B553: Git Commit | C553: of:=IF(COUNTIF([.A553:.A$2002];[.A553]) > 1; 1; 0) -> 1
A554: 2020-03-27 | B554: Git Commit | C554: of:=IF(COUNTIF([.A554:.A$2002];[.A554]) > 1; 1; 0) -> 1
A555: 2020-03-27 | B555: Git Commit | C555: of:=IF(COUNTIF([.A555:.A$2002];[.A555]) > 1; 1; 0) -> 1
A556: 2020-03-27 | B556: Git Commit | C556: of:=IF(COUNTIF([.A556:.A$2002];[.A556]) > 1; 1; 0) -> 1
A557: 2020-03-27 | B557: Git Commit | C557: of:=IF(COUNTIF([.A557:.A$2002];[.A557]) > 1; 1; 0) -> 1
A558: 2020-03-27 | B558: Git Commit | C558: of:=IF(COUNTIF([.A558:.A$2002];[.A558]) > 1; 1; 0) -> 1
A559: 2020-03-27 | B559: Git Commit | C559: of:=IF(COUNTIF([.A559:.A$2002];[.A559]) > 1; 1; 0) -> 1
A560: 2020-03-27 | B560: Git Commit | C560: of:=IF(COUNTIF([.A560:.A$2002];[.A560]) > 1; 1; 0) -> 1
A561: 2020-03-27 | B561: Git Commit | C561: of:=IF(COUNTIF([.A561:.A$2002];[.A561]) > 1; 1; 0) -> 1
A562: 2020-03-27 | B562: Git Commit | C562: of:=IF(COUNTIF([.A562:.A$2002];[.A562]) > 1; 1; 0) -> 1
A563: 2020-03-27 | B563: Git Commit | C563: of:=IF(COUNTIF([.A563:.A$2002];[.A563]) > 1; 1; 0) -> 1
A564: 2020-03-27 | B564: Git Commit | C564: of:=IF(COUNTIF([.A564:.A$2002];[.A564]) > 1; 1; 0) -> 1
A565: 2020-03-27 | B565: Git Commit | C565: of:=IF(COUNTIF([.A565:.A$2002];[.A565]) > 1; 1; 0) -> 1
A566: 2020-03-27 | B566: Git Commit | C566: of:=IF(COUNTIF([.A566:.A$2002];[.A566]) > 1; 1; 0) -> 1
A567: 2020-03-27 | B567: Git Commit | C567: of:=IF(COUNTIF([.A567:.A$2002];[.A567]) > 1; 1; 0) -> 1
A568: 2020-03-27 | B568: Git Commit | C568: of:=IF(COUNTIF([.A568:.A$2002];[.A568]) > 1; 1; 0) -> 1
A569: 2020-03-27 | B569: Git Commit | C569: of:=IF(COUNTIF([.A569:.A$2002];[.A569]) > 1; 1; 0) -> 1
A570: 2020-03-27 | B570: Git Commit | C570: of:=IF(COUNTIF([.A570:.A$2002];[.A570]) > 1; 1; 0) -> 1
A571: 2020-03-27 | B571: Git Commit | C571: of:=IF(COUNTIF([.A571:.A$2002];[.A571]) > 1; 1; 0) -> 1
A572: 2020-03-27 | B572: Git Commit | C572: of:=IF(COUNTIF([.A572:.A$2002];[.A572]) > 1; 1; 0) -> 1
A573: 2020-03-27 | B573: Git Commit | C573: of:=IF(COUNTIF([.A573:.A$2002];[.A573]) > 1; 1; 0) -> 1
A574: 2020-03-27 | B574: Git Commit | C574: of:=IF(COUNTIF([.A574:.A$2002];[.A574]) > 1; 1; 0) -> 1
A575: 2020-03-27 | B575: Git Commit | C575: of:=IF(COUNTIF([.A575:.A$2002];[.A575]) > 1; 1; 0) -> 1
A576: 2020-03-27 | B576: Git Commit | C576: of:=IF(COUNTIF([.A576:.A$2002];[.A576]) > 1; 1; 0) -> 1
A577: 2020-03-27 | B577: Git Commit | C577: of:=IF(COUNTIF([.A577:.A$2002];[.A577]) > 1; 1; 0) -> 1
A578: 2020-03-27 | B578: Git Commit | C578: of:=IF(COUNTIF([.A578:.A$2002];[.A578]) > 1; 1; 0) -> 1
A579: 2020-03-27 | B579: Git Commit | C579: of:=IF(COUNTIF([.A579:.A$2002];[.A579]) > 1; 1; 0) -> 1
A580: 2020-03-27 | B580: Git Commit | C580: of:=IF(COUNTIF([.A580:.A$2002];[.A580]) > 1; 1; 0) -> 1
A581: 2020-03-27 | B581: Git Commit | C581: of:=IF(COUNTIF([.A581:.A$2002];[.A581]) > 1; 1; 0) -> 1
A582: 2020-03-27 | B582: Git Commit | C582: of:=IF(COUNTIF([.A582:.A$2002];[.A582]) > 1; 1; 0) -> 1
A583: 2020-03-26 | B583: Git Commit | C583: of:=IF(COUNTIF([.A583:.A$2002];[.A583]) > 1; 1; 0) -> 1
A584: 2020-03-26 | B584: Git Commit | C584: of:=IF(COUNTIF([.A584:.A$2002];[.A584]) > 1; 1; 0) -> 1
A585: 2020-03-26 | B585: Git Commit | C585: of:=IF(COUNTIF([.A585:.A$2002];[.A585]) > 1; 1; 0) -> 1
A586: 2020-03-26 | B586: Git Commit | C586: of:=IF(COUNTIF([.A586:.A$2002];[.A586]) > 1; 1; 0) -> 1
A587: 2020-03-26 | B587: Git Commit | C587: of:=IF(COUNTIF([.A587:.A$2002];[.A587]) > 1; 1; 0) -> 1
A588: 2020-03-26 | B588: Git Commit | C588: of:=IF(COUNTIF([.A588:.A$2002];[.A588]) > 1; 1; 0) -> 1
A589: 2020-03-26 | B589: Git Commit | C589: of:=IF(COUNTIF([.A589:.A$2002];[.A589]) > 1; 1; 0) -> 1
A590: 2020-03-26 | B590: Git Commit | C590: of:=IF(COUNTIF([.A590:.A$2002];[.A590]) > 1; 1; 0) -> 1
A591: 2020-03-26 | B591: Git Commit | C591: of:=IF(COUNTIF([.A591:.A$2002];[.A591]) > 1; 1; 0) -> 1
A592: 2020-03-26 | B592: Git Commit | C592: of:=IF(COUNTIF([.A592:.A$2002];[.A592]) > 1; 1; 0) -> 1
A593: 2020-03-26 | B593: Git Commit | C593: of:=IF(COUNTIF([.A593:.A$2002];[.A593]) > 1; 1; 0) -> 1
A594: 2020-03-26 | B594: Git Commit | C594: of:=IF(COUNTIF([.A594:.A$2002];[.A594]) > 1; 1; 0) -> 1
A595: 2020-03-26 | B595: Git Commit | C595: of:=IF(COUNTIF([.A595:.A$2002];[.A595]) > 1; 1; 0) -> 1
A596: 2020-03-26 | B596: Git Commit | C596: of:=IF(COUNTIF([.A596:.A$2002];[.A596]) > 1; 1; 0) -> 1
A597: 2020-03-26 | B597: Git Commit | C597: of:=IF(COUNTIF([.A597:.A$2002];[.A597]) > 1; 1; 0) -> 1
A598: 2020-03-26 | B598: Git Commit | C598: of:=IF(COUNTIF([.A598:.A$2002];[.A598]) > 1; 1; 0) -> 1
A599: 2020-03-26 | B599: Git Commit | C599: of:=IF(COUNTIF([.A599:.A$2002];[.A599]) > 1; 1; 0) -> 1
A600: 2020-03-26 | B600: Git Commit | C600: of:=IF(COUNTIF([.A600:.A$2002];[.A600]) > 1; 1; 0) -> 1
A601: 2020-03-26 | B601: Git Commit | C601: of:=IF(COUNTIF([.A601:.A$2002];[.A601]) > 1; 1; 0) -> 1
A602: 2020-03-26 | B602: Git Commit | C602: of:=IF(COUNTIF([.A602:.A$2002];[.A602]) > 1; 1; 0) -> 1
A603: 2020-03-26 | B603: Git Commit | C603: of:=IF(COUNTIF([.A603:.A$2002];[.A603]) > 1; 1; 0) -> 1
A604: 2020-03-26 | B604: Git Commit | C604: of:=IF(COUNTIF([.A604:.A$2002];[.A604]) > 1; 1; 0) -> 1
A605: 2020-03-25 | B605: Git Commit | C605: of:=IF(COUNTIF([.A605:.A$2002];[.A605]) > 1; 1; 0) -> 0
A606: 2020-03-24 | B606: Git Commit | C606: of:=IF(COUNTIF([.A606:.A$2002];[.A606]) > 1; 1; 0) -> 1
A607: 2020-03-24 | B607: Git Commit | C607: of:=IF(COUNTIF([.A607:.A$2002];[.A607]) > 1; 1; 0) -> 1
A608: 2020-03-24 | B608: Git Commit | C608: of:=IF(COUNTIF([.A608:.A$2002];[.A608]) > 1; 1; 0) -> 1
A609: 2020-03-24 | B609: Git Commit | C609: of:=IF(COUNTIF([.A609:.A$2002];[.A609]) > 1; 1; 0) -> 1
A610: 2020-03-24 | B610: Git Commit | C610: of:=IF(COUNTIF([.A610:.A$2002];[.A610]) > 1; 1; 0) -> 1
A611: 2020-03-24 | B611: Git Commit | C611: of:=IF(COUNTIF([.A611:.A$2002];[.A611]) > 1; 1; 0) -> 1
A612: 2020-03-24 | B612: Git Commit | C612: of:=IF(COUNTIF([.A612:.A$2002];[.A612]) > 1; 1; 0) -> 1
A613: 2020-03-24 | B613: Git Commit | C613: of:=IF(COUNTIF([.A613:.A$2002];[.A613]) > 1; 1; 0) -> 1
A614: 2020-03-24 | B614: Git Commit | C614: of:=IF(COUNTIF([.A614:.A$2002];[.A614]) > 1; 1; 0) -> 1
A615: 2020-03-24 | B615: Git Commit | C615: of:=IF(COUNTIF([.A615:.A$2002];[.A615]) > 1; 1; 0) -> 1
A616: 2020-03-24 | B616: Git Commit | C616: of:=IF(COUNTIF([.A616:.A$2002];[.A616]) > 1; 1; 0) -> 1
A617: 2020-03-24 | B617: Git Commit | C617: of:=IF(COUNTIF([.A617:.A$2002];[.A617]) > 1; 1; 0) -> 1
A618: 2020-03-24 | B618: Git Commit | C618: of:=IF(COUNTIF([.A618:.A$2002];[.A618]) > 1; 1; 0) -> 1
A619: 2020-03-23 | B619: Git Commit | C619: of:=IF(COUNTIF([.A619:.A$2002];[.A619]) > 1; 1; 0) -> 1
A620: 2020-03-23 | B620: Git Commit | C620: of:=IF(COUNTIF([.A620:.A$2002];[.A620]) > 1; 1; 0) -> 1
A621: 2020-03-23 | B621: Git Commit | C621: of:=IF(COUNTIF([.A621:.A$2002];[.A621]) > 1; 1; 0) -> 1
A622: 2020-03-23 | B622: Git Commit | C622: of:=IF(COUNTIF([.A622:.A$2002];[.A622]) > 1; 1; 0) -> 1
A623: 2020-03-23 | B623: Git Commit | C623: of:=IF(COUNTIF([.A623:.A$2002];[.A623]) > 1; 1; 0) -> 1
A624: 2020-03-23 | B624: Git Commit | C624: of:=IF(COUNTIF([.A624:.A$2002];[.A624]) > 1; 1; 0) -> 1
A625: 2020-03-23 | B625: Git Commit | C625: of:=IF(COUNTIF([.A625:.A$2002];[.A625]) > 1; 1; 0) -> 1
A626: 2020-03-23 | B626: Git Commit | C626: of:=IF(COUNTIF([.A626:.A$2002];[.A626]) > 1; 1; 0) -> 1
A627: 2020-03-23 | B627: Git Commit | C627: of:=IF(COUNTIF([.A627:.A$2002];[.A627]) > 1; 1; 0) -> 1
A628: 2020-03-23 | B628: Git Commit | C628: of:=IF(COUNTIF([.A628:.A$2002];[.A628]) > 1; 1; 0) -> 1
A629: 2020-03-23 | B629: Git Commit | C629: of:=IF(COUNTIF([.A629:.A$2002];[.A629]) > 1; 1; 0) -> 1
A630: 2020-03-23 | B630: Git Commit | C630: of:=IF(COUNTIF([.A630:.A$2002];[.A630]) > 1; 1; 0) -> 0
A631: 2020-03-11 | B631: Git Commit | C631: of:=IF(COUNTIF([.A631:.A$2002];[.A631]) > 1; 1; 0) -> 1
A632: 2020-03-11 | B632: Git Commit | C632: of:=IF(COUNTIF([.A632:.A$2002];[.A632]) > 1; 1; 0) -> 1
A633: 2020-03-11 | B633: Git Commit | C633: of:=IF(COUNTIF([.A633:.A$2002];[.A633]) > 1; 1; 0) -> 1
A634: 2020-03-11 | B634: Git Commit | C634: of:=IF(COUNTIF([.A634:.A$2002];[.A634]) > 1; 1; 0) -> 1
A635: 2020-03-11 | B635: Git Commit | C635: of:=IF(COUNTIF([.A635:.A$2002];[.A635]) > 1; 1; 0) -> 1
A636: 2020-03-11 | B636: Git Commit | C636: of:=IF(COUNTIF([.A636:.A$2002];[.A636]) > 1; 1; 0) -> 1
A637: 2020-03-11 | B637: Git Commit | C637: of:=IF(COUNTIF([.A637:.A$2002];[.A637]) > 1; 1; 0) -> 0
A638: 2020-03-10 | B638: Git Commit | C638: of:=IF(COUNTIF([.A638:.A$2002];[.A638]) > 1; 1; 0) -> 1
A639: 2020-03-10 | B639: Git Commit | C639: of:=IF(COUNTIF([.A639:.A$2002];[.A639]) > 1; 1; 0) -> 1
A640: 2020-03-10 | B640: Git Commit | C640: of:=IF(COUNTIF([.A640:.A$2002];[.A640]) > 1; 1; 0) -> 1
A641: 2020-03-10 | B641: Git Commit | C641: of:=IF(COUNTIF([.A641:.A$2002];[.A641]) > 1; 1; 0) -> 1
A642: 2020-03-10 | B642: Git Commit | C642: of:=IF(COUNTIF([.A642:.A$2002];[.A642]) > 1; 1; 0) -> 1
A643: 2020-03-10 | B643: Git Commit | C643: of:=IF(COUNTIF([.A643:.A$2002];[.A643]) > 1; 1; 0) -> 1
A644: 2020-03-10 | B644: Git Commit | C644: of:=IF(COUNTIF([.A644:.A$2002];[.A644]) > 1; 1; 0) -> 1
A645: 2020-03-10 | B645: Git Commit | C645: of:=IF(COUNTIF([.A645:.A$2002];[.A645]) > 1; 1; 0) -> 1
A646: 2020-03-10 | B646: Git Commit | C646: of:=IF(COUNTIF([.A646:.A$2002];[.A646]) > 1; 1; 0) -> 1
A647: 2020-03-10 | B647: Git Commit | C647: of:=IF(COUNTIF([.A647:.A$2002];[.A647]) > 1; 1; 0) -> 1
A648: 2020-03-10 | B648: Git Commit | C648: of:=IF(COUNTIF([.A648:.A$2002];[.A648]) > 1; 1; 0) -> 1
A649: 2020-03-10 | B649: Git Commit | C649: of:=IF(COUNTIF([.A649:.A$2002];[.A649]) > 1; 1; 0) -> 1
A650: 2020-03-10 | B650: Git Commit | C650: of:=IF(COUNTIF([.A650:.A$2002];[.A650]) > 1; 1; 0) -> 1
A651: 2020-03-10 | B651: Git Commit | C651: of:=IF(COUNTIF([.A651:.A$2002];[.A651]) > 1; 1; 0) -> 1
A652: 2020-03-10 | B652: Git Commit | C652: of:=IF(COUNTIF([.A652:.A$2002];[.A652]) > 1; 1; 0) -> 1
A653: 2020-03-10 | B653: Git Commit | C653: of:=IF(COUNTIF([.A653:.A$2002];[.A653]) > 1; 1; 0) -> 1
A654: 2020-03-10 | B654: Git Commit | C654: of:=IF(COUNTIF([.A654:.A$2002];[.A654]) > 1; 1; 0) -> 1
A655: 2020-03-10 | B655: Git Commit | C655: of:=IF(COUNTIF([.A655:.A$2002];[.A655]) > 1; 1; 0) -> 1
A656: 2020-03-10 | B656: Git Commit | C656: of:=IF(COUNTIF([.A656:.A$2002];[.A656]) > 1; 1; 0) -> 1
A657: 2020-03-10 | B657: Git Commit | C657: of:=IF(COUNTIF([.A657:.A$2002];[.A657]) > 1; 1; 0) -> 1
A658: 2020-03-10 | B658: Git Commit | C658: of:=IF(COUNTIF([.A658:.A$2002];[.A658]) > 1; 1; 0) -> 1
A659: 2020-03-10 | B659: Git Commit | C659: of:=IF(COUNTIF([.A659:.A$2002];[.A659]) > 1; 1; 0) -> 1
A660: 2020-03-10 | B660: Git Commit | C660: of:=IF(COUNTIF([.A660:.A$2002];[.A660]) > 1; 1; 0) -> 1
A661: 2020-03-10 | B661: Git Commit | C661: of:=IF(COUNTIF([.A661:.A$2002];[.A661]) > 1; 1; 0) -> 1
A662: 2020-03-10 | B662: Git Commit | C662: of:=IF(COUNTIF([.A662:.A$2002];[.A662]) > 1; 1; 0) -> 0
A663: 2020-03-08 | B663: Git Commit | C663: of:=IF(COUNTIF([.A663:.A$2002];[.A663]) > 1; 1; 0) -> 1
A664: 2020-03-08 | B664: Git Commit | C664: of:=IF(COUNTIF([.A664:.A$2002];[.A664]) > 1; 1; 0) -> 1
A665: 2020-03-08 | B665: Git Commit | C665: of:=IF(COUNTIF([.A665:.A$2002];[.A665]) > 1; 1; 0) -> 1
A666: 2020-03-06 | B666: Git Commit | C666: of:=IF(COUNTIF([.A666:.A$2002];[.A666]) > 1; 1; 0) -> 1
A667: 2020-03-06 | B667: Git Commit | C667: of:=IF(COUNTIF([.A667:.A$2002];[.A667]) > 1; 1; 0) -> 1
A668: 2020-03-06 | B668: Git Commit | C668: of:=IF(COUNTIF([.A668:.A$2002];[.A668]) > 1; 1; 0) -> 1
A669: 2020-03-06 | B669: Git Commit | C669: of:=IF(COUNTIF([.A669:.A$2002];[.A669]) > 1; 1; 0) -> 1
A670: 2020-03-06 | B670: Git Commit | C670: of:=IF(COUNTIF([.A670:.A$2002];[.A670]) > 1; 1; 0) -> 1
A671: 2020-03-05 | B671: Git Commit | C671: of:=IF(COUNTIF([.A671:.A$2002];[.A671]) > 1; 1; 0) -> 1
A672: 2020-03-05 | B672: Git Commit | C672: of:=IF(COUNTIF([.A672:.A$2002];[.A672]) > 1; 1; 0) -> 1
A673: 2020-02-18 | B673: Git Commit | C673: of:=IF(COUNTIF([.A673:.A$2002];[.A673]) > 1; 1; 0) -> 1
A674: 2020-02-18 | B674: Git Commit | C674: of:=IF(COUNTIF([.A674:.A$2002];[.A674]) > 1; 1; 0) -> 1
A675: 2020-02-18 | B675: Git Commit | C675: of:=IF(COUNTIF([.A675:.A$2002];[.A675]) > 1; 1; 0) -> 1
A676: 2020-02-18 | B676: Git Commit | C676: of:=IF(COUNTIF([.A676:.A$2002];[.A676]) > 1; 1; 0) -> 1
A677: 2020-02-18 | B677: Git Commit | C677: of:=IF(COUNTIF([.A677:.A$2002];[.A677]) > 1; 1; 0) -> 1
A678: 2020-02-18 | B678: Git Commit | C678: of:=IF(COUNTIF([.A678:.A$2002];[.A678]) > 1; 1; 0) -> 1
A679: 2020-02-18 | B679: Git Commit | C679: of:=IF(COUNTIF([.A679:.A$2002];[.A679]) > 1; 1; 0) -> 1
A680: 2020-02-18 | B680: Git Commit | C680: of:=IF(COUNTIF([.A680:.A$2002];[.A680]) > 1; 1; 0) -> 1
A681: 2020-02-18 | B681: Git Commit | C681: of:=IF(COUNTIF([.A681:.A$2002];[.A681]) > 1; 1; 0) -> 1
A682: 2020-02-18 | B682: Git Commit | C682: of:=IF(COUNTIF([.A682:.A$2002];[.A682]) > 1; 1; 0) -> 1
A683: 2020-02-18 | B683: Git Commit | C683: of:=IF(COUNTIF([.A683:.A$2002];[.A683]) > 1; 1; 0) -> 1
A684: 2020-02-18 | B684: Git Commit | C684: of:=IF(COUNTIF([.A684:.A$2002];[.A684]) > 1; 1; 0) -> 1
A685: 2020-02-17 | B685: Git Commit | C685: of:=IF(COUNTIF([.A685:.A$2002];[.A685]) > 1; 1; 0) -> 1
A686: 2020-02-17 | B686: Git Commit | C686: of:=IF(COUNTIF([.A686:.A$2002];[.A686]) > 1; 1; 0) -> 1
A687: 2020-02-17 | B687: Git Commit | C687: of:=IF(COUNTIF([.A687:.A$2002];[.A687]) > 1; 1; 0) -> 0
A688: 2020-02-16 | B688: Git Commit | C688: of:=IF(COUNTIF([.A688:.A$2002];[.A688]) > 1; 1; 0) -> 1
A689: 2020-02-16 | B689: Git Commit | C689: of:=IF(COUNTIF([.A689:.A$2002];[.A689]) > 1; 1; 0) -> 1
A690: 2020-02-16 | B690: Git Commit | C690: of:=IF(COUNTIF([.A690:.A$2002];[.A690]) > 1; 1; 0) -> 1
A691: 2020-02-16 | B691: Git Commit | C691: of:=IF(COUNTIF([.A691:.A$2002];[.A691]) > 1; 1; 0) -> 1
A692: 2020-02-16 | B692: Git Commit | C692: of:=IF(COUNTIF([.A692:.A$2002];[.A692]) > 1; 1; 0) -> 1
A693: 2020-02-16 | B693: Git Commit | C693: of:=IF(COUNTIF([.A693:.A$2002];[.A693]) > 1; 1; 0) -> 1
A694: 2020-02-16 | B694: Git Commit | C694: of:=IF(COUNTIF([.A694:.A$2002];[.A694]) > 1; 1; 0) -> 1
A695: 2020-02-16 | B695: Git Commit | C695: of:=IF(COUNTIF([.A695:.A$2002];[.A695]) > 1; 1; 0) -> 1
A696: 2020-02-16 | B696: Git Commit | C696: of:=IF(COUNTIF([.A696:.A$2002];[.A696]) > 1; 1; 0) -> 1
A697: 2020-02-16 | B697: Git Commit | C697: of:=IF(COUNTIF([.A697:.A$2002];[.A697]) > 1; 1; 0) -> 1
A698: 2020-02-16 | B698: Git Commit | C698: of:=IF(COUNTIF([.A698:.A$2002];[.A698]) > 1; 1; 0) -> 1
A699: 2020-02-16 | B699: Git Commit | C699: of:=IF(COUNTIF([.A699:.A$2002];[.A699]) > 1; 1; 0) -> 1
A700: 2020-02-16 | B700: Git Commit | C700: of:=IF(COUNTIF([.A700:.A$2002];[.A700]) > 1; 1; 0) -> 1
A701: 2020-02-16 | B701: Git Commit | C701: of:=IF(COUNTIF([.A701:.A$2002];[.A701]) > 1; 1; 0) -> 1
A702: 2020-02-16 | B702: Git Commit | C702: of:=IF(COUNTIF([.A702:.A$2002];[.A702]) > 1; 1; 0) -> 1
A703: 2020-02-16 | B703: Git Commit | C703: of:=IF(COUNTIF([.A703:.A$2002];[.A703]) > 1; 1; 0) -> 1
A704: 2020-02-16 | B704: Git Commit | C704: of:=IF(COUNTIF([.A704:.A$2002];[.A704]) > 1; 1; 0) -> 1
A705: 2020-02-16 | B705: Git Commit | C705: of:=IF(COUNTIF([.A705:.A$2002];[.A705]) > 1; 1; 0) -> 0
A706: 2020-02-15 | B706: Git Commit | C706: of:=IF(COUNTIF([.A706:.A$2002];[.A706]) > 1; 1; 0) -> 1
A707: 2020-02-15 | B707: Git Commit | C707: of:=IF(COUNTIF([.A707:.A$2002];[.A707]) > 1; 1; 0) -> 1
A708: 2020-02-15 | B708: Git Commit | C708: of:=IF(COUNTIF([.A708:.A$2002];[.A708]) > 1; 1; 0) -> 1
A709: 2020-02-11 | B709: Git Commit | C709: of:=IF(COUNTIF([.A709:.A$2002];[.A709]) > 1; 1; 0) -> 1
A710: 2020-02-11 | B710: Git Commit | C710: of:=IF(COUNTIF([.A710:.A$2002];[.A710]) > 1; 1; 0) -> 1
A711: 2020-02-10 | B711: Git Commit | C711: of:=IF(COUNTIF([.A711:.A$2002];[.A711]) > 1; 1; 0) -> 1
A712: 2020-02-10 | B712: Git Commit | C712: of:=IF(COUNTIF([.A712:.A$2002];[.A712]) > 1; 1; 0) -> 1
A713: 2020-02-10 | B713: Git Commit | C713: of:=IF(COUNTIF([.A713:.A$2002];[.A713]) > 1; 1; 0) -> 1
A714: 2020-02-10 | B714: Git Commit | C714: of:=IF(COUNTIF([.A714:.A$2002];[.A714]) > 1; 1; 0) -> 1
A715: 2020-02-10 | B715: Git Commit | C715: of:=IF(COUNTIF([.A715:.A$2002];[.A715]) > 1; 1; 0) -> 1
A716: 2020-02-10 | B716: Git Commit | C716: of:=IF(COUNTIF([.A716:.A$2002];[.A716]) > 1; 1; 0) -> 1
A717: 2020-02-10 | B717: Git Commit | C717: of:=IF(COUNTIF([.A717:.A$2002];[.A717]) > 1; 1; 0) -> 1
A718: 2020-02-10 | B718: Git Commit | C718: of:=IF(COUNTIF([.A718:.A$2002];[.A718]) > 1; 1; 0) -> 1
A719: 2020-02-10 | B719: Git Commit | C719: of:=IF(COUNTIF([.A719:.A$2002];[.A719]) > 1; 1; 0) -> 1
A720: 2020-02-10 | B720: Git Commit | C720: of:=IF(COUNTIF([.A720:.A$2002];[.A720]) > 1; 1; 0) -> 1
A721: 2020-02-10 | B721: Git Commit | C721: of:=IF(COUNTIF([.A721:.A$2002];[.A721]) > 1; 1; 0) -> 1
A722: 2020-02-10 | B722: Git Commit | C722: of:=IF(COUNTIF([.A722:.A$2002];[.A722]) > 1; 1; 0) -> 1
A723: 2020-02-07 | B723: Git Commit | C723: of:=IF(COUNTIF([.A723:.A$2002];[.A723]) > 1; 1; 0) -> 1
A724: 2020-02-07 | B724: Git Commit | C724: of:=IF(COUNTIF([.A724:.A$2002];[.A724]) > 1; 1; 0) -> 1
A725: 2020-02-07 | B725: Git Commit | C725: of:=IF(COUNTIF([.A725:.A$2002];[.A725]) > 1; 1; 0) -> 1
A726: 2020-02-07 | B726: Git Commit | C726: of:=IF(COUNTIF([.A726:.A$2002];[.A726]) > 1; 1; 0) -> 1
A727: 2020-02-07 | B727: Git Commit | C727: of:=IF(COUNTIF([.A727:.A$2002];[.A727]) > 1; 1; 0) -> 0
A728: 2020-02-06 | B728: Git Commit | C728: of:=IF(COUNTIF([.A728:.A$2002];[.A728]) > 1; 1; 0) -> 1
A729: 2020-02-06 | B729: Git Commit | C729: of:=IF(COUNTIF([.A729:.A$2002];[.A729]) > 1; 1; 0) -> 1
A730: 2020-02-06 | B730: Git Commit | C730: of:=IF(COUNTIF([.A730:.A$2002];[.A730]) > 1; 1; 0) -> 1
A731: 2020-02-06 | B731: Git Commit | C731: of:=IF(COUNTIF([.A731:.A$2002];[.A731]) > 1; 1; 0) -> 1
A732: 2020-02-06 | B732: Git Commit | C732: of:=IF(COUNTIF([.A732:.A$2002];[.A732]) > 1; 1; 0) -> 1
A733: 2020-02-06 | B733: Git Commit | C733: of:=IF(COUNTIF([.A733:.A$2002];[.A733]) > 1; 1; 0) -> 1
A734: 2020-02-06 | B734: Git Commit | C734: of:=IF(COUNTIF([.A734:.A$2002];[.A734]) > 1; 1; 0) -> 1
A735: 2020-02-06 | B735: Git Commit | C735: of:=IF(COUNTIF([.A735:.A$2002];[.A735]) > 1; 1; 0) -> 1
A736: 2020-02-06 | B736: Git Commit | C736: of:=IF(COUNTIF([.A736:.A$2002];[.A736]) > 1; 1; 0) -> 1
A737: 2020-02-06 | B737: Git Commit | C737: of:=IF(COUNTIF([.A737:.A$2002];[.A737]) > 1; 1; 0) -> 1
A738: 2020-02-06 | B738: Git Commit | C738: of:=IF(COUNTIF([.A738:.A$2002];[.A738]) > 1; 1; 0) -> 1
A739: 2020-02-06 | B739: Git Commit | C739: of:=IF(COUNTIF([.A739:.A$2002];[.A739]) > 1; 1; 0) -> 1
A740: 2020-02-06 | B740: Git Commit | C740: of:=IF(COUNTIF([.A740:.A$2002];[.A740]) > 1; 1; 0) -> 1
A741: 2020-02-06 | B741: Git Commit | C741: of:=IF(COUNTIF([.A741:.A$2002];[.A741]) > 1; 1; 0) -> 1
A742: 2020-02-06 | B742: Git Commit | C742: of:=IF(COUNTIF([.A742:.A$2002];[.A742]) > 1; 1; 0) -> 1
A743: 2020-02-06 | B743: Git Commit | C743: of:=IF(COUNTIF([.A743:.A$2002];[.A743]) > 1; 1; 0) -> 1
A744: 2020-02-05 | B744: Git Commit | C744: of:=IF(COUNTIF([.A744:.A$2002];[.A744]) > 1; 1; 0) -> 1
A745: 2020-02-05 | B745: Git Commit | C745: of:=IF(COUNTIF([.A745:.A$2002];[.A745]) > 1; 1; 0) -> 1
A746: 2020-02-05 | B746: Git Commit | C746: of:=IF(COUNTIF([.A746:.A$2002];[.A746]) > 1; 1; 0) -> 1
A747: 2019-11-16 | B747: Git Commit | C747: of:=IF(COUNTIF([.A747:.A$2002];[.A747]) > 1; 1; 0) -> 0
A748: 2019-11-12 | B748: Git Commit | C748: of:=IF(COUNTIF([.A748:.A$2002];[.A748]) > 1; 1; 0) -> 1
A749: 2019-11-12 | B749: Git Commit | C749: of:=IF(COUNTIF([.A749:.A$2002];[.A749]) > 1; 1; 0) -> 1
A750: 2019-11-12 | B750: Git Commit | C750: of:=IF(COUNTIF([.A750:.A$2002];[.A750]) > 1; 1; 0) -> 1
A751: 2019-11-12 | B751: Git Commit | C751: of:=IF(COUNTIF([.A751:.A$2002];[.A751]) > 1; 1; 0) -> 1
A752: 2019-11-12 | B752: Git Commit | C752: of:=IF(COUNTIF([.A752:.A$2002];[.A752]) > 1; 1; 0) -> 1
A753: 2019-11-12 | B753: Git Commit | C753: of:=IF(COUNTIF([.A753:.A$2002];[.A753]) > 1; 1; 0) -> 1
A754: 2019-11-12 | B754: Git Commit | C754: of:=IF(COUNTIF([.A754:.A$2002];[.A754]) > 1; 1; 0) -> 1
A755: 2019-11-12 | B755: Git Commit | C755: of:=IF(COUNTIF([.A755:.A$2002];[.A755]) > 1; 1; 0) -> 1
A756: 2019-11-12 | B756: Git Commit | C756: of:=IF(COUNTIF([.A756:.A$2002];[.A756]) > 1; 1; 0) -> 1
A757: 2019-11-12 | B757: Git Commit | C757: of:=IF(COUNTIF([.A757:.A$2002];[.A757]) > 1; 1; 0) -> 1
A758: 2019-11-12 | B758: Git Commit | C758: of:=IF(COUNTIF([.A758:.A$2002];[.A758]) > 1; 1; 0) -> 1
A759: 2019-11-12 | B759: Git Commit | C759: of:=IF(COUNTIF([.A759:.A$2002];[.A759]) > 1; 1; 0) -> 1
A760: 2019-11-12 | B760: Git Commit | C760: of:=IF(COUNTIF([.A760:.A$2002];[.A760]) > 1; 1; 0) -> 1
A761: 2019-11-12 | B761: Git Commit | C761: of:=IF(COUNTIF([.A761:.A$2002];[.A761]) > 1; 1; 0) -> 1
A762: 2019-11-12 | B762: Git Commit | C762: of:=IF(COUNTIF([.A762:.A$2002];[.A762]) > 1; 1; 0) -> 1
A763: 2019-11-12 | B763: Git Commit | C763: of:=IF(COUNTIF([.A763:.A$2002];[.A763]) > 1; 1; 0) -> 1
A764: 2019-11-12 | B764: Git Commit | C764: of:=IF(COUNTIF([.A764:.A$2002];[.A764]) > 1; 1; 0) -> 1
A765: 2019-11-12 | B765: Git Commit | C765: of:=IF(COUNTIF([.A765:.A$2002];[.A765]) > 1; 1; 0) -> 1
A766: 2019-11-12 | B766: Git Commit | C766: of:=IF(COUNTIF([.A766:.A$2002];[.A766]) > 1; 1; 0) -> 0
A767: 2019-11-06 | B767: Git Commit | C767: of:=IF(COUNTIF([.A767:.A$2002];[.A767]) > 1; 1; 0) -> 1
A768: 2019-11-06 | B768: Git Commit | C768: of:=IF(COUNTIF([.A768:.A$2002];[.A768]) > 1; 1; 0) -> 1
A769: 2019-11-06 | B769: Git Commit | C769: of:=IF(COUNTIF([.A769:.A$2002];[.A769]) > 1; 1; 0) -> 1
A770: 2019-11-06 | B770: Git Commit | C770: of:=IF(COUNTIF([.A770:.A$2002];[.A770]) > 1; 1; 0) -> 1
A771: 2019-11-06 | B771: Git Commit | C771: of:=IF(COUNTIF([.A771:.A$2002];[.A771]) > 1; 1; 0) -> 1
A772: 2019-11-06 | B772: Git Commit | C772: of:=IF(COUNTIF([.A772:.A$2002];[.A772]) > 1; 1; 0) -> 1
A773: 2019-11-06 | B773: Git Commit | C773: of:=IF(COUNTIF([.A773:.A$2002];[.A773]) > 1; 1; 0) -> 1
A774: 2019-11-06 | B774: Git Commit | C774: of:=IF(COUNTIF([.A774:.A$2002];[.A774]) > 1; 1; 0) -> 1
A775: 2019-11-06 | B775: Git Commit | C775: of:=IF(COUNTIF([.A775:.A$2002];[.A775]) > 1; 1; 0) -> 1
A776: 2019-11-06 | B776: Git Commit | C776: of:=IF(COUNTIF([.A776:.A$2002];[.A776]) > 1; 1; 0) -> 1
A777: 2019-11-06 | B777: Git Commit | C777: of:=IF(COUNTIF([.A777:.A$2002];[.A777]) > 1; 1; 0) -> 1
A778: 2019-11-03 | B778: Git Commit | C778: of:=IF(COUNTIF([.A778:.A$2002];[.A778]) > 1; 1; 0) -> 1
A779: 2019-11-03 | B779: Git Commit | C779: of:=IF(COUNTIF([.A779:.A$2002];[.A779]) > 1; 1; 0) -> 1
A780: 2019-11-03 | B780: Git Commit | C780: of:=IF(COUNTIF([.A780:.A$2002];[.A780]) > 1; 1; 0) -> 1
A781: 2019-11-02 | B781: Git Commit | C781: of:=IF(COUNTIF([.A781:.A$2002];[.A781]) > 1; 1; 0) -> 1
A782: 2019-11-02 | B782: Git Commit | C782: of:=IF(COUNTIF([.A782:.A$2002];[.A782]) > 1; 1; 0) -> 1
A783: 2019-11-02 | B783: Git Commit | C783: of:=IF(COUNTIF([.A783:.A$2002];[.A783]) > 1; 1; 0) -> 1
A784: 2019-11-02 | B784: Git Commit | C784: of:=IF(COUNTIF([.A784:.A$2002];[.A784]) > 1; 1; 0) -> 1
A785: 2019-11-02 | B785: Git Commit | C785: of:=IF(COUNTIF([.A785:.A$2002];[.A785]) > 1; 1; 0) -> 1
A786: 2019-11-02 | B786: Git Commit | C786: of:=IF(COUNTIF([.A786:.A$2002];[.A786]) > 1; 1; 0) -> 1
A787: 2019-11-02 | B787: Git Commit | C787: of:=IF(COUNTIF([.A787:.A$2002];[.A787]) > 1; 1; 0) -> 1
A788: 2019-11-02 | B788: Git Commit | C788: of:=IF(COUNTIF([.A788:.A$2002];[.A788]) > 1; 1; 0) -> 1
A789: 2019-11-02 | B789: Git Commit | C789: of:=IF(COUNTIF([.A789:.A$2002];[.A789]) > 1; 1; 0) -> 1
A790: 2019-11-02 | B790: Git Commit | C790: of:=IF(COUNTIF([.A790:.A$2002];[.A790]) > 1; 1; 0) -> 1
A791: 2019-11-02 | B791: Git Commit | C791: of:=IF(COUNTIF([.A791:.A$2002];[.A791]) > 1; 1; 0) -> 1
A792: 2019-11-02 | B792: Git Commit | C792: of:=IF(COUNTIF([.A792:.A$2002];[.A792]) > 1; 1; 0) -> 1
A793: 2019-11-02 | B793: Git Commit | C793: of:=IF(COUNTIF([.A793:.A$2002];[.A793]) > 1; 1; 0) -> 1
A794: 2019-11-02 | B794: Git Commit | C794: of:=IF(COUNTIF([.A794:.A$2002];[.A794]) > 1; 1; 0) -> 1
A795: 2019-11-02 | B795: Git Commit | C795: of:=IF(COUNTIF([.A795:.A$2002];[.A795]) > 1; 1; 0) -> 1
A796: 2019-11-02 | B796: Git Commit | C796: of:=IF(COUNTIF([.A796:.A$2002];[.A796]) > 1; 1; 0) -> 1
A797: 2019-11-02 | B797: Git Commit | C797: of:=IF(COUNTIF([.A797:.A$2002];[.A797]) > 1; 1; 0) -> 1
A798: 2019-11-02 | B798: Git Commit | C798: of:=IF(COUNTIF([.A798:.A$2002];[.A798]) > 1; 1; 0) -> 1
A799: 2019-11-01 | B799: Git Commit | C799: of:=IF(COUNTIF([.A799:.A$2002];[.A799]) > 1; 1; 0) -> 1
A800: 2019-11-01 | B800: Git Commit | C800: of:=IF(COUNTIF([.A800:.A$2002];[.A800]) > 1; 1; 0) -> 1
A801: 2019-11-01 | B801: Git Commit | C801: of:=IF(COUNTIF([.A801:.A$2002];[.A801]) > 1; 1; 0) -> 1
A802: 2019-11-01 | B802: Git Commit | C802: of:=IF(COUNTIF([.A802:.A$2002];[.A802]) > 1; 1; 0) -> 1
A803: 2019-11-01 | B803: Git Commit | C803: of:=IF(COUNTIF([.A803:.A$2002];[.A803]) > 1; 1; 0) -> 1
A804: 2019-11-01 | B804: Git Commit | C804: of:=IF(COUNTIF([.A804:.A$2002];[.A804]) > 1; 1; 0) -> 1
A805: 2019-11-01 | B805: Git Commit | C805: of:=IF(COUNTIF([.A805:.A$2002];[.A805]) > 1; 1; 0) -> 1
A806: 2019-02-06 | B806: PDF Comment | C806: of:=IF(COUNTIF([.A806:.A$2002];[.A806]) > 1; 1; 0) -> 0
A807: 2019-02-11 | B807: PDF Comment | C807: of:=IF(COUNTIF([.A807:.A$2002];[.A807]) > 1; 1; 0) -> 0
A808: 2019-02-12 | B808: PDF Comment | C808: of:=IF(COUNTIF([.A808:.A$2002];[.A808]) > 1; 1; 0) -> 1
A809: 2019-02-12 | B809: PDF Comment | C809: of:=IF(COUNTIF([.A809:.A$2002];[.A809]) > 1; 1; 0) -> 0
A810: 2019-02-18 | B810: PDF Comment | C810: of:=IF(COUNTIF([.A810:.A$2002];[.A810]) > 1; 1; 0) -> 0
A811: 2019-11-01 | B811: PDF Comment | C811: of:=IF(COUNTIF([.A811:.A$2002];[.A811]) > 1; 1; 0) -> 1
A812: 2019-11-01 | B812: PDF Comment | C812: of:=IF(COUNTIF([.A812:.A$2002];[.A812]) > 1; 1; 0) -> 0
A813: 2019-11-02 | B813: PDF Comment | C813: of:=IF(COUNTIF([.A813:.A$2002];[.A813]) > 1; 1; 0) -> 1
A814: 2019-11-02 | B814: PDF Comment | C814: of:=IF(COUNTIF([.A814:.A$2002];[.A814]) > 1; 1; 0) -> 1
A815: 2019-11-02 | B815: PDF Comment | C815: of:=IF(COUNTIF([.A815:.A$2002];[.A815]) > 1; 1; 0) -> 0
A816: 2019-11-03 | B816: PDF Comment | C816: of:=IF(COUNTIF([.A816:.A$2002];[.A816]) > 1; 1; 0) -> 0
A817: 2019-11-06 | B817: PDF Comment | C817: of:=IF(COUNTIF([.A817:.A$2002];[.A817]) > 1; 1; 0) -> 0
A818: 2019-11-08 | B818: PDF Comment | C818: of:=IF(COUNTIF([.A818:.A$2002];[.A818]) > 1; 1; 0) -> 1
A819: 2019-11-08 | B819: PDF Comment | C819: of:=IF(COUNTIF([.A819:.A$2002];[.A819]) > 1; 1; 0) -> 0
A820: 2020-02-05 | B820: PDF Comment | C820: of:=IF(COUNTIF([.A820:.A$2002];[.A820]) > 1; 1; 0) -> 0
A821: 2020-02-06 | B821: PDF Comment | C821: of:=IF(COUNTIF([.A821:.A$2002];[.A821]) > 1; 1; 0) -> 0
A822: 2020-02-10 | B822: PDF Comment | C822: of:=IF(COUNTIF([.A822:.A$2002];[.A822]) > 1; 1; 0) -> 0
A823: 2020-02-11 | B823: PDF Comment | C823: of:=IF(COUNTIF([.A823:.A$2002];[.A823]) > 1; 1; 0) -> 1
A824: 2020-02-11 | B824: PDF Comment | C824: of:=IF(COUNTIF([.A824:.A$2002];[.A824]) > 1; 1; 0) -> 0
A825: 2020-02-15 | B825: PDF Comment | C825: of:=IF(COUNTIF([.A825:.A$2002];[.A825]) > 1; 1; 0) -> 1
A826: 2020-02-15 | B826: PDF Comment | C826: of:=IF(COUNTIF([.A826:.A$2002];[.A826]) > 1; 1; 0) -> 0
A827: 2020-02-18 | B827: PDF Comment | C827: of:=IF(COUNTIF([.A827:.A$2002];[.A827]) > 1; 1; 0) -> 0
A828: 2020-03-04 | B828: PDF Comment | C828: of:=IF(COUNTIF([.A828:.A$2002];[.A828]) > 1; 1; 0) -> 1
A829: 2020-03-04 | B829: PDF Comment | C829: of:=IF(COUNTIF([.A829:.A$2002];[.A829]) > 1; 1; 0) -> 1
A830: 2020-03-04 | B830: PDF Comment | C830: of:=IF(COUNTIF([.A830:.A$2002];[.A830]) > 1; 1; 0) -> 1
A831: 2020-03-04 | B831: PDF Comment | C831: of:=IF(COUNTIF([.A831:.A$2002];[.A831]) > 1; 1; 0) -> 0
A832: 2020-03-05 | B832: PDF Comment | C832: of:=IF(COUNTIF([.A832:.A$2002];[.A832]) > 1; 1; 0) -> 1
A833: 2020-03-05 | B833: PDF Comment | C833: of:=IF(COUNTIF([.A833:.A$2002];[.A833]) > 1; 1; 0) -> 1
A834: 2020-03-05 | B834: PDF Comment | C834: of:=IF(COUNTIF([.A834:.A$2002];[.A834]) > 1; 1; 0) -> 1
A835: 2020-03-05 | B835: PDF Comment | C835: of:=IF(COUNTIF([.A835:.A$2002];[.A835]) > 1; 1; 0) -> 0
A836: 2020-03-06 | B836: PDF Comment | C836: of:=IF(COUNTIF([.A836:.A$2002];[.A836]) > 1; 1; 0) -> 1
A837: 2020-03-06 | B837: PDF Comment | C837: of:=IF(COUNTIF([.A837:.A$2002];[.A837]) > 1; 1; 0) -> 1
A838: 2020-03-06 | B838: PDF Comment | C838: of:=IF(COUNTIF([.A838:.A$2002];[.A838]) > 1; 1; 0) -> 0
A839: 2020-03-07 | B839: PDF Comment | C839: of:=IF(COUNTIF([.A839:.A$2002];[.A839]) > 1; 1; 0) -> 0
A840: 2020-03-08 | B840: PDF Comment | C840: of:=IF(COUNTIF([.A840:.A$2002];[.A840]) > 1; 1; 0) -> 1
A841: 2020-03-08 | B841: PDF Comment | C841: of:=IF(COUNTIF([.A841:.A$2002];[.A841]) > 1; 1; 0) -> 1
A842: 2020-03-08 | B842: PDF Comment | C842: of:=IF(COUNTIF([.A842:.A$2002];[.A842]) > 1; 1; 0) -> 0
A843: 2020-03-24 | B843: PDF Comment | C843: of:=IF(COUNTIF([.A843:.A$2002];[.A843]) > 1; 1; 0) -> 0
A844: 2020-03-26 | B844: PDF Comment | C844: of:=IF(COUNTIF([.A844:.A$2002];[.A844]) > 1; 1; 0) -> 0
A845: 2020-03-27 | B845: PDF Comment | C845: of:=IF(COUNTIF([.A845:.A$2002];[.A845]) > 1; 1; 0) -> 1
A846: 2020-03-27 | B846: PDF Comment | C846: of:=IF(COUNTIF([.A846:.A$2002];[.A846]) > 1; 1; 0) -> 0
A847: 2020-03-28 | B847: PDF Comment | C847: of:=IF(COUNTIF([.A847:.A$2002];[.A847]) > 1; 1; 0) -> 0
A848: 2020-03-29 | B848: PDF Comment | C848: of:=IF(COUNTIF([.A848:.A$2002];[.A848]) > 1; 1; 0) -> 0
A849: 2020-03-30 | B849: PDF Comment | C849: of:=IF(COUNTIF([.A849:.A$2002];[.A849]) > 1; 1; 0) -> 0
A850: 2020-04-01 | B850: PDF Comment | C850: of:=IF(COUNTIF([.A850:.A$2002];[.A850]) > 1; 1; 0) -> 1
A851: 2020-04-01 | B851: PDF Comment | C851: of:=IF(COUNTIF([.A851:.A$2002];[.A851]) > 1; 1; 0) -> 1
A852: 2020-04-01 | B852: PDF Comment | C852: of:=IF(COUNTIF([.A852:.A$2002];[.A852]) > 1; 1; 0) -> 0
A853: 2020-04-02 | B853: PDF Comment | C853: of:=IF(COUNTIF([.A853:.A$2002];[.A853]) > 1; 1; 0) -> 1
A854: 2020-04-02 | B854: PDF Comment | C854: of:=IF(COUNTIF([.A854:.A$2002];[.A854]) > 1; 1; 0) -> 1
A855: 2020-04-02 | B855: PDF Comment | C855: of:=IF(COUNTIF([.A855:.A$2002];[.A855]) > 1; 1; 0) -> 0
A856: 2020-04-03 | B856: PDF Comment | C856: of:=IF(COUNTIF([.A856:.A$2002];[.A856]) > 1; 1; 0) -> 0
A857: 2020-04-07 | B857: PDF Comment | C857: of:=IF(COUNTIF([.A857:.A$2002];[.A857]) > 1; 1; 0) -> 0
A858: 2020-04-09 | B858: PDF Comment | C858: of:=IF(COUNTIF([.A858:.A$2002];[.A858]) > 1; 1; 0) -> 0
A859: 2020-04-10 | B859: PDF Comment | C859: of:=IF(COUNTIF([.A859:.A$2002];[.A859]) > 1; 1; 0) -> 0
A860: 2020-04-11 | B860: PDF Comment | C860: of:=IF(COUNTIF([.A860:.A$2002];[.A860]) > 1; 1; 0) -> 0
A861: 2020-04-29 | B861: PDF Comment | C861: of:=IF(COUNTIF([.A861:.A$2002];[.A861]) > 1; 1; 0) -> 0
A862: 2020-05-07 | B862: PDF Comment | C862: of:=IF(COUNTIF([.A862:.A$2002];[.A862]) > 1; 1; 0) -> 1
A863: 2020-05-07 | B863: PDF Comment | C863: of:=IF(COUNTIF([.A863:.A$2002];[.A863]) > 1; 1; 0) -> 0
A864: 2020-05-19 | B864: PDF Comment | C864: of:=IF(COUNTIF([.A864:.A$2002];[.A864]) > 1; 1; 0) -> 0
A865: 2020-06-22 | B865: PDF Comment | C865: of:=IF(COUNTIF([.A865:.A$2002];[.A865]) > 1; 1; 0) -> 0
A866: 2020-07-13 | B866: PDF Comment | C866: of:=IF(COUNTIF([.A866:.A$2002];[.A866]) > 1; 1; 0) -> 0
A867: 2020-07-17 | B867: PDF Comment | C867: of:=IF(COUNTIF([.A867:.A$2002];[.A867]) > 1; 1; 0) -> 0
A868: 2020-07-23 | B868: PDF Comment | C868: of:=IF(COUNTIF([.A868:.A$2002];[.A868]) > 1; 1; 0) -> 0
A869: 2020-07-28 | B869: PDF Comment | C869: of:=IF(COUNTIF([.A869:.A$2002];[.A869]) > 1; 1; 0) -> 0