Sheet: WoS - Citing but not co-authors
A1: Publication Type | B1: Authors | C1: Book Authors | D1: Book Editors | E1: Book Group Authors | F1: Author Full Names | G1: Book Author Full Names | H1: Group Authors | I1: Article Title | J1: Source Title | K1: Book Series Title | L1: Book Series Subtitle | M1: Language | N1: Document Type | O1: Conference Title | P1: Conference Date | Q1: Conference Location | R1: Conference Sponsor | S1: Conference Host | T1: Author Keywords | U1: Keywords Plus | V1: Abstract | W1: Addresses | X1: Reprint Addresses | Y1: Email Addresses | Z1: Researcher Ids | AA1: ORCIDs | AB1: Funding Orgs | AC1: Funding Text | AD1: Cited References | AE1: Cited Reference Count | AF1: Times Cited, WoS Core | AG1: Times Cited, All Databases | AH1: 180 Day Usage Count | AI1: Since 2013 Usage Count | AJ1: Publisher | AK1: Publisher City | AL1: Publisher Address | AM1: ISSN | AN1: eISSN | AO1: ISBN | AP1: Journal Abbreviation | AQ1: Journal ISO Abbreviation | AR1: Publication Date | AS1: Publication Year | AT1: Volume | AU1: Issue | AV1: Part Number | AW1: Supplement | AX1: Special Issue | AY1: Meeting Abstract | AZ1: Start Page | BA1: End Page | BB1: Article Number | BC1: DOI | BD1: Book DOI | BE1: Early Access Date | BF1: Number of Pages | BG1: WoS Categories | BH1: Research Areas | BI1: IDS Number | BJ1: UT (Unique WOS ID) | BK1: Pubmed Id | BL1: Open Access Designations | BM1: Highly Cited Status | BN1: Hot Paper Status | BO1: Date of Export
A2: J | B2: Climent, AM; Atienza, F; Millet, J; Guillem, MS | F2: Climent, Andreu M.; Atienza, Felipe; Millet, Jose; Guillem, Maria S. | I2: Generation of realistic atrial to atrial interval series during atrial fibrillation | J2: MEDICAL & BIOLOGICAL ENGINEERING & COMPUTING | Z2: Guillem, Maria/G-7368-2016; Atienza, Felipe/H-9273-2016; Climent, Andreu/E-8021-2011 | AA2: Guillem, Maria/0000-0001-5660-3693; Atienza, Felipe/0000-0002-9596-7649; Climent, Andreu/0000-0002-7260-8811; MILLET, JOSE/0000-0002-8879-003X | AM2: 0140-0118 | AN2: 1741-0444 | AR2: NOV | AS2: 2011 | AT2: 49 | AU2: 11 | AZ2: 1261 | BA2: 1268 | BC2: 10.1007/s11517-011-0823-2 | BJ2: WOS:000296640300004 | BK2: 21830052
A3: J | B3: Climent, AM; Guillem, MS; Zhang, Y; Millet, J; Mazgalev, TN | F3: Climent, A. M.; Guillem, M. S.; Zhang, Y.; Millet, J.; Mazgalev, T. N. | I3: Functional mathematical model of dual pathway AV nodal conduction | J3: AMERICAN JOURNAL OF PHYSIOLOGY-HEART AND CIRCULATORY PHYSIOLOGY | Z3: Climent, Andreu/E-8021-2011; Guillem, Maria/G-7368-2016 | AA3: Climent, Andreu/0000-0002-7260-8811; Guillem, Maria/0000-0001-5660-3693; MILLET, JOSE/0000-0002-8879-003X | AM3: 0363-6135 | AN3: 1522-1539 | AR3: APR | AS3: 2011 | AT3: 300 | AU3: 4 | AZ3: H1393 | BA3: H1401 | BC3: 10.1152/ajpheart.01175.2010 | BJ3: WOS:000288942300027 | BK3: 21257912
A4: J | B4: Holden, JE | F4: Holden, Janean E. | I4: Putting the Bio in Biobehavioral: Animal Models | J4: WESTERN JOURNAL OF NURSING RESEARCH | AM4: 0193-9459 | AN4: 1552-8456 | AR4: DEC | AS4: 2011 | AT4: 33 | AU4: 8 | AZ4: 1017 | BA4: 1029 | BC4: 10.1177/0193945911403776 | BJ4: WOS:000297078200003 | BK4: 21454886
A5: J | B5: Szilagyi, SM; Szilagyi, L; Benyo, Z | F5: Szilagyi, Sandor M.; Szilagyi, Laszlo; Benyo, Zoltan | I5: A patient specific electro-mechanical model of the heart | J5: COMPUTER METHODS AND PROGRAMS IN BIOMEDICINE | Z5: Szilagyi, Sandor M/E-8586-2017; Szilagyi, Laszlo/C-3532-2011; Benyo, Zoltan Prof. Dr. Habil./H-2900-2012 | AA5: Szilagyi, Sandor M/0000-0002-5657-7365; | AM5: 0169-2607 | AN5: 1872-7565 | AR5: FEB | AS5: 2011 | AT5: 101 | AU5: 2 | AX5: SI | AZ5: 183 | BA5: 200 | BC5: 10.1016/j.cmpb.2010.06.006 | BJ5: WOS:000288642700010 | BK5: 20692715
A6: J | B6: Winslow, RL; Cortassa, S; O'Rourke, B; Hashambhoy, YL; Rice, JJ; Greenstein, JL | F6: Winslow, Raimond L.; Cortassa, Sonia; O'Rourke, Brian; Hashambhoy, Yasmin L.; Rice, John Jeremy; Greenstein, Joseph L. | I6: Integrative modeling of the cardiac ventricular myocyte | J6: WILEY INTERDISCIPLINARY REVIEWS-SYSTEMS BIOLOGY AND MEDICINE | Z6: Cortassa, Sonia/AAO-1633-2020; Greenstein, Joseph L/A-3377-2010 | AA6: Cortassa, Sonia/0000-0001-7224-9858; Rice, John/0000-0001-8280-8529; Greenstein, Joseph/0000-0002-6193-7134; O'Rourke, Brian/0000-0002-5548-4853 | AM6: 1939-5094 | AN6: 1939-005X | AR6: JUL-AUG | AS6: 2011 | AT6: 3 | AU6: 4 | AZ6: 392 | BA6: 413 | BC6: 10.1002/wsbm.122 | BJ6: WOS:000291821300002 | BK6: 20865780
A7: J | B7: Noble, D; Garny, A; Noble, PJ | F7: Noble, Denis; Garny, Alan; Noble, Penelope J. | I7: How the Hodgkin-Huxley equations inspired the Cardiac Physiome Project | J7: JOURNAL OF PHYSIOLOGY-LONDON | AM7: 0022-3751 | AN7: 1469-7793 | AR7: JUN | AS7: 2012 | AT7: 590 | AU7: 11 | AZ7: 2613 | BA7: 2628 | BC7: 10.1113/jphysiol.2011.224238 | BJ7: WOS:000304659900014 | BK7: 22473779
A8: J | B8: Roberts, BN; Yang, PC; Behrens, SB; Moreno, JD; Clancy, CE | F8: Roberts, Byron N.; Yang, Pei-Chi; Behrens, Steven B.; Moreno, Jonathan D.; Clancy, Colleen E. | I8: Computational approaches to understand cardiac electrophysiology and arrhythmias | J8: AMERICAN JOURNAL OF PHYSIOLOGY-HEART AND CIRCULATORY PHYSIOLOGY | AM8: 0363-6135 | AN8: 1522-1539 | AR8: OCT | AS8: 2012 | AT8: 303 | AU8: 7 | AZ8: H766 | BA8: H783 | BC8: 10.1152/ajpheart.01081.2011 | BJ8: WOS:000309527600002 | BK8: 22886409
A9: J | B9: Boyle, PM; Veenhuyzen, GD; Vigmond, EJ | F9: Boyle, Patrick M.; Veenhuyzen, George D.; Vigmond, Edward J. | I9: Fusion during entrainment of orthodromic reciprocating tachycardia is enhanced for basal pacing sites but diminished when pacing near Purkinje system end points | J9: HEART RHYTHM | AA9: Boyle, Patrick M/0000-0001-9048-1239 | AM9: 1547-5271 | AR9: MAR | AS9: 2013 | AT9: 10 | AU9: 3 | AZ9: 444 | BA9: 451 | BC9: 10.1016/j.hrthm.2012.11.021 | BJ9: WOS:000315773000026 | BK9: 23207137
A10: J | B10: Podziemski, P; Zebrowski, JJ | F10: Podziemski, P.; Zebrowski, J. J. | I10: Lienard-type models for the simulation of the action potential of cardiac nodal cells | J10: PHYSICA D-NONLINEAR PHENOMENA | AA10: Podziemski, Piotr/0000-0001-6951-0293; Zebrowski, Jan/0000-0002-1082-2767 | AM10: 0167-2789 | AN10: 1872-8022 | AR10: OCT 15 | AS10: 2013 | AT10: 261 | AZ10: 52 | BA10: 61 | BC10: 10.1016/j.physd.2013.06.007 | BJ10: WOS:000324976500006
A11: J | B11: Podziemski, P; Zebrowski, JJ | F11: Podziemski, Piotr; Zebrowski, Jan J. | I11: A simple model of the right atrium of the human heart with the sinoatrial and atrioventricular nodes included | J11: JOURNAL OF CLINICAL MONITORING AND COMPUTING | O11: SCAI 10th International Conference on Complexity in Acute Illness (ICCAI) | P11: SEP, 2011 | Q11: Bonn, GERMANY | R11: Soc Complex Acute Illness (SCAI) | AA11: Podziemski, Piotr/0000-0001-6951-0293; Zebrowski, Jan/0000-0002-1082-2767 | AM11: 1387-1307 | AN11: 1573-2614 | AR11: AUG | AS11: 2013 | AT11: 27 | AU11: 4 | AX11: SI | AZ11: 481 | BA11: 498 | BC11: 10.1007/s10877-013-9429-6 | BJ11: WOS:000321261400013 | BK11: 23430363
A12: S | B12: Szilagyi, SM; Szilagyi, L; Hirsbrunner, B | E12: IEEE | F12: Szilagyi, Sandor M.; Szilagyi, Laszlo; Hirsbrunner, Beat | I12: Modeling the Influence of High Fibroblast Level on Arrhythmia Development and Obstructed Depolarization Spread | J12: 2013 COMPUTING IN CARDIOLOGY CONFERENCE (CINC) | K12: Computing in Cardiology Conference | O12: 40th Annual Meeting on Computing in Cardiology (CinC) | P12: SEP 22-25, 2013 | Q12: Zaragoza, SPAIN | R12: EMB, IEEE, PhysioNet, Mortara, Univ Inst Investigac Ingn Aragon, Univ Zaragoza, Philips, Escuela Ingn Arquitectura, Univ Zaragoza, GE Healthcare Life Sci, Cardiolund, Ciber-BBN, Centro Investigac Biomedica Red Bioingenieria, Biomateriales Nanomedicina, lOP Publishing, Zoll, Museo Ibercaja, Goya Zaragoza, ESC Working Grp, e-Cardiol, Unive Zaragoza, GTC, Commun Technologies Grp,, Unive Zaragoza, European Soc Cardiol | Z12: Szilagyi, Sandor M/E-8586-2017 | AA12: Szilagyi, Sandor M/0000-0002-5657-7365 | AM12: 2325-8861 | AN12: 2325-887X | AO12: 978-1-4799-0884-4 | AS12: 2013 | AT12: 40 | AZ12: 45 | BA12: 48 | BJ12: WOS:000349898700013
A13: S | B13: Szilagyi, SM; Szilagyi, L; Hirsbrunner, B | E13: IEEE | F13: Szilagyi, Sandor M.; Szilagyi, Laszlo; Hirsbrunner, Beat | I13: Simulation of Arrhythmia using Adaptive Spatio-temporal Resolution | J13: 2013 COMPUTING IN CARDIOLOGY CONFERENCE (CINC) | K13: Computing in Cardiology Conference | O13: 40th Annual Meeting on Computing in Cardiology (CinC) | P13: SEP 22-25, 2013 | Q13: Zaragoza, SPAIN | R13: EMB, IEEE, PhysioNet, Mortara, Univ Inst Investigac Ingn Aragon, Univ Zaragoza, Philips, Escuela Ingn Arquitectura, Univ Zaragoza, GE Healthcare Life Sci, Cardiolund, Ciber-BBN, Centro Investigac Biomedica Red Bioingenieria, Biomateriales Nanomedicina, lOP Publishing, Zoll, Museo Ibercaja, Goya Zaragoza, ESC Working Grp, e-Cardiol, Unive Zaragoza, GTC, Commun Technologies Grp,, Unive Zaragoza, European Soc Cardiol | Z13: Szilagyi, Sandor M/E-8586-2017 | AA13: Szilagyi, Sandor M/0000-0002-5657-7365 | AM13: 2325-8861 | AN13: 2325-887X | AO13: 978-1-4799-0884-4 | AS13: 2013 | AT13: 40 | AZ13: 365 | BA13: 368 | BJ13: WOS:000349898700093
A14: J | B14: Tong, WC; Ghouri, I; Taggart, MJ | F14: Tong, Wing-Chiu; Ghouri, Iffath; Taggart, Michael J. | I14: Computational modeling of inhibition of voltage-gated Ca channels: identification of different effects on uterine and cardiac action potentials | J14: FRONTIERS IN PHYSIOLOGY | AA14: Taggart, Michael/0000-0002-9981-2783 | AM14: 1664-042X | AR14: OCT 16 | AS14: 2014 | AT14: 5 | BB14: 399 | BC14: 10.3389/fphys.2014.00399 | BJ14: WOS:000347125900001 | BK14: 25360118
A15: J | B15: Balakrishnan, M; Chakravarthy, VS; Guhathakurta, S | F15: Balakrishnan, Minimol; Chakravarthy, V. Srinivasa; Guhathakurta, Soma | I15: Simulation of Cardiac Arrhythmias Using a 2D Heterogeneous Whole Heart Model | J15: FRONTIERS IN PHYSIOLOGY | AM15: 1664-042X | AR15: DEC 21 | AS15: 2015 | AT15: 6 | BB15: 374 | BC15: 10.3339/fphys.2015.00374 | BJ15: WOS:000366809300001 | BK15: 26733873
A16: J | B16: Bartos, DC; Grandi, E; Ripplinger, CM | F16: Bartos, Daniel C.; Grandi, Eleonora; Ripplinger, Crystal M. | I16: Ion Channels in the Heart | J16: COMPREHENSIVE PHYSIOLOGY | AA16: Ripplinger, Crystal/0000-0002-9908-4106; Grandi, Eleonora/0000-0002-4401-8857 | AM16: 2040-4603 | AR16: JUL | AS16: 2015 | AT16: 5 | AU16: 3 | AZ16: 1423 | BA16: 1464 | BC16: 10.1002/cphy.c140069 | BJ16: WOS:000357596400017 | BK16: 26140724
A17: J | B17: Khori, V; Alizadeh, AM; Moheimani, HR; Zahedi, M; Najafi, SA; Shakiba, D; Nayebpour, M | F17: Khori, Vahid; Alizadeh, Ali Mohammad; Moheimani, Hamid Reza; Zahedi, Mahdi; Najafi, Soroosh Aminolsharieh; Shakiba, Delaram; Nayebpour, Mohsen | I17: Acute effects of simvastatin to terminate fast reentrant tachycardia through increasing wavelength of atrioventricular nodal reentrant tachycardia circuit | J17: FUNDAMENTAL & CLINICAL PHARMACOLOGY | Z17: Khori, Vahid/G-1197-2017; Zahedi, Mahdi/P-7889-2016 | AA17: Khori, Vahid/0000-0002-4672-9732; Zahedi, Mahdi/0000-0002-3609-5190 | AM17: 0767-3981 | AN17: 1472-8206 | AR17: FEB | AS17: 2015 | AT17: 29 | AU17: 1 | AZ17: 41 | BA17: 53 | BC17: 10.1111/fcp.12089 | BJ17: WOS:000347832900005 | BK17: 24990322
A18: J | B18: Arevalo, HJ; Boyle, PM; Trayanova, NA | F18: Arevalo, Hermenegild J.; Boyle, Patrick M.; Trayanova, Natalia A. | I18: Computational rabbit models to investigate the initiation, perpetuation, and termination of ventricular arrhythmia | J18: PROGRESS IN BIOPHYSICS & MOLECULAR BIOLOGY | AA18: Trayanova, Natalia/0000-0002-8661-063X; Boyle, Patrick M/0000-0001-9048-1239 | AM18: 0079-6107 | AR18: JUL | AS18: 2016 | AT18: 121 | AU18: 2 | AZ18: 185 | BA18: 194 | BC18: 10.1016/j.pbiomolbio.2016.06.004 | BJ18: WOS:000380597800011 | BK18: 27334789
A19: J | B19: Clerx, M; Collins, P; de Lange, E; Volders, PGA | F19: Clerx, Michael; Collins, Pieter; de lange, Enno; Volders, Paul G. A. | I19: Myokit: A simple interface to cardiac cellular electrophysiology | J19: PROGRESS IN BIOPHYSICS & MOLECULAR BIOLOGY | Z19: Clerx, Michael/AAE-4607-2019 | AA19: Clerx, Michael/0000-0003-4062-3061; Collins, Pieter/0000-0002-8896-9603 | AM19: 0079-6107 | AR19: JAN | AS19: 2016 | AT19: 120 | AU19: 1-3 | AZ19: 100 | BA19: 114 | BC19: 10.1016/j.pbiomolbio.2015.12.008 | BJ19: WOS:000374611200010 | BK19: 26721671
A20: J | B20: Gemmell, P; Burrage, K; Rodriguez, B; Quinn, TA | F20: Gemmell, Philip; Burrage, Kevin; Rodriguez, Blanca; Quinn, T. Alexander | I20: Rabbit-specific computational modelling of ventricular cell electrophysiology: Using populations of models to explore variability in the response to ischemia | J20: PROGRESS IN BIOPHYSICS & MOLECULAR BIOLOGY | AA20: Gemmell, Philip/0000-0003-2942-0992; Rodriguez, Blanca/0000-0001-6361-3339 | AM20: 0079-6107 | AR20: JUL | AS20: 2016 | AT20: 121 | AU20: 2 | AZ20: 169 | BA20: 184 | BC20: 10.1016/j.pbiomolbio.2016.06.003 | BJ20: WOS:000380597800010 | BK20: 27320382
A21: J | B21: Das, PN; Mehrotra, P; Mishra, A; Bairagi, N; Chatterjee, S | F21: Das, Phonindra Nath; Mehrotra, Parul; Mishra, Aseem; Bairagi, Nandadulal; Chatterjee, Samrat | I21: Calcium dynamics in cardiac excitatory and non-excitatory cells and the role of gap junction | J21: MATHEMATICAL BIOSCIENCES | Z21: Bairagi, Nandadulal/S-4557-2016; Bairagi, Nandadulal/X-6749-2019 | AA21: Bairagi, Nandadulal/0000-0001-8867-7996; | AM21: 0025-5564 | AN21: 1879-3134 | AR21: JUL | AS21: 2017 | AT21: 289 | AZ21: 51 | BA21: 68 | BC21: 10.1016/j.mbs.2017.04.007 | BJ21: WOS:000404199700006 | BK21: 28457965
A22: J | B22: George, SA; Faye, NR; Murillo-Berlioz, A; Lee, KB; Trachiotis, GD; Efimov, IR | F22: George, Sharon A.; Faye, N. Rokhaya; Murillo-Berlioz, Alejandro; Lee, K. Benjamin; Trachiotis, Gregory D.; Efimov, Igor R. | I22: At the Atrioventricular Crossroads: Dual Pathway Electrophysiology in the Atrioventricular Node and its Underlying Heterogeneities | J22: ARRHYTHMIA & ELECTROPHYSIOLOGY REVIEW | Z22: ; Efimov, Igor/B-8040-2010 | AA22: Lee, Kyongjune/0000-0003-2938-9227; Efimov, Igor/0000-0002-1483-5039; Murillo-Berlioz, Alejandro/0000-0003-1972-8969; George, Sharon/0000-0001-9003-1158 | AM22: 2050-3369 | AN22: 2050-3377 | AR22: WIN | AS22: 2017 | AT22: 6 | AU22: 4 | AZ22: 179 | BA22: 185 | BC22: 10.15420/aer.2017.30.1 | BJ22: WOS:000424589700007 | BK22: 29326832
A23: J | B23: Hulsmans, M; Clauss, S; Xiao, L; Aguirre, AD; King, KR; Hanley, A; Hucker, WJ; Wulfers, EM; Seemann, G; Courties, G; Iwamoto, Y; Sun, Y; Savol, AJ; Sager, HB; Lavine, KJ; Fishbein, GA; Capen, DE; Da Silva, N; Miquerol, L; Wakimoto, H; Seidman, CE; Seidman, JG; Sadreyev, RI; Naxerova, K; Mitchell, RN; Brown, D; Libby, P; Weissleder, R; Swirski, FK; Kohl, P; Vinegoni, C; Milan, DJ; Ellinor, PT; Nahrendorf, M | F23: Hulsmans, Maarten; Clauss, Sebastian; Xiao, Ling; Aguirre, Aaron D.; King, Kevin R.; Hanley, Alan; Hucker, William J.; Wuelfers, Eike M.; Seemann, Gunnar; Courties, Gabriel; Iwamoto, Yoshiko; Sun, Yuan; Savol, Andrej J.; Sager, Hendrik B.; Lavine, Kory J.; Fishbein, Gregory A.; Capen, Diane E.; Da Silva, Nicolas; Miquerol, Lucile; Wakimoto, Hiroko; Seidman, Christine E.; Seidman, Jonathan G.; Sadreyev, Ruslan I.; Naxerova, Kamila; Mitchell, Richard N.; Brown, Dennis; Libby, Peter; Weissleder, Ralph; Swirski, Filip K.; Kohl, Peter; Vinegoni, Claudio; Milan, David J.; Ellinor, Patrick T.; Nahrendorf, Matthias | I23: Macrophages Facilitate Electrical Conduction in the Heart | J23: CELL | Z23: Hulsmans, Maarten/AAI-9547-2020; Vinegoni, Claudio/A-9490-2012; Seemann, Gunnar/D-3091-2011; Swirski, Filip/AAF-1340-2019 | AA23: Hulsmans, Maarten/0000-0003-1009-658X; Vinegoni, Claudio/0000-0002-9818-3639; Seemann, Gunnar/0000-0001-7111-7992; Ellinor, Patrick/0000-0002-2067-0533; Courties, Gabriel/0000-0002-0003-7407; Kohl, Peter/0000-0003-0416-6270; Naxerova, Kamila/0000-0001-7744-5110; Swirski, Filip/0000-0002-3163-9152; /0000-0003-0828-4143 | AM23: 0092-8674 | AN23: 1097-4172 | AR23: APR 20 | AS23: 2017 | AT23: 169 | AU23: 3 | AZ23: 510 | BA23: + | BC23: 10.1016/j.cell.2017.03.050 | BJ23: WOS:000399560600014 | BK23: 28431249
A24: J | B24: Kharche, SR; Vigmond, E; Efimov, IR; Dobrzynski, H | F24: Kharche, Sanjay R.; Vigmond, Edward; Efimov, Igor R.; Dobrzynski, Halina | I24: Computational assessment of the functional role of sinoatrial node exit pathways in the human heart | J24: PLOS ONE | Z24: Kharche, Sanjay Ram/I-2130-2014; Efimov, Igor/B-8040-2010 | AA24: Kharche, Sanjay Ram/0000-0002-2634-4894; Dobrzynski, Halina/0000-0003-4754-5975; Efimov, Igor/0000-0002-1483-5039 | AM24: 1932-6203 | AR24: SEP 5 | AS24: 2017 | AT24: 12 | AU24: 9 | BB24: e0183727 | BC24: 10.1371/journal.pone.0183727 | BJ24: WOS:000409282800023 | BK24: 28873427
A25: J | B25: Ai, WW; Patel, ND; Roop, PS; Malik, A; Andalam, S; Yip, E; Allen, N; Trew, ML | F25: Ai, Weiwei; Patel, Nitish D.; Roop, Partha S.; Malik, Avinash; Andalam, Sidharta; Yip, Eugene; Allen, Nathan; Trew, Mark L. | I25: A Parametric Computational Model of the Action Potential of Pacemaker Cells | J25: IEEE TRANSACTIONS ON BIOMEDICAL ENGINEERING | Z25: Roop, Partha/AAL-2839-2020 | AM25: 0018-9294 | AN25: 1558-2531 | AR25: JAN | AS25: 2018 | AT25: 65 | AU25: 1 | AZ25: 123 | BA25: 130 | BC25: 10.1109/TBME.2017.2695537 | BJ25: WOS:000418722000014 | BK25: 28436840
A26: J | B26: Ni, HB; Morotti, S; Grandi, E | F26: Ni, Haibo; Morotti, Stefano; Grandi, Eleonora | I26: A Heart for Diversity: Simulating Variability in Cardiac Arrhythmia Research | J26: FRONTIERS IN PHYSIOLOGY | AA26: Morotti, Stefano/0000-0001-8679-665X | AM26: 1664-042X | AR26: JUL 20 | AS26: 2018 | AT26: 9 | BB26: 958 | BC26: 10.3389/fphys.2018.00958 | BJ26: WOS:000439407200001 | BK26: 30079031
A27: S | B27: Ryzhii, M; Ryzhii, E | D27: Zheng, H; Callejas, Z; Griol, D; Wang, H; Hu, X; Schmidt, H; Baumbach, J; Dickerson, J; Zhang, L | F27: Ryzhii, Maxim; Ryzhii, Elena | I27: Development of Simplified Model of Atrioventricular Node with Dual Pathway | J27: PROCEEDINGS 2018 IEEE INTERNATIONAL CONFERENCE ON BIOINFORMATICS AND BIOMEDICINE (BIBM) | K27: IEEE International Conference on Bioinformatics and Biomedicine-BIBM | O27: IEEE International Conference on Bioinformatics and Biomedicine (BIBM) | P27: DEC 03-06, 2018 | Q27: Madrid, SPAIN | R27: Ulster Univ, Univ Granada, Univ Carlos III Madrid, TCCLS, IEEE, IEEE Comp Soc, Natl Sci Fdn, Syst Med, Mary Ann Liebert Inc publishers | Z27: Ryzhii, Maxim/K-3391-2013 | AA27: Ryzhii, Maxim/0000-0001-5580-5971 | AM27: 2156-1125 | AN27: 2156-1133 | AO27: 978-1-5386-5488-0 | AS27: 2018 | AZ27: 2800 | BA27: 2802 | BC27: https://doi.org/10.1109/BIBM.2018.8621149 | BJ27: WOS:000458654000493
A28: S | B28: Winkelmann, B; Zgierski-Johnston, CM; Wulfers, EM; Timmer, J; Seemann, G | E28: IEEE | F28: Winkelmann, Benjamin; Zgierski-Johnston, Callum M.; Wuelfers, Eike M.; Timmer, Jens; Seemann, Gunnar | I28: Computational Mechanistic Investigation of Chronotropic Effects on Murine Sinus Node Cells | J28: 2018 COMPUTING IN CARDIOLOGY CONFERENCE (CINC) | K28: Computing in Cardiology Conference | O28: 45th Computing in Cardiology Conference (CinC) | P28: SEP 23-26, 2018 | Q28: Maastricht, NETHERLANDS | AA28: Zgierski-Johnston, Callum/0000-0002-6773-9884 | AM28: 2325-8861 | AN28: 2325-887X | AO28: 978-1-7281-0958-9 | AS28: 2018 | AT28: 45 | BC28: 10.22489/CinC.2018.092 | BJ28: WOS:000482598700093
A29: J | B29: Clerx, M; Beattie, KA; Gavaghan, DJ; Mirams, GR | F29: Clerx, Michael; Beattie, Kylie A.; Gavaghan, David J.; Mirams, Gary R. | I29: Four Ways to Fit an Ion Channel Model | J29: BIOPHYSICAL JOURNAL | Z29: Clerx, Michael/AAE-4607-2019; Mirams, Gary/B-6653-2008 | AA29: Clerx, Michael/0000-0003-4062-3061; Mirams, Gary/0000-0002-4569-4312 | AM29: 0006-3495 | AN29: 1542-0086 | AR29: DEC 17 | AS29: 2019 | AT29: 117 | AU29: 12 | AX29: SI | AZ29: 2420 | BA29: 2437 | BC29: 10.1016/j.bpj.2019.08.001 | BJ29: WOS:000503173400018 | BK29: 31493859

Sheet: Notes
A1: Author | B1: Title | C1: Publication | D1: WOS-ID | E1: Inada cited/used as | F1: Specifics of Use | G1: Lab/Group
A2: Climent, AM; Atienza, F; Millet, J; Guillem, MS | B2: Generation of realistic atrial to atrial interval series during atrial fibrillation | C2: MEDICAL & BIOLOGICAL ENGINEERING & COMPUTING | D2: WOS:000296640300004 | E2: Biological reference | F2: AFib
A3: Climent, AM; Guillem, MS; Zhang, Y; Millet, J; Mazgalev, TN | B3: Functional mathematical model of dual pathway AV nodal conduction | C3: AMERICAN JOURNAL OF PHYSIOLOGY-HEART AND CIRCULATORY PHYSIOLOGY | D3: WOS:000288942300027 | E3: Biological reference | F3: Cell types
A4: Holden, JE | B4: Putting the Bio in Biobehavioral: Animal Models | C4: WESTERN JOURNAL OF NURSING RESEARCH | D4: WOS:000297078200003 | E4: Example | F4: of AVN models
A5: Szilagyi, SM; Szilagyi, L; Benyo, Z | B5: A patient specific electro-mechanical model of the heart | C5: COMPUTER METHODS AND PROGRAMS IN BIOMEDICINE | D5: WOS:000288642700010 | E5: Simulation | F5: AVN-cells in whole-heart model | G5: Szilagyi
A6: Winslow, RL; Cortassa, S; O'Rourke, B; Hashambhoy, YL; Rice, JJ; Greenstein, JL | B6: Integrative modeling of the cardiac ventricular myocyte | C6: WILEY INTERDISCIPLINARY REVIEWS-SYSTEMS BIOLOGY AND MEDICINE | D6: WOS:000291821300002 | E6: Example | F6: of AVN models
A7: Noble, D; Garny, A; Noble, PJ | B7: How the Hodgkin-Huxley equations inspired the Cardiac Physiome Project | C7: JOURNAL OF PHYSIOLOGY-LONDON | D7: WOS:000304659900014 | E7: Example | F7: of AVN models
A8: Roberts, BN; Yang, PC; Behrens, SB; Moreno, JD; Clancy, CE | B8: Computational approaches to understand cardiac electrophysiology and arrhythmias | C8: AMERICAN JOURNAL OF PHYSIOLOGY-HEART AND CIRCULATORY PHYSIOLOGY | D8: WOS:000309527600002 | E8: Example | F8: of AVN models
A9: Boyle, PM; Veenhuyzen, GD; Vigmond, EJ | B9: Fusion during entrainment of orthodromic reciprocating tachycardia is enhanced for basal pacing sites but diminished when pacing near Purkinje system end points | C9: HEART RHYTHM | D9: WOS:000315773000026 | E9: Simulation | F9: AVN-Cells in model of cardiac conduction system | G9: Boyle
A10: Podziemski, P; Zebrowski, JJ | B10: Lienard-type models for the simulation of the action potential of cardiac nodal cells | C10: PHYSICA D-NONLINEAR PHENOMENA | D10: WOS:000324976500006 | E10: Technical reference | F10: for 1-d model with simple AP formulation
A11: Podziemski, P; Zebrowski, JJ | B11: A simple model of the right atrium of the human heart with the sinoatrial and atrioventricular nodes included | C11: JOURNAL OF CLINICAL MONITORING AND COMPUTING | D11: WOS:000321261400013 | E11: Example | F11: of AVN models
A12: Szilagyi, SM; Szilagyi, L; Hirsbrunner, B | B12: Modeling the Influence of High Fibroblast Level on Arrhythmia Development and Obstructed Depolarization Spread | C12: 2013 COMPUTING IN CARDIOLOGY CONFERENCE (CINC) | D12: WOS:000349898700013 | E12: Simulation | F12: AVN-cells in 3D heart model | G12: Szilagyi
A13: Szilagyi, SM; Szilagyi, L; Hirsbrunner, B | B13: Simulation of Arrhythmia using Adaptive Spatio-temporal Resolution | C13: 2013 COMPUTING IN CARDIOLOGY CONFERENCE (CINC) | D13: WOS:000349898700093 | E13: Simulation | F13: AVN-cells in 3D heart model | G13: Szilagyi
A14: Tong, WC; Ghouri, I; Taggart, MJ | B14: Computational modeling of inhibition of voltage-gated Ca channels: identification of different effects on uterine and cardiac action potentials | C14: FRONTIERS IN PHYSIOLOGY | D14: WOS:000347125900001 | E14: Example | F14: of AVN models
A15: Balakrishnan, M; Chakravarthy, VS; Guhathakurta, S | B15: Simulation of Cardiac Arrhythmias Using a 2D Heterogeneous Whole Heart Model | C15: FRONTIERS IN PHYSIOLOGY | D15: WOS:000366809300001 | E15: Example | F15: of AVN models
A16: Bartos, DC; Grandi, E; Ripplinger, CM | B16: Ion Channels in the Heart | C16: COMPREHENSIVE PHYSIOLOGY | D16: WOS:000357596400017 | E16: Biological reference | F16: ion channel scaled according to mRNA
A17: Khori, V; Alizadeh, AM; Moheimani, HR; Zahedi, M; Najafi, SA; Shakiba, D; Nayebpour, M | B17: Acute effects of simvastatin to terminate fast reentrant tachycardia through increasing wavelength of atrioventricular nodal reentrant tachycardia circuit | C17: FUNDAMENTAL & CLINICAL PHARMACOLOGY | D17: WOS:000347832900005 | E17: Biological reference | F17: terminating reentry
A18: Arevalo, HJ; Boyle, PM; Trayanova, NA | B18: Computational rabbit models to investigate the initiation, perpetuation, and termination of ventricular arrhythmia | C18: PROGRESS IN BIOPHYSICS & MOLECULAR BIOLOGY | D18: WOS:000380597800011 | E18: Example | F18: of AVN models | G18: Boyle
A19: Clerx, M; Collins, P; de Lange, E; Volders, PGA | B19: Myokit: A simple interface to cardiac cellular electrophysiology | C19: PROGRESS IN BIOPHYSICS & MOLECULAR BIOLOGY | D19: WOS:000374611200010 | E19: Example | F19: of post-CellML modeling paper
A20: Gemmell, P; Burrage, K; Rodriguez, B; Quinn, TA | B20: Rabbit-specific computational modelling of ventricular cell electrophysiology: Using populations of models to explore variability in the response to ischemia | C20: PROGRESS IN BIOPHYSICS & MOLECULAR BIOLOGY | D20: WOS:000380597800010 | E20: Example | F20: of AVN models
A21: Das, PN; Mehrotra, P; Mishra, A; Bairagi, N; Chatterjee, S | B21: Calcium dynamics in cardiac excitatory and non-excitatory cells and the role of gap junction | C21: MATHEMATICAL BIOSCIENCES | D21: WOS:000404199700006 | E21: Example | F21: of AVN models
A22: George, SA; Faye, NR; Murillo-Berlioz, A; Lee, KB; Trachiotis, GD; Efimov, IR | B22: At the Atrioventricular Crossroads: Dual Pathway Electrophysiology in the Atrioventricular Node and its Underlying Heterogeneities | C22: ARRHYTHMIA & ELECTROPHYSIOLOGY REVIEW | D22: WOS:000424589700007 | E22: Biological reference | F22: ion channel properties of AVN
A23: Hulsmans, M; Clauss, S; Xiao, L; Aguirre, AD; King, KR; Hanley, A; Hucker, WJ; Wulfers, EM; Seemann, G; Courties, G; Iwamoto, Y; Sun, Y; Savol, AJ; Sager, HB; Lavine, KJ; Fishbein, GA; Capen, DE; Da Silva, N; Miquerol, L; Wakimoto, H; Seidman, CE; Seidman, JG; Sadreyev, RI; Naxerova, K; Mitchell, RN; Brown, D; Libby, P; Weissleder, R; Swirski, FK; Kohl, P; Vinegoni, C; Milan, DJ; Ellinor, PT; Nahrendorf, M | B23: Macrophages Facilitate Electrical Conduction in the Heart | C23: CELL | D23: WOS:000399560600014 | E23: Simulation | F23: AVN-cell model adapted to mouse | G23: Nahrendorf + Seemann + X
A24: Kharche, SR; Vigmond, E; Efimov, IR; Dobrzynski, H | B24: Computational assessment of the functional role of sinoatrial node exit pathways in the human heart | C24: PLOS ONE | D24: WOS:000409282800023 | E24: Example | F24: of model with simple SAN anatomy
A25: Ai, WW; Patel, ND; Roop, PS; Malik, A; Andalam, S; Yip, E; Allen, N; Trew, ML | B25: A Parametric Computational Model of the Action Potential of Pacemaker Cells | C25: IEEE TRANSACTIONS ON BIOMEDICAL ENGINEERING | D25: WOS:000418722000014 | E25: Example | F25: of animal AVN model
A26: Ni, HB; Morotti, S; Grandi, E | B26: A Heart for Diversity: Simulating Variability in Cardiac Arrhythmia Research | C26: FRONTIERS IN PHYSIOLOGY | D26: WOS:000439407200001 | E26: Example | F26: of AVN models
A27: Ryzhii, M; Ryzhii, E | B27: Development of Simplified Model of Atrioventricular Node with Dual Pathway | C27: PROCEEDINGS 2018 IEEE INTERNATIONAL CONFERENCE ON BIOINFORMATICS AND BIOMEDICINE (BIBM) | D27: WOS:000458654000493 | E27: Example | F27: of complicated AVN models
A28: Winkelmann, B; Zgierski-Johnston, CM; Wulfers, EM; Timmer, J; Seemann, G | B28: Computational Mechanistic Investigation of Chronotropic Effects on Murine Sinus Node Cells | C28: 2018 COMPUTING IN CARDIOLOGY CONFERENCE (CINC) | D28: WOS:000482598700093 | E28: Simulation | F28: mouse-adapted AVN and atrial cells in 1D ring model of SAN | G28: Seemann
A29: Clerx, M; Beattie, KA; Gavaghan, DJ; Mirams, GR | B29: Four Ways to Fit an Ion Channel Model | C29: BIOPHYSICAL JOURNAL | D29: WOS:000503173400018 | E29: Example | F29: of full-AP models

Sheet: Statistics
A1: Search performed on | B1: 2020-07-20
A2: Database | B2: Web of Science
A3: #articles Citing Inada 2009 | B3: 52
A4: of those: #articles by co-authors of Inada 2009 | B4: 23
A5: Remaining | B5: of:=[.B3]-[.B4] -> 29 | C5: Percent
A6: #Example | B6: of:=COUNTIF([$Notes.$E$2:.$E$29];"Example") -> 16 | C6: of:=[.B6]/SUM([.B$6:.B$9]) -> 0.571428571428571
A7: #Biological Reference | B7: of:=COUNTIF([$Notes.$E$2:.$E$29];"Biological reference") -> 5 | C7: of:=[.B7]/SUM([.B$6:.B$9]) -> 0.178571428571429
A8: #Technical Reference | B8: of:=COUNTIF([$Notes.$E$2:.$E$29];"Technical reference") -> 1 | C8: of:=[.B8]/SUM([.B$6:.B$9]) -> 0.0357142857142857
A9: #Simulation | B9: of:=COUNTIF([$Notes.$E$2:.$E$29];"Simulation") -> 6 | C9: of:=[.B9]/SUM([.B$6:.B$9]) -> 0.214285714285714
A10: #Simulations (unique) | B10: 3 | C10: of:=[.B10]/[.B5] -> 0.103448275862069