Sheet: Sheet1
B1: Sum | C1: Type | D1: Sandve2013 | E1: Stodden2013 | F1: Waltemath2014 | G1: Topalidou2015 | H1: Lewis2016 | I1: Medley2016 | J1: Waltemath2016 | K1: Medley2018 | L1: Stodden2018 | M1: Kirouac2019 | N1: Papin2020 | O1: Mulugeta2018 | P1: Hellerstein2019
A2: Exp. Notebook (offline) | B2: of:=COUNTIF([.D2:.P2];"x") -> 2 | C2: Bio/Model | D2: x | J2: x
A3: No manual data manipulation | B3: of:=COUNTIF([.D3:.P3];"x") -> 1 | C3: Bio/Model | D3: x
A4: use VMs/Docker | B4: of:=COUNTIF([.D4:.P4];"x") -> 3 | C4: SE | D4: x | H4: x | J4: x
A5: Version control | B5: of:=COUNTIF([.D5:.P5];"x") -> 5 | C5: SE | D5: x | H5: x | K5: x | O5: x | P5: x
A6: Record intermediate results | B6: of:=COUNTIF([.D6:.P6];"x") -> 2 | C6: Bio/Model | D6: x | J6: x
A7: Random seeds | B7: of:=COUNTIF([.D7:.P7];"x") -> 2 | C7: Bio/Model | D7: x | O7: x
A8: Publish simulation results | B8: of:=COUNTIF([.D8:.P8];"x") -> 5 | C8: Bio/Model | D8: x | I8: x | J8: x | L8: x | M8: x
A9: Hierarchical analysis output | B9: of:=COUNTIF([.D9:.P9];"x") -> 1 | C9: Bio/Model | D9: x
A10: Jupyter notebook/knitr | B10: of:=COUNTIF([.D10:.P10];"x") -> 8 | C10: Bio/Model | D10: x | E10: x | G10: x | H10: x | J10: x | K10: x | O10: x | P10: x
A11: Publish executable scripts | B11: of:=COUNTIF([.D11:.P11];"x") -> 8 | C11: Bio/Model | D11: x | H11: x | I11: x | J11: x | L11: x | M11: x | N11: x | O11: x
A12: Galaxy/KNIME | B12: of:=COUNTIF([.D12:.P12];"x") -> 4 | C12: Bio/Model | D12: x | E12: x | J12: x | K12: x
A13: Documentation (e.g. Sphinx) | B13: of:=COUNTIF([.D13:.P13];"x") -> 5 | C13: SE | E13: x | H13: x | J13: x | L13: x | O13: x
A14: Journal policy | B14: of:=COUNTIF([.D14:.P14];"x") -> 4 | C14: Journal | G14: x | I14: x | J14: x | O14: x
A15: Official code repository for journal | B15: of:=COUNTIF([.D15:.P15];"x") -> 1 | C15: Journal | G15: x
A16: Software design | B16: of:=COUNTIF([.D16:.P16];"x") -> 2 | C16: SE | H16: x | I16: x
A17: Publication checklists (e.g. MIRIAM/MIASE) | B17: of:=COUNTIF([.D17:.P17];"x") -> 2 | C17: Journal | H17: x | J17: x
A18: Stochastic repeatability | B18: of:=COUNTIF([.D18:.P18];"x") -> 2 | C18: Bio/Model | H18: x | I18: x
A19: Statement of key model properties | B19: of:=COUNTIF([.D19:.P19];"x") -> 1 | C19: Bio/Model | H19: x
A20: Modularity | B20: of:=COUNTIF([.D20:.P20];"x") -> 2 | C20: SE, MoDROGH | H20: x | P20: x
A21: “seal of approval”/badge | B21: of:=COUNTIF([.D21:.P21];"x") -> 4 | C21: Journal | H21: x | J21: x | M21: x | N21: x
A22: Record design choices | B22: of:=COUNTIF([.D22:.P22];"x") -> 1 | C22: SE | I22: x
A23: Record assumptions | B23: of:=COUNTIF([.D23:.P23];"x") -> 1 | C23: Bio/Model | E23: x
A24: Model databases | B24: of:=COUNTIF([.D24:.P24];"x") -> 3 | C24: Bio/Model | I24: x | J24: x | O24: x
A25: Use of open standards | B25: of:=COUNTIF([.D25:.P25];"x") -> 4 | C25: SE, MoDROGH | I25: x | J25: x | M25: x | O25: x
A26: Support wide variety of models (~hybrid) | B26: of:=COUNTIF([.D26:.P26];"x") -> 1 | C26: MoDROGH | I26: x
A27: Unit tests | B27: of:=COUNTIF([.D27:.P27];"x") -> 4 | C27: SE | I27: x | K27: x | O27: x | P27: x
A28: Long-term archival | B28: of:=COUNTIF([.D28:.P28];"x") -> 1 | C28: SE | I28: x
A29: Ensure determinism in parallel simulatiions | B29: of:=COUNTIF([.D29:.P29];"x") -> 1 | C29: SE | I29: x
A30: Model curation | B30: of:=COUNTIF([.D30:.P30];"x") -> 1 | C30: Bio/Model | J30: x
A31: Human-readable standards | B31: of:=COUNTIF([.D31:.P31];"x") -> 2 | C31: SE, MoDROGH | K31: x | P31: x
A32: Connect math and biology (e.g. through ontology) | B32: of:=COUNTIF([.D32:.P32];"x") -> 1 | C32: Bio/Model | K32: x
A33: True unit tests using temporal logic | B33: of:=COUNTIF([.D33:.P33];"x") -> 1 | C33: Bio/Model | K33: x
A34: Citing software versions | B34: of:=COUNTIF([.D34:.P34];"x") -> 2 | C34: SE | L34: x | N34: x
A35: Declarative language | B35: of:=COUNTIF([.D35:.P35];"x") -> 2 | C35: MoDROGH | O35: x | P35: x
A36: Oject-orientation | B36: of:=COUNTIF([.D36:.P36];"x") -> 2 | C36: SE, MoDROGH | O36: x | P36: x
A37: Hybrid languages | B37: of:=COUNTIF([.D37:.P37];"x") -> 1 | C37: MoDROGH | O37: x
A38: Split design data and test data | B38: of:=COUNTIF([.D38:.P38];"x") -> 1 | C38: ML | O38: x
A39: Continuous integration | B39: of:=COUNTIF([.D39:.P39];"x") -> 1 | C39: SE | O39: x
A40: Independent reviews for models | B40: of:=COUNTIF([.D40:.P40];"x") -> 2 | C40: Bio/Model | N40: x | O40: x
A41: use cases | B41: of:=COUNTIF([.D41:.P41];"x") -> 1 | C41: SE | P41: x
A42: dependency management | B42: of:=COUNTIF([.D42:.P42];"x") -> 1 | C42: SE | P42: x
A43: linters/static analysis | B43: of:=COUNTIF([.D43:.P43];"x") -> 1 | C43: SE | P43: x