Sheet: Modelia Association 2021-04-26
A1: Organization, head-quarter | B1: Contact | C1: Type
A2: Altair, Troy, MI, USA | C2: Company
A3: Ansys, Inc, Canonsburg, PA, USA | C3: Company | D3: acquired spin-off
A4: Austrian Institute of Technology, Vienna, Austria | B4: modelica@ait.ac.at | C4: Research Institute
A5: AVIC - Aviation Industry Corporation of China, Beijing, China | C5: Company
A6: BMW, Munich, Germany | C6: Company
A7: Dassault Systèmes AB, Lund, Sweden | B7: Dan.Henriksson@3ds.com | C7: Company
A8: Dassault Systèmes SA, Paris, France | B8: Modelica.info@3ds.com | C8: Company
A9: DLR - Institute of System Dynamics and Control, Oberpfaffenhofen, Germany | B9: Martin.Otter@dlr.de | C9: Research Institute
A10: ESI ITI GmbH, Dresden, Germany | B10: Info.ITI@esi-group.com | C10: Company | D10: acquired spin-off
A11: Global Crown Technology, Beijing, China | C11: Company
A12: IDA PELAB, Sweden, Linköping, Sweden | B12: peter.fritzson@liu.se | C12: University
A13: Institut für Thermodynamik, Universität Braunschweig, Braunschweig, Germany | B13: ift@tu-bs.de | C13: University
A14: Institute of Engineering Thermodynamics, Hamburg University of Technology, Hamburg, Germany | B14: schmitz@tuhh.de | C14: University
A15: Institute of Vehicle Engineering (iVH), Seoul, Korea | C15: Spin-Off
A16: Kompetenzzentrum - Das virtuelle Fahrzeug, Forschungsgesellschaft mbH, Graz, Austria | B16: info@v2c2.at | C16: Research Institute
A17: LTX Simulation GmbH, Munich, Germany | B17: info@ltx.de | C17: Spin-Off
A18: Maplesoft, Waterloo, ON, Canada | B18: modelica@maplesoft.com | C18: Company
A19: Metamorph, Nashville, USA | C19: Spin-Off
A20: Mitsubishi Electric Research Laboratories (MERL), Cambridge, Massachusetts, USA | B20: bortoff@merl.com | C20: Company
A21: Modelon AB, Lund, Sweden | B21: info@modelon.com | C21: Company
A22: National Instruments, Austin, USA | B22: jeannie.falcon@ni.com | C22: Company
A23: Robert Bosch GmbH, Stuttgart, Germany | C23: Company
A24: Siemens Industry Software, Lyon, France | C24: Company
A25: Suzhou Tongyuan Software & Control Technology Co., Ltd,, Suzhou, China | B25: zhoufl@tongyuan.cc | C25: Company
A26: Wolfram MathCore AB, Linköping, Sweden | B26: henrikt@wolfram.com | C26: Company
A27: XRG Simulation GmbH, Hamburg, Germany | B27: info@xrg-simulation.de | C27: Company
A28: Yuanda SimTek Co. Ltd., Nanjing, China | B28: info@cnydsimtek.com | C28: Company

Sheet: Sheet2
B1: Count MA | C1: Count MDG 1996
A2: Company | B2: of:=COUNTIF([$'Modelia Association 2021-04-26'.C$2:$'Modelia Association 2021-04-26'.C$28]; [.$A2]) -> 18 | C2: of:=COUNTIF([$'Modelica Design Group 1996'.D$2:.D$15]; [.$A2]) -> 5
A3: Spin-Off | B3: of:=COUNTIF([$'Modelia Association 2021-04-26'.C$2:$'Modelia Association 2021-04-26'.C$28]; [.$A3]) -> 3 | C3: of:=COUNTIF([$'Modelica Design Group 1996'.D$2:.D$15]; [.$A3]) -> 0
A4: Research Institute | B4: of:=COUNTIF([$'Modelia Association 2021-04-26'.C$2:$'Modelia Association 2021-04-26'.C$28]; [.$A4]) -> 3 | C4: of:=COUNTIF([$'Modelica Design Group 1996'.D$2:.D$15]; [.$A4]) -> 4
A5: University | B5: of:=COUNTIF([$'Modelia Association 2021-04-26'.C$2:$'Modelia Association 2021-04-26'.C$28]; [.$A5]) -> 3 | C5: of:=COUNTIF([$'Modelica Design Group 1996'.D$2:.D$15]; [.$A5]) -> 5

Sheet: Modelica Design Group 1996
A1: Name | B1: Affiliation | C1: Land | D1: Type
A2: Fabrice Boudaud | B2: Gaz de France | C2: Company | D2: Company
A3: Jan Broenink | B3: Univ. of Twente | C3: Netherlands | D3: University
A4: Dag Brück | B4: Dynasim AB | C4: Lund, Sweden | D4: Company
A5: Hilding Elmqvist | B5: Dynasim AB | C5: Lund, Sweden | D5: Company
A6: Thilo Ernst | B6: GMD-FIRST | C6: Berlin, Germany | D6: Research Institute
A7: Peter Fritzson | B7: Linköping University | C7: Sweden | D7: University
A8: Alexandre Jeandel | B8: Gaz de France | D8: Company
A9: Kaj Juslin | B9: VTT | C9: Finland | D9: Research Institute
A10: Sven Erik Mattsson | B10: Lund University | C10: Sweden | D10: University
A11: Bernt Nilsson | B11: Lund University | C11: Sweden | D11: University
A12: Martin Otter | B12: DLR Oberpfa enhofen | C12: Germany | D12: Research Institute
A13: Per Sahlin | B13: BrisData AB | C13: Stockholm, Sweden | D13: Company
A14: Hubertus Tummescheit | B14: GMD FIRST | C14: Berlin, Germany | D14: Research Institute
A15: Hans Vangheluwe | B15: University of Gent | C15: Belgium | D15: University